notebooks/notebooks/sparsity_kernel_search_results.csv
kernel,B,H,W,k,block,BLOCK_M,BLOCK_N,BLOCK_K,NUM_WARPS,NUM_STAGES,mode,keep_ratio,time_ms,torch_time_ms,speedup_vs_torch,mae,max,rel_l2
1x1@56,32,56,56,1,64-64-16/4x2,64,64,16,4,2,dense,1.0,0.69023681640625,0.11696127891540527,0.16945094224960294,8.088909089565277e-05,0.001953125,0.0003486883360892534
1x1@56,32,56,56,1,64-64-16/4x2,64,64,16,4,2,channel,1.0,0.6841753387451172,0.11696127891540527,0.17095219937323414,8.088909089565277e-05,0.001953125,0.0003486883360892534
1x1@56,32,56,56,1,64-64-16/4x2,64,64,16,4,2,channel,0.85,0.8629657745361328,0.11696127891540527,0.13553408763896238,0.06645882874727249,3.1640625,0.36366260051727295
1x1@56,32,56,56,1,64-64-16/4x2,64,64,16,4,2,channel,0.75,0.940052490234375,0.11696127891540527,0.12441994476951425,0.1073429137468338,3.1640625,0.46450579166412354
1x1@56,32,56,56,1,64-64-16/4x2,64,64,16,4,2,channel,0.65,0.8154521942138672,0.11696127891540527,0.14343119038162774,0.14941325783729553,3.1640625,0.5516571402549744
1x1@56,32,56,56,1,64-64-16/4x2,64,64,16,4,2,channel,0.5,0.7408844757080079,0.11696127891540527,0.15786709365671905,0.22017334401607513,3.212890625,0.6742751598358154
1x1@56,32,56,56,1,64-64-16/4x2,64,64,16,4,2,channel,0.35,0.7054131317138672,0.11696127891540527,0.16580536093967643,0.2928003668785095,3.212890625,0.7828121781349182
1x1@56,32,56,56,1,64-64-16/4x2,64,64,16,4,2,channel,0.25,0.6334668731689453,0.11696127891540527,0.18463677244920706,0.3376118838787079,3.212890625,0.8444278240203857
1x1@56,32,56,56,1,64-64-16/4x2,64,64,16,4,2,block,1.0,0.7143014526367187,0.11696127891540527,0.16374218263684498,8.088909089565277e-05,0.001953125,0.0003486883360892534
1x1@56,32,56,56,1,64-64-16/4x2,64,64,16,4,2,block,0.85,0.8867021179199219,0.11696127891540527,0.13190594287716367,0.05485542491078377,3.029296875,0.3359450399875641
1x1@56,32,56,56,1,64-64-16/4x2,64,64,16,4,2,block,0.75,0.8351538848876953,0.11696127891540527,0.14004757809530308,0.1112883910536766,3.046875,0.482300341129303
1x1@56,32,56,56,1,64-64-16/4x2,64,64,16,4,2,block,0.65,0.7940083312988281,0.11696127891540527,0.14730485097565865,0.1684514433145523,3.1640625,0.5962845087051392
1x1@56,32,56,56,1,64-64-16/4x2,64,64,16,4,2,block,0.5,0.756816635131836,0.11696127891540527,0.15454374743630053,0.22560101747512817,3.212890625,0.6915515065193176
1x1@56,32,56,56,1,64-64-16/4x2,64,64,16,4,2,block,0.35,0.7040819549560546,0.11696127891540527,0.16611884183667996,0.28343480825424194,3.212890625,0.7771689891815186
1x1@56,32,56,56,1,64-64-16/4x2,64,64,16,4,2,block,0.25,0.6745702362060547,0.11696127891540527,0.17338636162369636,0.34189572930336,3.212890625,0.8557457327842712
1x1@56,32,56,56,1,64-64-16/4x2,64,64,16,4,2,input,1.0,0.7057612609863281,0.11696127891540527,0.165723574501592,8.088909089565277e-05,0.001953125,0.0003486883360892534
1x1@56,32,56,56,1,64-64-16/4x2,64,64,16,4,2,input,0.85,0.8175405120849609,0.11696127891540527,0.14306481108455496,0.16350331902503967,1.26788330078125,0.35805007815361023
1x1@56,32,56,56,1,64-64-16/4x2,64,64,16,4,2,input,0.75,0.7958086395263672,0.11696127891540527,0.14697161240297146,0.21020495891571045,1.64990234375,0.45842787623405457
1x1@56,32,56,56,1,64-64-16/4x2,64,64,16,4,2,input,0.65,0.8011366271972656,0.11696127891540527,0.14599417246043056,0.24993591010570526,2.0040283203125,0.5442469120025635
1x1@56,32,56,56,1,64-64-16/4x2,64,64,16,4,2,input,0.5,0.7784652709960938,0.11696127891540527,0.15024598177096093,0.3080410361289978,2.17431640625,0.6694660782814026
1x1@56,32,56,56,1,64-64-16/4x2,64,64,16,4,2,input,0.35,0.7592755126953125,0.11696127891540527,0.15404326487523684,0.3579624593257904,2.418701171875,0.7770875096321106
1x1@56,32,56,56,1,64-64-16/4x2,64,64,16,4,2,input,0.25,0.7581696319580078,0.11696127891540527,0.15426795532992718,0.3860342800617218,2.68798828125,0.8376279473304749
1x1@56,32,56,56,1,64-64-32/4x2,64,64,32,4,2,dense,1.0,0.7052902221679688,0.11696127891540527,0.16583425551524275,8.088909089565277e-05,0.001953125,0.0003486883360892534
1x1@56,32,56,56,1,64-64-32/4x2,64,64,32,4,2,channel,1.0,0.6900736236572266,0.11696127891540527,0.16949101502465522,8.088909089565277e-05,0.001953125,0.0003486883360892534
1x1@56,32,56,56,1,64-64-32/4x2,64,64,32,4,2,channel,0.85,0.8724275207519532,0.11696127891540527,0.13406417855158362,0.06645882874727249,3.1640625,0.36366260051727295
1x1@56,32,56,56,1,64-64-32/4x2,64,64,32,4,2,channel,0.75,0.8160870361328125,0.11696127891540527,0.14331961388536335,0.1073429137468338,3.1640625,0.46450579166412354
1x1@56,32,56,56,1,64-64-32/4x2,64,64,32,4,2,channel,0.65,0.8055193328857422,0.11696127891540527,0.14519984082367826,0.14941325783729553,3.1640625,0.5516571402549744
1x1@56,32,56,56,1,64-64-32/4x2,64,64,32,4,2,channel,0.5,0.7534783935546875,0.11696127891540527,0.15522844439323158,0.22017334401607513,3.212890625,0.6742751598358154
1x1@56,32,56,56,1,64-64-32/4x2,64,64,32,4,2,channel,0.35,0.7136255645751953,0.11696127891540527,0.16389726590726833,0.2928003668785095,3.212890625,0.7828121781349182
1x1@56,32,56,56,1,64-64-32/4x2,64,64,32,4,2,channel,0.25,0.6519398498535156,0.11696127891540527,0.17940501557265645,0.3376118838787079,3.212890625,0.8444278240203857
1x1@56,32,56,56,1,64-64-32/4x2,64,64,32,4,2,block,1.0,0.7304806518554687,0.11696127891540527,0.16011550561717952,8.088909089565277e-05,0.001953125,0.0003486883360892534
1x1@56,32,56,56,1,64-64-32/4x2,64,64,32,4,2,block,0.85,0.8833433532714844,0.11696127891540527,0.13240749305718577,0.05485542491078377,3.029296875,0.3359450399875641
1x1@56,32,56,56,1,64-64-32/4x2,64,64,32,4,2,block,0.75,0.8514150238037109,0.11696127891540527,0.1373728154254065,0.1112883910536766,3.046875,0.482300341129303
1x1@56,32,56,56,1,64-64-32/4x2,64,64,32,4,2,block,0.65,0.8218624114990234,0.11696127891540527,0.1423124811147836,0.1684514433145523,3.1640625,0.5962845087051392
1x1@56,32,56,56,1,64-64-32/4x2,64,64,32,4,2,block,0.5,0.7736115264892578,0.11696127891540527,0.1511886456063932,0.22560101747512817,3.212890625,0.6915515065193176
1x1@56,32,56,56,1,64-64-32/4x2,64,64,32,4,2,block,0.35,0.7693740844726562,0.11696127891540527,0.15202133952246752,0.28343480825424194,3.212890625,0.7771689891815186
1x1@56,32,56,56,1,64-64-32/4x2,64,64,32,4,2,block,0.25,0.7069696044921875,0.11696127891540527,0.1654403218642164,0.34189572930336,3.212890625,0.8557457327842712
1x1@56,32,56,56,1,64-64-32/4x2,64,64,32,4,2,input,1.0,0.7497318267822266,0.11696127891540527,0.156004153401612,8.088909089565277e-05,0.001953125,0.0003486883360892534
1x1@56,32,56,56,1,64-64-32/4x2,64,64,32,4,2,input,0.85,0.8520275115966797,0.11696127891540527,0.1372740637168189,0.16350331902503967,1.26788330078125,0.35805007815361023
1x1@56,32,56,56,1,64-64-32/4x2,64,64,32,4,2,input,0.75,0.8095340728759766,0.11696127891540527,0.1444797480850743,0.21020495891571045,1.64990234375,0.45842787623405457
1x1@56,32,56,56,1,64-64-32/4x2,64,64,32,4,2,input,0.65,0.8223538970947266,0.11696127891540527,0.14222742705861166,0.24993591010570526,2.0040283203125,0.5442469120025635
1x1@56,32,56,56,1,64-64-32/4x2,64,64,32,4,2,input,0.5,0.8143462371826172,0.11696127891540527,0.14362598311997443,0.3080410361289978,2.17431640625,0.6694660782814026
1x1@56,32,56,56,1,64-64-32/4x2,64,64,32,4,2,input,0.35,0.7777279663085938,0.11696127891540527,0.15038841855019053,0.3579624593257904,2.418701171875,0.7770875096321106
1x1@56,32,56,56,1,64-64-32/4x2,64,64,32,4,2,input,0.25,0.7390412902832031,0.11696127891540527,0.15826081770151884,0.3860342800617218,2.68798828125,0.8376279473304749
1x1@56,32,56,56,1,64-64-64/4x2,64,64,64,4,2,dense,1.0,0.713276138305664,0.11696127891540527,0.16397755740608166,8.088909089565277e-05,0.001953125,0.0003486883360892534
1x1@56,32,56,56,1,64-64-64/4x2,64,64,64,4,2,channel,1.0,0.6853209686279297,0.11696127891540527,0.17066642386496886,8.088909089565277e-05,0.001953125,0.0003486883360892534
1x1@56,32,56,56,1,64-64-64/4x2,64,64,64,4,2,channel,0.85,0.8536678314208984,0.11696127891540527,0.13701029207194976,0.06645882874727249,3.1640625,0.36366260051727295
1x1@56,32,56,56,1,64-64-64/4x2,64,64,64,4,2,channel,0.75,0.8126668548583984,0.11696127891540527,0.14392278732197705,0.1073429137468338,3.1640625,0.46450579166412354
1x1@56,32,56,56,1,64-64-64/4x2,64,64,64,4,2,channel,0.65,0.8234566497802734,0.11696127891540527,0.14203695962211801,0.14941325783729553,3.1640625,0.5516571402549744
1x1@56,32,56,56,1,64-64-64/4x2,64,64,64,4,2,channel,0.5,0.7435462188720703,0.11696127891540527,0.15730196179711708,0.22017334401607513,3.212890625,0.6742751598358154
1x1@56,32,56,56,1,64-64-64/4x2,64,64,64,4,2,channel,0.35,0.7296377563476563,0.11696127891540527,0.16030047499306738,0.2928003668785095,3.212890625,0.7828121781349182
1x1@56,32,56,56,1,64-64-64/4x2,64,64,64,4,2,channel,0.25,0.653311996459961,0.11696127891540527,0.179028212476079,0.3376118838787079,3.212890625,0.8444278240203857
1x1@56,32,56,56,1,64-64-64/4x2,64,64,64,4,2,block,1.0,0.6992441558837891,0.11696127891540527,0.16726815366454584,8.088909089565277e-05,0.001953125,0.0003486883360892534
1x1@56,32,56,56,1,64-64-64/4x2,64,64,64,4,2,block,0.85,0.8617581176757813,0.11696127891540527,0.13572402338472608,0.05485542491078377,3.029296875,0.3359450399875641
1x1@56,32,56,56,1,64-64-64/4x2,64,64,64,4,2,block,0.75,0.8195481872558594,0.11696127891540527,0.1427143403330968,0.1112883910536766,3.046875,0.482300341129303
1x1@56,32,56,56,1,64-64-64/4x2,64,64,64,4,2,block,0.65,0.7737548828125,0.11696127891540527,0.15116063434748997,0.1684514433145523,3.1640625,0.5962845087051392
1x1@56,32,56,56,1,64-64-64/4x2,64,64,64,4,2,block,0.5,0.7287987518310547,0.11696127891540527,0.16048501540589694,0.22560101747512817,3.212890625,0.6915515065193176
1x1@56,32,56,56,1,64-64-64/4x2,64,64,64,4,2,block,0.35,0.6827417755126953,0.11696127891540527,0.1713111502918872,0.28343480825424194,3.212890625,0.7771689891815186
1x1@56,32,56,56,1,64-64-64/4x2,64,64,64,4,2,block,0.25,0.6667263793945313,0.11696127891540527,0.1754262056071943,0.34189572930336,3.212890625,0.8557457327842712
1x1@56,32,56,56,1,64-64-64/4x2,64,64,64,4,2,input,1.0,0.7125401306152344,0.11696127891540527,0.16414693557598845,8.088909089565277e-05,0.001953125,0.0003486883360892534
1x1@56,32,56,56,1,64-64-64/4x2,64,64,64,4,2,input,0.85,0.8197939300537109,0.11696127891540527,0.1426715600440494,0.16350331902503967,1.26788330078125,0.35805007815361023
1x1@56,32,56,56,1,64-64-64/4x2,64,64,64,4,2,input,0.75,0.7955865478515625,0.11696127891540527,0.14701264021023575,0.21020495891571045,1.64990234375,0.45842787623405457
1x1@56,32,56,56,1,64-64-64/4x2,64,64,64,4,2,input,0.65,0.7917158508300781,0.11696127891540527,0.14773138467895605,0.24993591010570526,2.0040283203125,0.5442469120025635
1x1@56,32,56,56,1,64-64-64/4x2,64,64,64,4,2,input,0.5,0.7754137420654297,0.11696127891540527,0.15083725315966354,0.3080410361289978,2.17431640625,0.6694660782814026
1x1@56,32,56,56,1,64-64-64/4x2,64,64,64,4,2,input,0.35,0.7585177612304688,0.11696127891540527,0.15419715251712826,0.3579624593257904,2.418701171875,0.7770875096321106
1x1@56,32,56,56,1,64-64-64/4x2,64,64,64,4,2,input,0.25,0.7653580474853515,0.11696127891540527,0.15281903587437465,0.3860342800617218,2.68798828125,0.8376279473304749
1x1@56,32,56,56,1,64-128-32/4x2,64,128,32,4,2,dense,1.0,0.710615005493164,0.11696127891540527,0.16459162557964083,8.088909089565277e-05,0.001953125,0.0003486883360892534
1x1@56,32,56,56,1,64-128-32/4x2,64,128,32,4,2,channel,1.0,0.7393228912353516,0.11696127891540527,0.158200537683842,8.088909089565277e-05,0.001953125,0.0003486883360892534
1x1@56,32,56,56,1,64-128-32/4x2,64,128,32,4,2,channel,0.85,0.918887710571289,0.11696127891540527,0.12728571464155106,0.06645882874727249,3.1640625,0.36366260051727295
1x1@56,32,56,56,1,64-128-32/4x2,64,128,32,4,2,channel,0.75,0.8909824371337891,0.11696127891540527,0.1312722608670708,0.1073429137468338,3.1640625,0.46450579166412354
1x1@56,32,56,56,1,64-128-32/4x2,64,128,32,4,2,channel,0.65,0.8681267547607422,0.11696127891540527,0.1347283426918919,0.14941325783729553,3.1640625,0.5516571402549744
1x1@56,32,56,56,1,64-128-32/4x2,64,128,32,4,2,channel,0.5,0.7766425323486328,0.11696127891540527,0.1505986010857588,0.22017334401607513,3.212890625,0.6742751598358154
1x1@56,32,56,56,1,64-128-32/4x2,64,128,32,4,2,channel,0.35,0.7016652679443359,0.11696127891540527,0.16669099107337312,0.2928003668785095,3.212890625,0.7828121781349182
1x1@56,32,56,56,1,64-128-32/4x2,64,128,32,4,2,channel,0.25,0.7013581085205078,0.11696127891540527,0.16676399330740083,0.3376118838787079,3.212890625,0.8444278240203857
1x1@56,32,56,56,1,64-128-32/4x2,64,128,32,4,2,block,1.0,0.7080544281005859,0.11696127891540527,0.1651868476116497,8.088909089565277e-05,0.001953125,0.0003486883360892534
1x1@56,32,56,56,1,64-128-32/4x2,64,128,32,4,2,block,0.85,0.8806988525390625,0.11696127891540527,0.13280507698880822,0.05485542491078377,3.029296875,0.3359450399875641
1x1@56,32,56,56,1,64-128-32/4x2,64,128,32,4,2,block,0.75,0.8388607788085938,0.11696127891540527,0.13942871316682787,0.1112883910536766,3.046875,0.482300341129303
1x1@56,32,56,56,1,64-128-32/4x2,64,128,32,4,2,block,0.65,0.8433625793457031,0.11696127891540527,0.13868445408871008,0.1684514433145523,3.1640625,0.5962845087051392
1x1@56,32,56,56,1,64-128-32/4x2,64,128,32,4,2,block,0.5,0.7388159942626953,0.11696127891540527,0.1583090780704163,0.22560101747512817,3.212890625,0.6915515065193176
1x1@56,32,56,56,1,64-128-32/4x2,64,128,32,4,2,block,0.35,0.7308070373535156,0.11696127891540527,0.16004399648224407,0.28343480825424194,3.212890625,0.7771689891815186
1x1@56,32,56,56,1,64-128-32/4x2,64,128,32,4,2,block,0.25,0.66482177734375,0.11696127891540527,0.17592877204281132,0.34189572930336,3.212890625,0.8557457327842712
1x1@56,32,56,56,1,64-128-32/4x2,64,128,32,4,2,input,1.0,0.7143628692626953,0.11696127891540527,0.16372810506811863,8.088909089565277e-05,0.001953125,0.0003486883360892534
1x1@56,32,56,56,1,64-128-32/4x2,64,128,32,4,2,input,0.85,0.810909423828125,0.11696127891540527,0.14423470177872247,0.16350331902503967,1.26788330078125,0.35805007815361023
1x1@56,32,56,56,1,64-128-32/4x2,64,128,32,4,2,input,0.75,0.8054374694824219,0.11696127891540527,0.1452145987081594,0.21020495891571045,1.64990234375,0.45842787623405457
1x1@56,32,56,56,1,64-128-32/4x2,64,128,32,4,2,input,0.65,0.7712358093261719,0.11696127891540527,0.15165436757610393,0.24993591010570526,2.0040283203125,0.5442469120025635
1x1@56,32,56,56,1,64-128-32/4x2,64,128,32,4,2,input,0.5,0.7587225341796875,0.11696127891540527,0.15415553597846013,0.3080410361289978,2.17431640625,0.6694660782814026
1x1@56,32,56,56,1,64-128-32/4x2,64,128,32,4,2,input,0.35,0.7457145690917969,0.11696127891540527,0.15684456729583812,0.3579624593257904,2.418701171875,0.7770875096321106
1x1@56,32,56,56,1,64-128-32/4x2,64,128,32,4,2,input,0.25,0.7494041442871093,0.11696127891540527,0.15607236736950234,0.3860342800617218,2.68798828125,0.8376279473304749
1x1@56,32,56,56,1,128-64-32/8x2,128,64,32,8,2,dense,1.0,0.6904377746582031,0.11696127891540527,0.16940162199744388,8.088909089565277e-05,0.001953125,0.0003486883360892534
1x1@56,32,56,56,1,128-64-32/8x2,128,64,32,8,2,channel,1.0,0.7280435180664062,0.11696127891540527,0.16065149405634432,8.088909089565277e-05,0.001953125,0.0003486883360892534
1x1@56,32,56,56,1,128-64-32/8x2,128,64,32,8,2,channel,0.85,0.8587468719482422,0.11696127891540527,0.13619994754688863,0.06645882874727249,3.1640625,0.36366260051727295
1x1@56,32,56,56,1,128-64-32/8x2,128,64,32,8,2,channel,0.75,0.8536883544921875,0.11696127891540527,0.13700699827981036,0.1073429137468338,3.1640625,0.46450579166412354
1x1@56,32,56,56,1,128-64-32/8x2,128,64,32,8,2,channel,0.65,0.787804183959961,0.11696127891540527,0.14846491208956267,0.14941325783729553,3.1640625,0.5516571402549744
1x1@56,32,56,56,1,128-64-32/8x2,128,64,32,8,2,channel,0.5,0.7316889953613281,0.11696127891540527,0.1598510838032306,0.22017334401607513,3.212890625,0.6742751598358154
1x1@56,32,56,56,1,128-64-32/8x2,128,64,32,8,2,channel,0.35,0.6911385345458985,0.11696127891540527,0.16922986213213073,0.2928003668785095,3.212890625,0.7828121781349182
1x1@56,32,56,56,1,128-64-32/8x2,128,64,32,8,2,channel,0.25,0.6382579040527344,0.11696127891540527,0.18325081158061404,0.3376118838787079,3.212890625,0.8444278240203857
1x1@56,32,56,56,1,128-64-32/8x2,128,64,32,8,2,block,1.0,0.7117209625244141,0.11696127891540527,0.16433586345490445,8.088909089565277e-05,0.001953125,0.0003486883360892534
1x1@56,32,56,56,1,128-64-32/8x2,128,64,32,8,2,block,0.85,0.9219232177734376,0.11696127891540527,0.12686661607013403,0.05485542491078377,3.029296875,0.3359450399875641
1x1@56,32,56,56,1,128-64-32/8x2,128,64,32,8,2,block,0.75,0.8930303955078125,0.11696127891540527,0.13097121834122616,0.1112883910536766,3.046875,0.482300341129303
1x1@56,32,56,56,1,128-64-32/8x2,128,64,32,8,2,block,0.65,0.8279449462890625,0.11696127891540527,0.14126697607085856,0.1684514433145523,3.1640625,0.5962845087051392
1x1@56,32,56,56,1,128-64-32/8x2,128,64,32,8,2,block,0.5,0.7330201721191406,0.11696127891540527,0.1595607915908692,0.22560101747512817,3.212890625,0.6915515065193176
1x1@56,32,56,56,1,128-64-32/8x2,128,64,32,8,2,block,0.35,0.6923673248291016,0.11696127891540527,0.16892951865438632,0.28343480825424194,3.212890625,0.7771689891815186
1x1@56,32,56,56,1,128-64-32/8x2,128,64,32,8,2,block,0.25,0.6565478515625,0.11696127891540527,0.17814585583831,0.34189572930336,3.212890625,0.8557457327842712
1x1@56,32,56,56,1,128-64-32/8x2,128,64,32,8,2,input,1.0,0.7072953796386718,0.11696127891540527,0.16536412124614186,8.088909089565277e-05,0.001953125,0.0003486883360892534
1x1@56,32,56,56,1,128-64-32/8x2,128,64,32,8,2,input,0.85,0.7886406707763672,0.11696127891540527,0.1483074399399973,0.16350331902503967,1.26788330078125,0.35805007815361023
1x1@56,32,56,56,1,128-64-32/8x2,128,64,32,8,2,input,0.75,0.7811277008056641,0.11696127891540527,0.14973387679731504,0.21020495891571045,1.64990234375,0.45842787623405457
1x1@56,32,56,56,1,128-64-32/8x2,128,64,32,8,2,input,0.65,0.7661772918701172,0.11696127891540527,0.15265563226224227,0.24993591010570526,2.0040283203125,0.5442469120025635
1x1@56,32,56,56,1,128-64-32/8x2,128,64,32,8,2,input,0.5,0.7557734680175782,0.11696127891540527,0.15475705864906722,0.3080410361289978,2.17431640625,0.6694660782814026
1x1@56,32,56,56,1,128-64-32/8x2,128,64,32,8,2,input,0.35,0.7413113403320313,0.11696127891540527,0.1577761900458971,0.3579624593257904,2.418701171875,0.7770875096321106
1x1@56,32,56,56,1,128-64-32/8x2,128,64,32,8,2,input,0.25,0.7395327758789062,0.11696127891540527,0.15815563924993223,0.3860342800617218,2.68798828125,0.8376279473304749
1x1@56,32,56,56,1,128-128-32/8x2,128,128,32,8,2,dense,1.0,0.6945382690429688,0.11696127891540527,0.168401489347118,8.088909089565277e-05,0.001953125,0.0003486883360892534
1x1@56,32,56,56,1,128-128-32/8x2,128,128,32,8,2,channel,1.0,0.6904402923583984,0.11696127891540527,0.1694010042720569,8.088909089565277e-05,0.001953125,0.0003486883360892534
1x1@56,32,56,56,1,128-128-32/8x2,128,128,32,8,2,channel,0.85,0.9301811218261719,0.11696127891540527,0.12574032752436626,0.06645882874727249,3.1640625,0.36366260051727295
1x1@56,32,56,56,1,128-128-32/8x2,128,128,32,8,2,channel,0.75,0.8208134460449219,0.11696127891540527,0.14249435054820503,0.1073429137468338,3.1640625,0.46450579166412354
1x1@56,32,56,56,1,128-128-32/8x2,128,128,32,8,2,channel,0.65,0.8434239959716797,0.11696127891540527,0.13867435533495606,0.14941325783729553,3.1640625,0.5516571402549744
1x1@56,32,56,56,1,128-128-32/8x2,128,128,32,8,2,channel,0.5,0.74102783203125,0.11696127891540527,0.15783655331109464,0.22017334401607513,3.212890625,0.6742751598358154
1x1@56,32,56,56,1,128-128-32/8x2,128,128,32,8,2,channel,0.35,0.7404134368896484,0.11696127891540527,0.15796752609831044,0.2928003668785095,3.212890625,0.7828121781349182
1x1@56,32,56,56,1,128-128-32/8x2,128,128,32,8,2,channel,0.25,0.6480076599121094,0.11696127891540527,0.18049366720644777,0.3376118838787079,3.212890625,0.8444278240203857
1x1@56,32,56,56,1,128-128-32/8x2,128,128,32,8,2,block,1.0,0.7103250885009765,0.11696127891540527,0.16465880314354753,8.088909089565277e-05,0.001953125,0.0003486883360892534
1x1@56,32,56,56,1,128-128-32/8x2,128,128,32,8,2,block,0.85,0.9388646697998047,0.11696127891540527,0.12457735675616069,0.05485542491078377,3.029296875,0.3359450399875641
1x1@56,32,56,56,1,128-128-32/8x2,128,128,32,8,2,block,0.75,0.8608972930908203,0.11696127891540527,0.13585973594537304,0.1112883910536766,3.046875,0.482300341129303
1x1@56,32,56,56,1,128-128-32/8x2,128,128,32,8,2,block,0.65,0.8406015777587891,0.11696127891540527,0.13913997071864567,0.1684514433145523,3.1640625,0.5962845087051392
1x1@56,32,56,56,1,128-128-32/8x2,128,128,32,8,2,block,0.5,0.7535206604003907,0.11696127891540527,0.1552197372441742,0.22560101747512817,3.212890625,0.6915515065193176
1x1@56,32,56,56,1,128-128-32/8x2,128,128,32,8,2,block,0.35,0.7495065307617188,0.11696127891540527,0.15605104707565157,0.28343480825424194,3.212890625,0.7771689891815186
1x1@56,32,56,56,1,128-128-32/8x2,128,128,32,8,2,block,0.25,0.6497689819335938,0.11696127891540527,0.18000440489995362,0.34189572930336,3.212890625,0.8557457327842712
1x1@56,32,56,56,1,128-128-32/8x2,128,128,32,8,2,input,1.0,0.7111679840087891,0.11696127891540527,0.16446364508158143,8.088909089565277e-05,0.001953125,0.0003486883360892534
1x1@56,32,56,56,1,128-128-32/8x2,128,128,32,8,2,input,0.85,0.8393523406982422,0.11696127891540527,0.13934705753975413,0.16350331902503967,1.26788330078125,0.35805007815361023
1x1@56,32,56,56,1,128-128-32/8x2,128,128,32,8,2,input,0.75,0.8033036804199218,0.11696127891540527,0.1456003274555701,0.21020495891571045,1.64990234375,0.45842787623405457
1x1@56,32,56,56,1,128-128-32/8x2,128,128,32,8,2,input,0.65,0.8153702545166016,0.11696127891540527,0.14344560433437278,0.24993591010570526,2.0040283203125,0.5442469120025635
1x1@56,32,56,56,1,128-128-32/8x2,128,128,32,8,2,input,0.5,0.7743660736083985,0.11696127891540527,0.1510413264496312,0.3080410361289978,2.17431640625,0.6694660782814026
1x1@56,32,56,56,1,128-128-32/8x2,128,128,32,8,2,input,0.35,0.7683891296386719,0.11696127891540527,0.15221620713245287,0.3579624593257904,2.418701171875,0.7770875096321106
1x1@56,32,56,56,1,128-128-32/8x2,128,128,32,8,2,input,0.25,0.7565977478027344,0.11696127891540527,0.15458845767791032,0.3860342800617218,2.68798828125,0.8376279473304749
1x1@56,32,56,56,1,128-128-64/8x2,128,128,64,8,2,dense,1.0,0.7438130950927735,0.11696127891540527,0.15724552268176598,8.088909089565277e-05,0.001953125,0.0003486883360892534
1x1@56,32,56,56,1,128-128-64/8x2,128,128,64,8,2,channel,1.0,0.6999654388427734,0.11696127891540527,0.1670957913418882,8.088909089565277e-05,0.001953125,0.0003486883360892534
1x1@56,32,56,56,1,128-128-64/8x2,128,128,64,8,2,channel,0.85,0.9057689666748047,0.11696127891540527,0.12912926277965261,0.06645882874727249,3.1640625,0.36366260051727295
1x1@56,32,56,56,1,128-128-64/8x2,128,128,64,8,2,channel,0.75,0.8385523223876953,0.11696127891540527,0.13948000117913875,0.1073429137468338,3.1640625,0.46450579166412354
1x1@56,32,56,56,1,128-128-64/8x2,128,128,64,8,2,channel,0.65,0.8463155364990235,0.11696127891540527,0.13820055744130869,0.14941325783729553,3.1640625,0.5516571402549744
1x1@56,32,56,56,1,128-128-64/8x2,128,128,64,8,2,channel,0.5,0.7584556579589844,0.11696127891540527,0.15420977836746558,0.22017334401607513,3.212890625,0.6742751598358154
1x1@56,32,56,56,1,128-128-64/8x2,128,128,64,8,2,channel,0.35,0.7410688018798828,0.11696127891540527,0.1578278273470796,0.2928003668785095,3.212890625,0.7828121781349182
1x1@56,32,56,56,1,128-128-64/8x2,128,128,64,8,2,channel,0.25,0.6830899047851563,0.11696127891540527,0.17122384344443156,0.3376118838787079,3.212890625,0.8444278240203857
1x1@56,32,56,56,1,128-128-64/8x2,128,128,64,8,2,block,1.0,0.6983065795898438,0.11696127891540527,0.16749273504497617,8.088909089565277e-05,0.001953125,0.0003486883360892534
1x1@56,32,56,56,1,128-128-64/8x2,128,128,64,8,2,block,0.85,0.9100287628173828,0.11696127891540527,0.1285248155819841,0.05485542491078377,3.029296875,0.3359450399875641
1x1@56,32,56,56,1,128-128-64/8x2,128,128,64,8,2,block,0.75,0.8367922973632812,0.11696127891540527,0.1397733694298434,0.1112883910536766,3.046875,0.482300341129303
1x1@56,32,56,56,1,128-128-64/8x2,128,128,64,8,2,block,0.65,0.8304230499267579,0.11696127891540527,0.14084541478674165,0.1684514433145523,3.1640625,0.5962845087051392
1x1@56,32,56,56,1,128-128-64/8x2,128,128,64,8,2,block,0.5,0.7595008087158203,0.11696127891540527,0.15399756994751043,0.22560101747512817,3.212890625,0.6915515065193176
1x1@56,32,56,56,1,128-128-64/8x2,128,128,64,8,2,block,0.35,0.7504486083984375,0.11696127891540527,0.15585514798277397,0.28343480825424194,3.212890625,0.7771689891815186
1x1@56,32,56,56,1,128-128-64/8x2,128,128,64,8,2,block,0.25,0.6800588989257812,0.11696127891540527,0.17198698392177048,0.34189572930336,3.212890625,0.8557457327842712
1x1@56,32,56,56,1,128-128-64/8x2,128,128,64,8,2,input,1.0,0.7013375854492188,0.11696127891540527,0.1667688732816017,8.088909089565277e-05,0.001953125,0.0003486883360892534
1x1@56,32,56,56,1,128-128-64/8x2,128,128,64,8,2,input,0.85,0.8142803192138672,0.11696127891540527,0.14363760999200312,0.16350331902503967,1.26788330078125,0.35805007815361023
1x1@56,32,56,56,1,128-128-64/8x2,128,128,64,8,2,input,0.75,0.7932723236083984,0.11696127891540527,0.1474415222043516,0.21020495891571045,1.64990234375,0.45842787623405457
1x1@56,32,56,56,1,128-128-64/8x2,128,128,64,8,2,input,0.65,0.8201420593261719,0.11696127891540527,0.1426109996254802,0.24993591010570526,2.0040283203125,0.5442469120025635
1x1@56,32,56,56,1,128-128-64/8x2,128,128,64,8,2,input,0.5,0.8040857696533203,0.11696127891540527,0.145458710164505,0.3080410361289978,2.17431640625,0.6694660782814026
1x1@56,32,56,56,1,128-128-64/8x2,128,128,64,8,2,input,0.35,0.8199372863769532,0.11696127891540527,0.14264661561156786,0.3579624593257904,2.418701171875,0.7770875096321106
1x1@56,32,56,56,1,128-128-64/8x2,128,128,64,8,2,input,0.25,0.790442886352539,0.11696127891540527,0.14796929788958885,0.3860342800617218,2.68798828125,0.8376279473304749
1x1@56,32,56,56,1,128-64-32/8x3,128,64,32,8,3,dense,1.0,0.7025049591064453,0.11696127891540527,0.16649174842007486,8.088909089565277e-05,0.001953125,0.0003486883360892534
1x1@56,32,56,56,1,128-64-32/8x3,128,64,32,8,3,channel,1.0,0.7034674835205078,0.11696127891540527,0.16626394489489657,8.088909089565277e-05,0.001953125,0.0003486883360892534
1x1@56,32,56,56,1,128-64-32/8x3,128,64,32,8,3,channel,0.85,0.8602214050292969,0.11696127891540527,0.1359664828514955,0.06645882874727249,3.1640625,0.36366260051727295
1x1@56,32,56,56,1,128-64-32/8x3,128,64,32,8,3,channel,0.75,0.8169062042236328,0.11696127891540527,0.14317589744169262,0.1073429137468338,3.1640625,0.46450579166412354
1x1@56,32,56,56,1,128-64-32/8x3,128,64,32,8,3,channel,0.65,0.7854694366455078,0.11696127891540527,0.1489062125891365,0.14941325783729553,3.1640625,0.5516571402549744
1x1@56,32,56,56,1,128-64-32/8x3,128,64,32,8,3,channel,0.5,0.7285555267333984,0.11696127891540527,0.1605385926311216,0.22017334401607513,3.212890625,0.6742751598358154
1x1@56,32,56,56,1,128-64-32/8x3,128,64,32,8,3,channel,0.35,0.7016448211669922,0.11696127891540527,0.16669584865013684,0.2928003668785095,3.212890625,0.7828121781349182
1x1@56,32,56,56,1,128-64-32/8x3,128,64,32,8,3,channel,0.25,0.6553600311279297,0.11696127891540527,0.17846873986822948,0.3376118838787079,3.212890625,0.8444278240203857
1x1@56,32,56,56,1,128-64-32/8x3,128,64,32,8,3,block,1.0,0.7108761596679688,0.11696127891540527,0.16453115964675866,8.088909089565277e-05,0.001953125,0.0003486883360892534
1x1@56,32,56,56,1,128-64-32/8x3,128,64,32,8,3,block,0.85,0.8870502471923828,0.11696127891540527,0.1318541754377515,0.05485542491078377,3.029296875,0.3359450399875641
1x1@56,32,56,56,1,128-64-32/8x3,128,64,32,8,3,block,0.75,0.844185562133789,0.11696127891540527,0.13854925286778227,0.1112883910536766,3.046875,0.482300341129303
1x1@56,32,56,56,1,128-64-32/8x3,128,64,32,8,3,block,0.65,0.788828125,0.11696127891540527,0.14827219670369293,0.1684514433145523,3.1640625,0.5962845087051392
1x1@56,32,56,56,1,128-64-32/8x3,128,64,32,8,3,block,0.5,0.7665248107910156,0.11696127891540527,0.15258642286439106,0.22560101747512817,3.212890625,0.6915515065193176
1x1@56,32,56,56,1,128-64-32/8x3,128,64,32,8,3,block,0.35,0.709570541381836,0.11696127891540527,0.1648338989491191,0.28343480825424194,3.212890625,0.7771689891815186
1x1@56,32,56,56,1,128-64-32/8x3,128,64,32,8,3,block,0.25,0.6601522827148437,0.11696127891540527,0.17717317954943332,0.34189572930336,3.212890625,0.8557457327842712
1x1@56,32,56,56,1,128-64-32/8x3,128,64,32,8,3,input,1.0,0.7040614318847657,0.11696127891540527,0.16612368412554718,8.088909089565277e-05,0.001953125,0.0003486883360892534
1x1@56,32,56,56,1,128-64-32/8x3,128,64,32,8,3,input,0.85,0.8039609527587891,0.11696127891540527,0.14548129298326376,0.16350331902503967,1.26788330078125,0.35805007815361023
1x1@56,32,56,56,1,128-64-32/8x3,128,64,32,8,3,input,0.75,0.7928217315673828,0.11696127891540527,0.14752531907037492,0.21020495891571045,1.64990234375,0.45842787623405457
1x1@56,32,56,56,1,128-64-32/8x3,128,64,32,8,3,input,0.65,0.7879443359375,0.11696127891540527,0.14843850457563626,0.24993591010570526,2.0040283203125,0.5442469120025635
1x1@56,32,56,56,1,128-64-32/8x3,128,64,32,8,3,input,0.5,0.7926956939697266,0.11696127891540527,0.14754877540670994,0.3080410361289978,2.17431640625,0.6694660782814026
1x1@56,32,56,56,1,128-64-32/8x3,128,64,32,8,3,input,0.35,0.7592550659179688,0.11696127891540527,0.15404741326815455,0.3579624593257904,2.418701171875,0.7770875096321106
1x1@56,32,56,56,1,128-64-32/8x3,128,64,32,8,3,input,0.25,0.7421542358398437,0.11696127891540527,0.15759699704879865,0.3860342800617218,2.68798828125,0.8376279473304749
1x1@56,32,56,56,1,64-128-32/4x3,64,128,32,4,3,dense,1.0,0.691404800415039,0.11696127891540527,0.1691646902728985,8.088909089565277e-05,0.001953125,0.0003486883360892534
1x1@56,32,56,56,1,64-128-32/4x3,64,128,32,4,3,channel,1.0,0.7271180725097657,0.11696127891540527,0.16085596457765722,8.088909089565277e-05,0.001953125,0.0003486883360892534
1x1@56,32,56,56,1,64-128-32/4x3,64,128,32,4,3,channel,0.85,0.8877670288085937,0.11696127891540527,0.13174771659674084,0.06645882874727249,3.1640625,0.36366260051727295
1x1@56,32,56,56,1,64-128-32/4x3,64,128,32,4,3,channel,0.75,0.8373452758789063,0.11696127891540527,0.13968106381520898,0.1073429137468338,3.1640625,0.46450579166412354
1x1@56,32,56,56,1,64-128-32/4x3,64,128,32,4,3,channel,0.65,0.8199167633056641,0.11696127891540527,0.14265018615286224,0.14941325783729553,3.1640625,0.5516571402549744
1x1@56,32,56,56,1,64-128-32/4x3,64,128,32,4,3,channel,0.5,0.7488716888427734,0.11696127891540527,0.1561833364219507,0.22017334401607513,3.212890625,0.6742751598358154
1x1@56,32,56,56,1,64-128-32/4x3,64,128,32,4,3,channel,0.35,0.7258528137207031,0.11696127891540527,0.16113635809423224,0.2928003668785095,3.212890625,0.7828121781349182
1x1@56,32,56,56,1,64-128-32/4x3,64,128,32,4,3,channel,0.25,0.6642073822021485,0.11696127891540527,0.17609150703448315,0.3376118838787079,3.212890625,0.8444278240203857
1x1@56,32,56,56,1,64-128-32/4x3,64,128,32,4,3,block,1.0,0.7104512023925781,0.11696127891540527,0.16462957416570786,8.088909089565277e-05,0.001953125,0.0003486883360892534
1x1@56,32,56,56,1,64-128-32/4x3,64,128,32,4,3,block,0.85,0.9722713470458985,0.11696127891540527,0.12029695133027901,0.05485542491078377,3.029296875,0.3359450399875641
1x1@56,32,56,56,1,64-128-32/4x3,64,128,32,4,3,block,0.75,0.833597412109375,0.11696127891540527,0.14030907152103653,0.1112883910536766,3.046875,0.482300341129303
1x1@56,32,56,56,1,64-128-32/4x3,64,128,32,4,3,block,0.65,0.8018739318847656,0.11696127891540527,0.14585993416757354,0.1684514433145523,3.1640625,0.5962845087051392
1x1@56,32,56,56,1,64-128-32/4x3,64,128,32,4,3,block,0.5,0.7559372711181641,0.11696127891540527,0.15472352453583743,0.22560101747512817,3.212890625,0.6915515065193176
1x1@56,32,56,56,1,64-128-32/4x3,64,128,32,4,3,block,0.35,0.7233740997314453,0.11696127891540527,0.16168850800550846,0.28343480825424194,3.212890625,0.7771689891815186
1x1@56,32,56,56,1,64-128-32/4x3,64,128,32,4,3,block,0.25,0.6645145416259766,0.11696127891540527,0.17601011202737107,0.34189572930336,3.212890625,0.8557457327842712
1x1@56,32,56,56,1,64-128-32/4x3,64,128,32,4,3,input,1.0,0.7141171264648437,0.11696127891540527,0.16378444736987177,8.088909089565277e-05,0.001953125,0.0003486883360892534
1x1@56,32,56,56,1,64-128-32/4x3,64,128,32,4,3,input,0.85,0.8154112243652344,0.11696127891540527,0.14343839699589006,0.16350331902503967,1.26788330078125,0.35805007815361023
1x1@56,32,56,56,1,64-128-32/4x3,64,128,32,4,3,input,0.75,0.8092057800292969,0.11696127891540527,0.14453836317280228,0.21020495891571045,1.64990234375,0.45842787623405457
1x1@56,32,56,56,1,64-128-32/4x3,64,128,32,4,3,input,0.65,0.7932723236083984,0.11696127891540527,0.1474415222043516,0.24993591010570526,2.0040283203125,0.5442469120025635
1x1@56,32,56,56,1,64-128-32/4x3,64,128,32,4,3,input,0.5,0.7788748931884766,0.11696127891540527,0.15016696511631208,0.3080410361289978,2.17431640625,0.6694660782814026
1x1@56,32,56,56,1,64-128-32/4x3,64,128,32,4,3,input,0.35,0.7614873504638672,0.11696127891540527,0.1535958264364565,0.3579624593257904,2.418701171875,0.7770875096321106
1x1@56,32,56,56,1,64-128-32/4x3,64,128,32,4,3,input,0.25,0.7567359924316406,0.11696127891540527,0.1545602166213482,0.3860342800617218,2.68798828125,0.8376279473304749
1x1@56,32,56,56,1,64-64-32/2x2,64,64,32,2,2,dense,1.0,0.7064749145507813,0.11696127891540527,0.16555616697271722,8.088909089565277e-05,0.001953125,0.0003486883360892534
1x1@56,32,56,56,1,64-64-32/2x2,64,64,32,2,2,channel,1.0,0.7048966217041016,0.11696127891540527,0.16592685411464883,8.088909089565277e-05,0.001953125,0.0003486883360892534
1x1@56,32,56,56,1,64-64-32/2x2,64,64,32,2,2,channel,0.85,0.8695763397216797,0.11696127891540527,0.13450375035829562,0.06645882874727249,3.1640625,0.36366260051727295
1x1@56,32,56,56,1,64-64-32/2x2,64,64,32,2,2,channel,0.75,0.8383692932128907,0.11696127891540527,0.13951045185251648,0.1073429137468338,3.1640625,0.46450579166412354
1x1@56,32,56,56,1,64-64-32/2x2,64,64,32,2,2,channel,0.65,0.8052735900878907,0.11696127891540527,0.14524415100045646,0.14941325783729553,3.1640625,0.5516571402549744
1x1@56,32,56,56,1,64-64-32/2x2,64,64,32,2,2,channel,0.5,0.7505945587158203,0.11696127891540527,0.15582484252951737,0.22017334401607513,3.212890625,0.6742751598358154
1x1@56,32,56,56,1,64-64-32/2x2,64,64,32,2,2,channel,0.35,0.6978765106201172,0.11696127891540527,0.16759595305977001,0.2928003668785095,3.212890625,0.7828121781349182
1x1@56,32,56,56,1,64-64-32/2x2,64,64,32,2,2,channel,0.25,0.6576537322998047,0.11696127891540527,0.17784629383367676,0.3376118838787079,3.212890625,0.8444278240203857
1x1@56,32,56,56,1,64-64-32/2x2,64,64,32,2,2,block,1.0,0.7136460876464844,0.11696127891540527,0.16389255254117477,8.088909089565277e-05,0.001953125,0.0003486883360892534
1x1@56,32,56,56,1,64-64-32/2x2,64,64,32,2,2,block,0.85,0.8868454742431641,0.11696127891540527,0.13188462061580716,0.05485542491078377,3.029296875,0.3359450399875641
1x1@56,32,56,56,1,64-64-32/2x2,64,64,32,2,2,block,0.75,0.8352934265136719,0.11696127891540527,0.14002418216503332,0.1112883910536766,3.046875,0.482300341129303
1x1@56,32,56,56,1,64-64-32/2x2,64,64,32,2,2,block,0.65,0.7968768310546875,0.11696127891540527,0.1467746009889683,0.1684514433145523,3.1640625,0.5962845087051392
1x1@56,32,56,56,1,64-64-32/2x2,64,64,32,2,2,block,0.5,0.747356185913086,0.11696127891540527,0.15650004792896344,0.22560101747512817,3.212890625,0.6915515065193176
1x1@56,32,56,56,1,64-64-32/2x2,64,64,32,2,2,block,0.35,0.7367430114746094,0.11696127891540527,0.15875451425226875,0.28343480825424194,3.212890625,0.7771689891815186
1x1@56,32,56,56,1,64-64-32/2x2,64,64,32,2,2,block,0.25,0.6577964782714844,0.11696127891540527,0.17780770006970645,0.34189572930336,3.212890625,0.8557457327842712
1x1@56,32,56,56,1,64-64-32/2x2,64,64,32,2,2,input,1.0,0.7039590454101563,0.11696127891540527,0.1661478457844926,8.088909089565277e-05,0.001953125,0.0003486883360892534
1x1@56,32,56,56,1,64-64-32/2x2,64,64,32,2,2,input,0.85,0.8119347381591797,0.11696127891540527,0.144052561638858,0.16350331902503967,1.26788330078125,0.35805007815361023
1x1@56,32,56,56,1,64-64-32/2x2,64,64,32,2,2,input,0.75,0.8085913848876953,0.11696127891540527,0.1446481883202972,0.21020495891571045,1.64990234375,0.45842787623405457
1x1@56,32,56,56,1,64-64-32/2x2,64,64,32,2,2,input,0.65,0.8033689880371093,0.11696127891540527,0.14558849128739654,0.24993591010570526,2.0040283203125,0.5442469120025635
1x1@56,32,56,56,1,64-64-32/2x2,64,64,32,2,2,input,0.5,0.7875174713134766,0.11696127891540527,0.14851896392892602,0.3080410361289978,2.17431640625,0.6694660782814026
1x1@56,32,56,56,1,64-64-32/2x2,64,64,32,2,2,input,0.35,0.7665248107910156,0.11696127891540527,0.15258642286439106,0.3579624593257904,2.418701171875,0.7770875096321106
1x1@56,32,56,56,1,64-64-32/2x2,64,64,32,2,2,input,0.25,0.7715795135498047,0.11696127891540527,0.1515868123264467,0.3860342800617218,2.68798828125,0.8376279473304749
3x3@56,16,56,56,3,64-64-16/4x2,64,64,16,4,2,dense,1.0,1.4560050964355469,0.31145984649658204,0.21391398097373998,7.887938409112394e-05,0.001953125,0.0003531323454808444
3x3@56,16,56,56,3,64-64-16/4x2,64,64,16,4,2,channel,1.0,1.4742118835449218,0.31145984649658204,0.21127210408020788,7.887938409112394e-05,0.001953125,0.0003531323454808444
3x3@56,16,56,56,3,64-64-16/4x2,64,64,16,4,2,channel,0.85,1.5311424255371093,0.31145984649658204,0.20341663930272527,0.06598103791475296,3.283203125,0.3755829632282257
3x3@56,16,56,56,3,64-64-16/4x2,64,64,16,4,2,channel,0.75,1.6911949157714843,0.31145984649658204,0.18416555276509994,0.1114378273487091,3.283203125,0.48904842138290405
3x3@56,16,56,56,3,64-64-16/4x2,64,64,16,4,2,channel,0.65,1.5408940124511719,0.31145984649658204,0.20212931193179753,0.1571718156337738,3.283203125,0.58188796043396
3x3@56,16,56,56,3,64-64-16/4x2,64,64,16,4,2,channel,0.5,1.1941478729248047,0.31145984649658204,0.2608218408778212,0.22452056407928467,3.283203125,0.6971522569656372
3x3@56,16,56,56,3,64-64-16/4x2,64,64,16,4,2,channel,0.35,1.0942873382568359,0.31145984649658204,0.28462345821594487,0.29229822754859924,3.283203125,0.7971453070640564
3x3@56,16,56,56,3,64-64-16/4x2,64,64,16,4,2,channel,0.25,1.1510784149169921,0.31145984649658204,0.2705809113091938,0.3390449583530426,3.283203125,0.8598080277442932
3x3@56,16,56,56,3,64-64-16/4x2,64,64,16,4,2,block,1.0,1.5395225524902343,0.31145984649658204,0.20230937571702623,7.887938409112394e-05,0.001953125,0.0003531323454808444
3x3@56,16,56,56,3,64-64-16/4x2,64,64,16,4,2,block,0.85,1.5177932739257813,0.31145984649658204,0.2052057100575952,0.0706055611371994,2.919921875,0.3918136954307556
3x3@56,16,56,56,3,64-64-16/4x2,64,64,16,4,2,block,0.75,1.6508895874023437,0.31145984649658204,0.18866182746155702,0.11305787414312363,3.283203125,0.4962484538555145
3x3@56,16,56,56,3,64-64-16/4x2,64,64,16,4,2,block,0.65,1.4447821044921876,0.31145984649658204,0.2155756536076795,0.1555105298757553,3.283203125,0.582270622253418
3x3@56,16,56,56,3,64-64-16/4x2,64,64,16,4,2,block,0.5,1.1944569396972655,0.31145984649658204,0.2607543529995492,0.22649677097797394,3.283203125,0.7033554315567017
3x3@56,16,56,56,3,64-64-16/4x2,64,64,16,4,2,block,0.35,1.0940121459960936,0.31145984649658204,0.2846950535571971,0.2975679337978363,3.283203125,0.8066952228546143
3x3@56,16,56,56,3,64-64-16/4x2,64,64,16,4,2,block,0.25,1.1083161926269531,0.31145984649658204,0.2810207489239634,0.3404467701911926,3.283203125,0.863337516784668
3x3@56,16,56,56,3,64-64-16/4x2,64,64,16,4,2,input,1.0,1.45413818359375,0.31145984649658204,0.21418861701770442,7.887938409112394e-05,0.001953125,0.0003531323454808444
3x3@56,16,56,56,3,64-64-16/4x2,64,64,16,4,2,input,0.85,1.3525401306152345,0.31145984649658204,0.23027771187455062,0.17663496732711792,1.3218994140625,0.38841795921325684
3x3@56,16,56,56,3,64-64-16/4x2,64,64,16,4,2,input,0.75,1.3325721740722656,0.31145984649658204,0.23372831322507528,0.22428882122039795,1.5341796875,0.4929824471473694
3x3@56,16,56,56,3,64-64-16/4x2,64,64,16,4,2,input,0.65,1.1600077056884766,0.31145984649658204,0.2684980840810255,0.26345711946487427,1.882080078125,0.5788899660110474
3x3@56,16,56,56,3,64-64-16/4x2,64,64,16,4,2,input,0.5,1.021091842651367,0.31145984649658204,0.3050262801902769,0.31860628724098206,2.2628173828125,0.6999634504318237
3x3@56,16,56,56,3,64-64-16/4x2,64,64,16,4,2,input,0.35,0.8968192291259766,0.31145984649658204,0.34729389868248595,0.36607131361961365,2.517578125,0.8041509389877319
3x3@56,16,56,56,3,64-64-16/4x2,64,64,16,4,2,input,0.25,0.8542803192138672,0.31145984649658204,0.36458740707405757,0.3918350338935852,2.566162109375,0.8607099056243896
3x3@56,16,56,56,3,64-64-32/4x2,64,64,32,4,2,dense,1.0,1.1722342681884765,0.31145984649658204,0.26569761262644154,7.887938409112394e-05,0.001953125,0.0003531323454808444
3x3@56,16,56,56,3,64-64-32/4x2,64,64,32,4,2,channel,1.0,1.1501158142089845,0.31145984649658204,0.27080737665605864,7.887938409112394e-05,0.001953125,0.0003531323454808444
3x3@56,16,56,56,3,64-64-32/4x2,64,64,32,4,2,channel,0.85,1.2783519744873046,0.31145984649658204,0.24364169861864218,0.06598103791475296,3.283203125,0.3755829632282257
3x3@56,16,56,56,3,64-64-32/4x2,64,64,32,4,2,channel,0.75,1.2853453063964844,0.31145984649658204,0.24231608809446845,0.1114378273487091,3.283203125,0.48904842138290405
3x3@56,16,56,56,3,64-64-32/4x2,64,64,32,4,2,channel,0.65,1.2045926666259765,0.31145984649658204,0.25856030434667227,0.1571718156337738,3.283203125,0.58188796043396
3x3@56,16,56,56,3,64-64-32/4x2,64,64,32,4,2,channel,0.5,1.0515046691894532,0.31145984649658204,0.29620395954748274,0.22452056407928467,3.283203125,0.6971522569656372
3x3@56,16,56,56,3,64-64-32/4x2,64,64,32,4,2,channel,0.35,0.9825894165039063,0.31145984649658204,0.31697862939005494,0.29229822754859924,3.283203125,0.7971453070640564
3x3@56,16,56,56,3,64-64-32/4x2,64,64,32,4,2,channel,0.25,0.9689702606201172,0.31145984649658204,0.32143385525295215,0.3390449583530426,3.283203125,0.8598080277442932
3x3@56,16,56,56,3,64-64-32/4x2,64,64,32,4,2,block,1.0,1.1508121490478516,0.31145984649658204,0.2706435161935637,7.887938409112394e-05,0.001953125,0.0003531323454808444
3x3@56,16,56,56,3,64-64-32/4x2,64,64,32,4,2,block,0.85,1.2773580932617188,0.31145984649658204,0.2438312702910685,0.0706055611371994,2.919921875,0.3918136954307556
3x3@56,16,56,56,3,64-64-32/4x2,64,64,32,4,2,block,0.75,1.2831129455566406,0.31145984649658204,0.24273766980151884,0.11305787414312363,3.283203125,0.4962484538555145
3x3@56,16,56,56,3,64-64-32/4x2,64,64,32,4,2,block,0.65,1.224089584350586,0.31145984649658204,0.25444203633332957,0.1555105298757553,3.283203125,0.582270622253418
3x3@56,16,56,56,3,64-64-32/4x2,64,64,32,4,2,block,0.5,1.0519347381591797,0.31145984649658204,0.2960828606550416,0.22649677097797394,3.283203125,0.7033554315567017
3x3@56,16,56,56,3,64-64-32/4x2,64,64,32,4,2,block,0.35,0.9627852630615235,0.31145984649658204,0.3234987680494641,0.2975679337978363,3.283203125,0.8066952228546143
3x3@56,16,56,56,3,64-64-32/4x2,64,64,32,4,2,block,0.25,0.9525247955322266,0.31145984649658204,0.3269834527746364,0.3404467701911926,3.283203125,0.863337516784668
3x3@56,16,56,56,3,64-64-32/4x2,64,64,32,4,2,input,1.0,1.150873565673828,0.31145984649658204,0.2706290732416159,7.887938409112394e-05,0.001953125,0.0003531323454808444
3x3@56,16,56,56,3,64-64-32/4x2,64,64,32,4,2,input,0.85,1.145714569091797,0.31145984649658204,0.2718476790807286,0.17663496732711792,1.3218994140625,0.38841795921325684
3x3@56,16,56,56,3,64-64-32/4x2,64,64,32,4,2,input,0.75,1.133465576171875,0.31145984649658204,0.2747854483137415,0.22428882122039795,1.5341796875,0.4929824471473694
3x3@56,16,56,56,3,64-64-32/4x2,64,64,32,4,2,input,0.65,0.9991577911376953,0.31145984649658204,0.31172238184915413,0.26345711946487427,1.882080078125,0.5788899660110474
3x3@56,16,56,56,3,64-64-32/4x2,64,64,32,4,2,input,0.5,0.932515869140625,0.31145984649658204,0.33399951336336275,0.31860628724098206,2.2628173828125,0.6999634504318237
3x3@56,16,56,56,3,64-64-32/4x2,64,64,32,4,2,input,0.35,0.8781024169921875,0.31145984649658204,0.35469649151341887,0.36607131361961365,2.517578125,0.8041509389877319
3x3@56,16,56,56,3,64-64-32/4x2,64,64,32,4,2,input,0.25,0.8370630645751953,0.31145984649658204,0.37208647672758816,0.3918350338935852,2.566162109375,0.8607099056243896
3x3@56,16,56,56,3,64-64-64/4x2,64,64,64,4,2,dense,1.0,1.0436812591552735,0.31145984649658204,0.29842429742263354,7.887938409112394e-05,0.001953125,0.0003531323454808444
3x3@56,16,56,56,3,64-64-64/4x2,64,64,64,4,2,channel,1.0,1.0479206085205077,0.31145984649658204,0.29721702575952996,7.887938409112394e-05,0.001953125,0.0003531323454808444
3x3@56,16,56,56,3,64-64-64/4x2,64,64,64,4,2,channel,0.85,1.2422605133056641,0.31145984649658204,0.25072023392886017,0.06598103791475296,3.283203125,0.3755829632282257
3x3@56,16,56,56,3,64-64-64/4x2,64,64,64,4,2,channel,0.75,1.1765350341796874,0.31145984649658204,0.2647263680624185,0.1114378273487091,3.283203125,0.48904842138290405
3x3@56,16,56,56,3,64-64-64/4x2,64,64,64,4,2,channel,0.65,1.1876761627197265,0.31145984649658204,0.2622430728788499,0.1571718156337738,3.283203125,0.58188796043396
3x3@56,16,56,56,3,64-64-64/4x2,64,64,64,4,2,channel,0.5,0.9859686279296875,0.31145984649658204,0.31589224816470857,0.22452056407928467,3.283203125,0.6971522569656372
3x3@56,16,56,56,3,64-64-64/4x2,64,64,64,4,2,channel,0.35,0.949797134399414,0.31145984649658204,0.32792249546375785,0.29229822754859924,3.283203125,0.7971453070640564
3x3@56,16,56,56,3,64-64-64/4x2,64,64,64,4,2,channel,0.25,0.9116633605957031,0.31145984649658204,0.3416390961385863,0.3390449583530426,3.283203125,0.8598080277442932
3x3@56,16,56,56,3,64-64-64/4x2,64,64,64,4,2,block,1.0,1.0447846221923829,0.31145984649658204,0.2981091412343079,7.887938409112394e-05,0.001953125,0.0003531323454808444
3x3@56,16,56,56,3,64-64-64/4x2,64,64,64,4,2,block,0.85,1.2304998779296874,0.31145984649658204,0.25311651962177545,0.0706055611371994,2.919921875,0.3918136954307556
3x3@56,16,56,56,3,64-64-64/4x2,64,64,64,4,2,block,0.75,1.180569610595703,0.31145984649658204,0.2638216702354575,0.11305787414312363,3.283203125,0.4962484538555145
3x3@56,16,56,56,3,64-64-64/4x2,64,64,64,4,2,block,0.65,1.1671756744384765,0.31145984649658204,0.26684915845802226,0.1555105298757553,3.283203125,0.582270622253418
3x3@56,16,56,56,3,64-64-64/4x2,64,64,64,4,2,block,0.5,0.9966796875,0.31145984649658204,0.31249743563835,0.22649677097797394,3.283203125,0.7033554315567017
3x3@56,16,56,56,3,64-64-64/4x2,64,64,64,4,2,block,0.35,0.9582592010498047,0.31145984649658204,0.3250267215335553,0.2975679337978363,3.283203125,0.8066952228546143
3x3@56,16,56,56,3,64-64-64/4x2,64,64,64,4,2,block,0.25,0.91430908203125,0.31145984649658204,0.34065050059946433,0.3404467701911926,3.283203125,0.863337516784668
3x3@56,16,56,56,3,64-64-64/4x2,64,64,64,4,2,input,1.0,1.0442752075195312,0.31145984649658204,0.2982545637910845,7.887938409112394e-05,0.001953125,0.0003531323454808444
3x3@56,16,56,56,3,64-64-64/4x2,64,64,64,4,2,input,0.85,1.0909241485595702,0.31145984649658204,0.2855009185632439,0.17663496732711792,1.3218994140625,0.38841795921325684
3x3@56,16,56,56,3,64-64-64/4x2,64,64,64,4,2,input,0.75,1.035325469970703,0.31145984649658204,0.3008327869161719,0.22428882122039795,1.5341796875,0.4929824471473694
3x3@56,16,56,56,3,64-64-64/4x2,64,64,64,4,2,input,0.65,1.2065408325195313,0.31145984649658204,0.25814281464986405,0.26345711946487427,1.882080078125,0.5788899660110474
3x3@56,16,56,56,3,64-64-64/4x2,64,64,64,4,2,input,0.5,1.0095410919189454,0.31145984649658204,0.30851626445889013,0.31860628724098206,2.2628173828125,0.6999634504318237
3x3@56,16,56,56,3,64-64-64/4x2,64,64,64,4,2,input,0.35,0.9401344299316406,0.31145984649658204,0.3312928838477163,0.36607131361961365,2.517578125,0.8041509389877319
3x3@56,16,56,56,3,64-64-64/4x2,64,64,64,4,2,input,0.25,0.8738572692871094,0.31145984649658204,0.35641958640530647,0.3918350338935852,2.566162109375,0.8607099056243896
3x3@56,16,56,56,3,64-128-32/4x2,64,128,32,4,2,dense,1.0,1.035120620727539,0.31145984649658204,0.3008923213969703,7.887938409112394e-05,0.001953125,0.0003531323454808444
3x3@56,16,56,56,3,64-128-32/4x2,64,128,32,4,2,channel,1.0,1.00853759765625,0.31145984649658204,0.3088232379441148,7.887938409112394e-05,0.001953125,0.0003531323454808444
3x3@56,16,56,56,3,64-128-32/4x2,64,128,32,4,2,channel,0.85,1.2093215942382813,0.31145984649658204,0.2575492308915248,0.06598103791475296,3.283203125,0.3755829632282257
3x3@56,16,56,56,3,64-128-32/4x2,64,128,32,4,2,channel,0.75,1.1445657348632812,0.31145984649658204,0.2721205405767158,0.1114378273487091,3.283203125,0.48904842138290405
3x3@56,16,56,56,3,64-128-32/4x2,64,128,32,4,2,channel,0.65,1.149501419067383,0.31145984649658204,0.27095212004981833,0.1571718156337738,3.283203125,0.58188796043396
3x3@56,16,56,56,3,64-128-32/4x2,64,128,32,4,2,channel,0.5,1.117122573852539,0.31145984649658204,0.27880543620425935,0.22452056407928467,3.283203125,0.6971522569656372
3x3@56,16,56,56,3,64-128-32/4x2,64,128,32,4,2,channel,0.35,1.0990796661376954,0.31145984649658204,0.2833824117509982,0.29229822754859924,3.283203125,0.7971453070640564
3x3@56,16,56,56,3,64-128-32/4x2,64,128,32,4,2,channel,0.25,1.0313113403320313,0.31145984649658204,0.3020037056863036,0.3390449583530426,3.283203125,0.8598080277442932
3x3@56,16,56,56,3,64-128-32/4x2,64,128,32,4,2,block,1.0,1.0738687896728516,0.31145984649658204,0.29003529061633926,7.887938409112394e-05,0.001953125,0.0003531323454808444
3x3@56,16,56,56,3,64-128-32/4x2,64,128,32,4,2,block,0.85,1.2901171875,0.31145984649658204,0.24141981016478944,0.0706055611371994,2.919921875,0.3918136954307556
3x3@56,16,56,56,3,64-128-32/4x2,64,128,32,4,2,block,0.75,1.217085418701172,0.31145984649658204,0.2559063166075561,0.11305787414312363,3.283203125,0.4962484538555145
3x3@56,16,56,56,3,64-128-32/4x2,64,128,32,4,2,block,0.65,1.2139705657958983,0.31145984649658204,0.2565629309903276,0.1555105298757553,3.283203125,0.582270622253418
3x3@56,16,56,56,3,64-128-32/4x2,64,128,32,4,2,block,0.5,1.098487014770508,0.31145984649658204,0.28353530110836234,0.22649677097797394,3.283203125,0.7033554315567017
3x3@56,16,56,56,3,64-128-32/4x2,64,128,32,4,2,block,0.35,1.0694656372070312,0.31145984649658204,0.29122940996026453,0.2975679337978363,3.283203125,0.8066952228546143
3x3@56,16,56,56,3,64-128-32/4x2,64,128,32,4,2,block,0.25,0.9789440155029296,0.31145984649658204,0.31815899741372894,0.3404467701911926,3.283203125,0.863337516784668
3x3@56,16,56,56,3,64-128-32/4x2,64,128,32,4,2,input,1.0,1.0104627227783203,0.31145984649658204,0.30823487049597126,7.887938409112394e-05,0.001953125,0.0003531323454808444
3x3@56,16,56,56,3,64-128-32/4x2,64,128,32,4,2,input,0.85,1.0608230590820313,0.31145984649658204,0.29360207042077263,0.17663496732711792,1.3218994140625,0.38841795921325684
3x3@56,16,56,56,3,64-128-32/4x2,64,128,32,4,2,input,0.75,1.0061663818359374,0.31145984649658204,0.3095510366071521,0.22428882122039795,1.5341796875,0.4929824471473694
3x3@56,16,56,56,3,64-128-32/4x2,64,128,32,4,2,input,0.65,1.0012467193603516,0.31145984649658204,0.31107202697808467,0.26345711946487427,1.882080078125,0.5788899660110474
3x3@56,16,56,56,3,64-128-32/4x2,64,128,32,4,2,input,0.5,0.9324140930175782,0.31145984649658204,0.334035970529577,0.31860628724098206,2.2628173828125,0.6999634504318237
3x3@56,16,56,56,3,64-128-32/4x2,64,128,32,4,2,input,0.35,0.8880524444580078,0.31145984649658204,0.350722357041279,0.36607131361961365,2.517578125,0.8041509389877319
3x3@56,16,56,56,3,64-128-32/4x2,64,128,32,4,2,input,0.25,0.8539750671386719,0.31145984649658204,0.364717728282348,0.3918350338935852,2.566162109375,0.8607099056243896
3x3@56,16,56,56,3,128-64-32/8x2,128,64,32,8,2,dense,1.0,1.1611775970458984,0.31145984649658204,0.26822757112172463,7.887938409112394e-05,0.001953125,0.0003531323454808444
3x3@56,16,56,56,3,128-64-32/8x2,128,64,32,8,2,channel,1.0,1.1472691345214843,0.31145984649658204,0.2714793217430095,7.887938409112394e-05,0.001953125,0.0003531323454808444
3x3@56,16,56,56,3,128-64-32/8x2,128,64,32,8,2,channel,0.85,1.4916607666015624,0.31145984649658204,0.20880072297280988,0.06598103791475296,3.283203125,0.3755829632282257
3x3@56,16,56,56,3,128-64-32/8x2,128,64,32,8,2,channel,0.75,1.3834445190429687,0.31145984649658204,0.22513360110172104,0.1114378273487091,3.283203125,0.48904842138290405
3x3@56,16,56,56,3,128-64-32/8x2,128,64,32,8,2,channel,0.65,1.3280870056152343,0.31145984649658204,0.2345176522168431,0.1571718156337738,3.283203125,0.58188796043396
3x3@56,16,56,56,3,128-64-32/8x2,128,64,32,8,2,channel,0.5,1.0248191833496094,0.31145984649658204,0.3039168777838245,0.22452056407928467,3.283203125,0.6971522569656372
3x3@56,16,56,56,3,128-64-32/8x2,128,64,32,8,2,channel,0.35,0.9979692840576172,0.31145984649658204,0.312093619986204,0.29229822754859924,3.283203125,0.7971453070640564
3x3@56,16,56,56,3,128-64-32/8x2,128,64,32,8,2,channel,0.25,0.9818105316162109,0.31145984649658204,0.3172300932481049,0.3390449583530426,3.283203125,0.8598080277442932
3x3@56,16,56,56,3,128-64-32/8x2,128,64,32,8,2,block,1.0,1.217269744873047,0.31145984649658204,0.25586756576215175,7.887938409112394e-05,0.001953125,0.0003531323454808444
3x3@56,16,56,56,3,128-64-32/8x2,128,64,32,8,2,block,0.85,1.405726776123047,0.31145984649658204,0.2215649952657081,0.0706055611371994,2.919921875,0.3918136954307556
3x3@56,16,56,56,3,128-64-32/8x2,128,64,32,8,2,block,0.75,1.306972198486328,0.31145984649658204,0.23830640533693048,0.11305787414312363,3.283203125,0.4962484538555145
3x3@56,16,56,56,3,128-64-32/8x2,128,64,32,8,2,block,0.65,1.236792984008789,0.31145984649658204,0.25182860068226964,0.1555105298757553,3.283203125,0.582270622253418
3x3@56,16,56,56,3,128-64-32/8x2,128,64,32,8,2,block,0.5,1.024163818359375,0.31145984649658204,0.30411135495443953,0.22649677097797394,3.283203125,0.7033554315567017
3x3@56,16,56,56,3,128-64-32/8x2,128,64,32,8,2,block,0.35,0.9749094390869141,0.31145984649658204,0.31947567026152784,0.2975679337978363,3.283203125,0.8066952228546143
3x3@56,16,56,56,3,128-64-32/8x2,128,64,32,8,2,block,0.25,0.9667174530029297,0.31145984649658204,0.3221829144897399,0.3404467701911926,3.283203125,0.863337516784668
3x3@56,16,56,56,3,128-64-32/8x2,128,64,32,8,2,input,1.0,1.1673600006103515,0.31145984649658204,0.2668070229695518,7.887938409112394e-05,0.001953125,0.0003531323454808444
3x3@56,16,56,56,3,128-64-32/8x2,128,64,32,8,2,input,0.85,1.134551010131836,0.31145984649658204,0.274522558893487,0.17663496732711792,1.3218994140625,0.38841795921325684
3x3@56,16,56,56,3,128-64-32/8x2,128,64,32,8,2,input,0.75,1.1084595489501954,0.31145984649658204,0.28098440470070446,0.22428882122039795,1.5341796875,0.4929824471473694
3x3@56,16,56,56,3,128-64-32/8x2,128,64,32,8,2,input,0.65,1.010688018798828,0.31145984649658204,0.3081661607770344,0.26345711946487427,1.882080078125,0.5788899660110474
3x3@56,16,56,56,3,128-64-32/8x2,128,64,32,8,2,input,0.5,0.941322250366211,0.31145984649658204,0.3308748373635193,0.31860628724098206,2.2628173828125,0.6999634504318237
3x3@56,16,56,56,3,128-64-32/8x2,128,64,32,8,2,input,0.35,0.8670406341552734,0.31145984649658204,0.3592217414354821,0.36607131361961365,2.517578125,0.8041509389877319
3x3@56,16,56,56,3,128-64-32/8x2,128,64,32,8,2,input,0.25,0.8190393829345703,0.31145984649658204,0.38027456674994015,0.3918350338935852,2.566162109375,0.8607099056243896
3x3@56,16,56,56,3,128-128-32/8x2,128,128,32,8,2,dense,1.0,1.012510757446289,0.31145984649658204,0.3076113949466894,7.887938409112394e-05,0.001953125,0.0003531323454808444
3x3@56,16,56,56,3,128-128-32/8x2,128,128,32,8,2,channel,1.0,1.012838363647461,0.31145984649658204,0.30751189693777436,7.887938409112394e-05,0.001953125,0.0003531323454808444
3x3@56,16,56,56,3,128-128-32/8x2,128,128,32,8,2,channel,0.85,1.3454777526855468,0.31145984649658204,0.2314864336291807,0.06598103791475296,3.283203125,0.3755829632282257
3x3@56,16,56,56,3,128-128-32/8x2,128,128,32,8,2,channel,0.75,1.1448729705810547,0.31145984649658204,0.27204751487713746,0.1114378273487091,3.283203125,0.48904842138290405
3x3@56,16,56,56,3,128-128-32/8x2,128,128,32,8,2,channel,0.65,1.264021759033203,0.31145984649658204,0.2464038647046745,0.1571718156337738,3.283203125,0.58188796043396
3x3@56,16,56,56,3,128-128-32/8x2,128,128,32,8,2,channel,0.5,1.0559487915039063,0.31145984649658204,0.2949573397901179,0.22452056407928467,3.283203125,0.6971522569656372
3x3@56,16,56,56,3,128-128-32/8x2,128,128,32,8,2,channel,0.35,1.1208934020996093,0.31145984649658204,0.27786749918696,0.29229822754859924,3.283203125,0.7971453070640564
3x3@56,16,56,56,3,128-128-32/8x2,128,128,32,8,2,channel,0.25,0.9769369506835938,0.31145984649658204,0.3188126380915818,0.3390449583530426,3.283203125,0.8598080277442932
3x3@56,16,56,56,3,128-128-32/8x2,128,128,32,8,2,block,1.0,1.0127769470214845,0.31145984649658204,0.30753054501543164,7.887938409112394e-05,0.001953125,0.0003531323454808444
3x3@56,16,56,56,3,128-128-32/8x2,128,128,32,8,2,block,0.85,1.3404978942871093,0.31145984649658204,0.23234638996745283,0.0706055611371994,2.919921875,0.3918136954307556
3x3@56,16,56,56,3,128-128-32/8x2,128,128,32,8,2,block,0.75,1.1440787506103516,0.31145984649658204,0.27223637038134146,0.11305787414312363,3.283203125,0.4962484538555145
3x3@56,16,56,56,3,128-128-32/8x2,128,128,32,8,2,block,0.65,1.2924493408203126,0.31145984649658204,0.24098418147584777,0.1555105298757553,3.283203125,0.582270622253418
3x3@56,16,56,56,3,128-128-32/8x2,128,128,32,8,2,block,0.5,1.0590412902832032,0.31145984649658204,0.2940960370046508,0.22649677097797394,3.283203125,0.7033554315567017
3x3@56,16,56,56,3,128-128-32/8x2,128,128,32,8,2,block,0.35,1.1169388580322266,0.31145984649658204,0.2788512945509821,0.2975679337978363,3.283203125,0.8066952228546143
3x3@56,16,56,56,3,128-128-32/8x2,128,128,32,8,2,block,0.25,0.9847398376464844,0.31145984649658204,0.31628642874951324,0.3404467701911926,3.283203125,0.863337516784668
3x3@56,16,56,56,3,128-128-32/8x2,128,128,32,8,2,input,1.0,1.013987808227539,0.31145984649658204,0.3071633050904399,7.887938409112394e-05,0.001953125,0.0003531323454808444
3x3@56,16,56,56,3,128-128-32/8x2,128,128,32,8,2,input,0.85,1.119989776611328,0.31145984649658204,0.27809168708570137,0.17663496732711792,1.3218994140625,0.38841795921325684
3x3@56,16,56,56,3,128-128-32/8x2,128,128,32,8,2,input,0.75,1.006960678100586,0.31145984649658204,0.3093068610028386,0.22428882122039795,1.5341796875,0.4929824471473694
3x3@56,16,56,56,3,128-128-32/8x2,128,128,32,8,2,input,0.65,0.9966572570800781,0.31145984649658204,0.31250446859642667,0.26345711946487427,1.882080078125,0.5788899660110474
3x3@56,16,56,56,3,128-128-32/8x2,128,128,32,8,2,input,0.5,0.8938291168212891,0.31145984649658204,0.3484556954289227,0.31860628724098206,2.2628173828125,0.6999634504318237
3x3@56,16,56,56,3,128-128-32/8x2,128,128,32,8,2,input,0.35,0.8856326293945312,0.31145984649658204,0.35168063614538875,0.36607131361961365,2.517578125,0.8041509389877319
3x3@56,16,56,56,3,128-128-32/8x2,128,128,32,8,2,input,0.25,0.8182579040527344,0.31145984649658204,0.3806377487512902,0.3918350338935852,2.566162109375,0.8607099056243896
3x3@56,16,56,56,3,128-128-64/8x2,128,128,64,8,2,dense,1.0,1.0854195404052733,0.31145984649658204,0.2869488109457559,7.887938409112394e-05,0.001953125,0.0003531323454808444
3x3@56,16,56,56,3,128-128-64/8x2,128,128,64,8,2,channel,1.0,1.1087462615966797,0.31145984649658204,0.2809117444491366,7.887938409112394e-05,0.001953125,0.0003531323454808444
3x3@56,16,56,56,3,128-128-64/8x2,128,128,64,8,2,channel,0.85,1.29902587890625,0.31145984649658204,0.23976415832363868,0.06598103791475296,3.283203125,0.3755829632282257
3x3@56,16,56,56,3,128-128-64/8x2,128,128,64,8,2,channel,0.75,1.17946044921875,0.31145984649658204,0.26406976741177424,0.1114378273487091,3.283203125,0.48904842138290405
3x3@56,16,56,56,3,128-128-64/8x2,128,128,64,8,2,channel,0.65,1.2510617828369142,0.31145984649658204,0.2489564070851194,0.1571718156337738,3.283203125,0.58188796043396
3x3@56,16,56,56,3,128-128-64/8x2,128,128,64,8,2,channel,0.5,1.1542937469482422,0.31145984649658204,0.26982719721044085,0.22452056407928467,3.283203125,0.6971522569656372
3x3@56,16,56,56,3,128-128-64/8x2,128,128,64,8,2,channel,0.35,1.1684454345703126,0.31145984649658204,0.26655917108454374,0.29229822754859924,3.283203125,0.7971453070640564
3x3@56,16,56,56,3,128-128-64/8x2,128,128,64,8,2,channel,0.25,1.0126541137695313,0.31145984649658204,0.3075678479566882,0.3390449583530426,3.283203125,0.8598080277442932
3x3@56,16,56,56,3,128-128-64/8x2,128,128,64,8,2,block,1.0,1.0420223999023437,0.31145984649658204,0.2988993773317843,7.887938409112394e-05,0.001953125,0.0003531323454808444
3x3@56,16,56,56,3,128-128-64/8x2,128,128,64,8,2,block,0.85,1.2989234924316406,0.31145984649658204,0.23978305751751075,0.0706055611371994,2.919921875,0.3918136954307556
3x3@56,16,56,56,3,128-128-64/8x2,128,128,64,8,2,block,0.75,1.2007424163818359,0.31145984649658204,0.2593893929683066,0.11305787414312363,3.283203125,0.4962484538555145
3x3@56,16,56,56,3,128-128-64/8x2,128,128,64,8,2,block,0.65,1.240412139892578,0.31145984649658204,0.2510938392811562,0.1555105298757553,3.283203125,0.582270622253418
3x3@56,16,56,56,3,128-128-64/8x2,128,128,64,8,2,block,0.5,1.0896166229248048,0.31145984649658204,0.28584351591530016,0.22649677097797394,3.283203125,0.7033554315567017
3x3@56,16,56,56,3,128-128-64/8x2,128,128,64,8,2,block,0.35,1.1085785675048827,0.31145984649658204,0.2809542378196936,0.2975679337978363,3.283203125,0.8066952228546143
3x3@56,16,56,56,3,128-128-64/8x2,128,128,64,8,2,block,0.25,1.0087193298339843,0.31145984649658204,0.30876759995056535,0.3404467701911926,3.283203125,0.863337516784668
3x3@56,16,56,56,3,128-128-64/8x2,128,128,64,8,2,input,1.0,1.0419181060791016,0.31145984649658204,0.2989292965343058,7.887938409112394e-05,0.001953125,0.0003531323454808444
3x3@56,16,56,56,3,128-128-64/8x2,128,128,64,8,2,input,0.85,1.0916454315185546,0.31145984649658204,0.2853122795222252,0.17663496732711792,1.3218994140625,0.38841795921325684
3x3@56,16,56,56,3,128-128-64/8x2,128,128,64,8,2,input,0.75,1.0258841705322266,0.31145984649658204,0.3036013766885567,0.22428882122039795,1.5341796875,0.4929824471473694
3x3@56,16,56,56,3,128-128-64/8x2,128,128,64,8,2,input,0.65,0.9963884735107422,0.31145984649658204,0.31258876911649075,0.26345711946487427,1.882080078125,0.5788899660110474
3x3@56,16,56,56,3,128-128-64/8x2,128,128,64,8,2,input,0.5,0.9243647766113281,0.31145984649658204,0.33694473694505883,0.31860628724098206,2.2628173828125,0.6999634504318237
3x3@56,16,56,56,3,128-128-64/8x2,128,128,64,8,2,input,0.35,0.883609619140625,0.31145984649658204,0.352485803402072,0.36607131361961365,2.517578125,0.8041509389877319
3x3@56,16,56,56,3,128-128-64/8x2,128,128,64,8,2,input,0.25,0.8335769653320313,0.31145984649658204,0.37364257825013314,0.3918350338935852,2.566162109375,0.8607099056243896
3x3@56,16,56,56,3,128-64-32/8x3,128,64,32,8,3,dense,1.0,1.1292063903808593,0.31145984649658204,0.2758218950492591,7.887938409112394e-05,0.001953125,0.0003531323454808444
3x3@56,16,56,56,3,128-64-32/8x3,128,64,32,8,3,channel,1.0,1.1275878143310547,0.31145984649658204,0.2762178187260357,7.887938409112394e-05,0.001953125,0.0003531323454808444
3x3@56,16,56,56,3,128-64-32/8x3,128,64,32,8,3,channel,0.85,1.2635955047607421,0.31145984649658204,0.2464869852125313,0.06598103791475296,3.283203125,0.3755829632282257
3x3@56,16,56,56,3,128-64-32/8x3,128,64,32,8,3,channel,0.75,1.2565715026855468,0.31145984649658204,0.24786480182857043,0.1114378273487091,3.283203125,0.48904842138290405
3x3@56,16,56,56,3,128-64-32/8x3,128,64,32,8,3,channel,0.65,1.1922227478027343,0.31145984649658204,0.26124299932256984,0.1571718156337738,3.283203125,0.58188796043396
3x3@56,16,56,56,3,128-64-32/8x3,128,64,32,8,3,channel,0.5,1.023078384399414,0.31145984649658204,0.30443400158377976,0.22452056407928467,3.283203125,0.6971522569656372
3x3@56,16,56,56,3,128-64-32/8x3,128,64,32,8,3,channel,0.35,0.9618022155761718,0.31145984649658204,0.3238294125887417,0.29229822754859924,3.283203125,0.7971453070640564
3x3@56,16,56,56,3,128-64-32/8x3,128,64,32,8,3,channel,0.25,0.9313689422607422,0.31145984649658204,0.33441081440891235,0.3390449583530426,3.283203125,0.8598080277442932
3x3@56,16,56,56,3,128-64-32/8x3,128,64,32,8,3,block,1.0,1.126456298828125,0.31145984649658204,0.2764952771098177,7.887938409112394e-05,0.001953125,0.0003531323454808444
3x3@56,16,56,56,3,128-64-32/8x3,128,64,32,8,3,block,0.85,1.2600121307373047,0.31145984649658204,0.24718797454301428,0.0706055611371994,2.919921875,0.3918136954307556
3x3@56,16,56,56,3,128-64-32/8x3,128,64,32,8,3,block,0.75,1.2571033477783202,0.31145984649658204,0.24775993719770556,0.11305787414312363,3.283203125,0.4962484538555145
3x3@56,16,56,56,3,128-64-32/8x3,128,64,32,8,3,block,0.65,1.2022354888916016,0.31145984649658204,0.25906725377382744,0.1555105298757553,3.283203125,0.582270622253418
3x3@56,16,56,56,3,128-64-32/8x3,128,64,32,8,3,block,0.5,1.0245938873291016,0.31145984649658204,0.30398370549378506,0.22649677097797394,3.283203125,0.7033554315567017
3x3@56,16,56,56,3,128-64-32/8x3,128,64,32,8,3,block,0.35,0.9591385650634766,0.31145984649658204,0.32472872830003385,0.2975679337978363,3.283203125,0.8066952228546143
3x3@56,16,56,56,3,128-64-32/8x3,128,64,32,8,3,block,0.25,0.9340070343017578,0.31145984649658204,0.33346627494023345,0.3404467701911926,3.283203125,0.863337516784668
3x3@56,16,56,56,3,128-64-32/8x3,128,64,32,8,3,input,1.0,1.1255347442626953,0.31145984649658204,0.2767216632664771,7.887938409112394e-05,0.001953125,0.0003531323454808444
3x3@56,16,56,56,3,128-64-32/8x3,128,64,32,8,3,input,0.85,1.1126367950439453,0.31145984649658204,0.2799294863192804,0.17663496732711792,1.3218994140625,0.38841795921325684
3x3@56,16,56,56,3,128-64-32/8x3,128,64,32,8,3,input,0.75,1.103851547241211,0.31145984649658204,0.28215736733349217,0.22428882122039795,1.5341796875,0.4929824471473694
3x3@56,16,56,56,3,128-64-32/8x3,128,64,32,8,3,input,0.65,0.9956192016601563,0.31145984649658204,0.3128302929244784,0.26345711946487427,1.882080078125,0.5788899660110474
3x3@56,16,56,56,3,128-64-32/8x3,128,64,32,8,3,input,0.5,0.9204736328125,0.31145984649658204,0.33836911280654386,0.31860628724098206,2.2628173828125,0.6999634504318237
3x3@56,16,56,56,3,128-64-32/8x3,128,64,32,8,3,input,0.35,0.8673280334472656,0.31145984649658204,0.3591027091084092,0.36607131361961365,2.517578125,0.8041509389877319
3x3@56,16,56,56,3,128-64-32/8x3,128,64,32,8,3,input,0.25,0.821370849609375,0.31145984649658204,0.37919515483743443,0.3918350338935852,2.566162109375,0.8607099056243896
3x3@56,16,56,56,3,64-128-32/4x3,64,128,32,4,3,dense,1.0,0.9785951995849609,0.31145984649658204,0.3182724037770444,7.887938409112394e-05,0.001953125,0.0003531323454808444
3x3@56,16,56,56,3,64-128-32/4x3,64,128,32,4,3,channel,1.0,0.9771622467041016,0.31145984649658204,0.3187391321626617,7.887938409112394e-05,0.001953125,0.0003531323454808444
3x3@56,16,56,56,3,64-128-32/4x3,64,128,32,4,3,channel,0.85,1.1945568084716798,0.31145984649658204,0.2607325531006473,0.06598103791475296,3.283203125,0.3755829632282257
3x3@56,16,56,56,3,64-128-32/4x3,64,128,32,4,3,channel,0.75,1.1161804962158204,0.31145984649658204,0.2790407533123203,0.1114378273487091,3.283203125,0.48904842138290405
3x3@56,16,56,56,3,64-128-32/4x3,64,128,32,4,3,channel,0.65,1.146204147338867,0.31145984649658204,0.27173156476505156,0.1571718156337738,3.283203125,0.58188796043396
3x3@56,16,56,56,3,64-128-32/4x3,64,128,32,4,3,channel,0.5,1.0318438720703125,0.31145984649658204,0.3018478424179258,0.22452056407928467,3.283203125,0.6971522569656372
3x3@56,16,56,56,3,64-128-32/4x3,64,128,32,4,3,channel,0.35,1.0203340911865235,0.31145984649658204,0.3052528080624969,0.29229822754859924,3.283203125,0.7971453070640564
3x3@56,16,56,56,3,64-128-32/4x3,64,128,32,4,3,channel,0.25,0.9555558776855468,0.31145984649658204,0.32594624110415116,0.3390449583530426,3.283203125,0.8598080277442932
3x3@56,16,56,56,3,64-128-32/4x3,64,128,32,4,3,block,1.0,0.9776742553710938,0.31145984649658204,0.3185722082641543,7.887938409112394e-05,0.001953125,0.0003531323454808444
3x3@56,16,56,56,3,64-128-32/4x3,64,128,32,4,3,block,0.85,1.1937177276611328,0.31145984649658204,0.2609158256423229,0.0706055611371994,2.919921875,0.3918136954307556
3x3@56,16,56,56,3,64-128-32/4x3,64,128,32,4,3,block,0.75,1.1150540924072265,0.31145984649658204,0.27932263431650134,0.11305787414312363,3.283203125,0.4962484538555145
3x3@56,16,56,56,3,64-128-32/4x3,64,128,32,4,3,block,0.65,1.1243488311767578,0.31145984649658204,0.27701353695596787,0.1555105298757553,3.283203125,0.582270622253418
3x3@56,16,56,56,3,64-128-32/4x3,64,128,32,4,3,block,0.5,1.0637312316894532,0.31145984649658204,0.2927993812891168,0.22649677097797394,3.283203125,0.7033554315567017
3x3@56,16,56,56,3,64-128-32/4x3,64,128,32,4,3,block,0.35,1.0767565155029297,0.31145984649658204,0.2892574523694485,0.2975679337978363,3.283203125,0.8066952228546143
3x3@56,16,56,56,3,64-128-32/4x3,64,128,32,4,3,block,0.25,0.9572761535644532,0.31145984649658204,0.3253604984693808,0.3404467701911926,3.283203125,0.863337516784668
3x3@56,16,56,56,3,64-128-32/4x3,64,128,32,4,3,input,1.0,1.0167091369628907,0.31145984649658204,0.30634115025952613,7.887938409112394e-05,0.001953125,0.0003531323454808444
3x3@56,16,56,56,3,64-128-32/4x3,64,128,32,4,3,input,0.85,1.1008409881591796,0.31145984649658204,0.2829290059569852,0.17663496732711792,1.3218994140625,0.38841795921325684
3x3@56,16,56,56,3,64-128-32/4x3,64,128,32,4,3,input,0.75,1.0417151641845703,0.31145984649658204,0.2989875324896373,0.22428882122039795,1.5341796875,0.4929824471473694
3x3@56,16,56,56,3,64-128-32/4x3,64,128,32,4,3,input,0.65,0.9452543640136719,0.31145984649658204,0.32949844862295413,0.26345711946487427,1.882080078125,0.5788899660110474
3x3@56,16,56,56,3,64-128-32/4x3,64,128,32,4,3,input,0.5,0.8715878295898437,0.31145984649658204,0.35734763144082726,0.31860628724098206,2.2628173828125,0.6999634504318237
3x3@56,16,56,56,3,64-128-32/4x3,64,128,32,4,3,input,0.35,0.8489113616943359,0.31145984649658204,0.3668932476942488,0.36607131361961365,2.517578125,0.8041509389877319
3x3@56,16,56,56,3,64-128-32/4x3,64,128,32,4,3,input,0.25,0.8147135925292969,0.31145984649658204,0.38229366657508174,0.3918350338935852,2.566162109375,0.8607099056243896
3x3@56,16,56,56,3,64-64-32/2x2,64,64,32,2,2,dense,1.0,1.235251235961914,0.31145984649658204,0.2521429142744733,7.887938409112394e-05,0.001953125,0.0003531323454808444
3x3@56,16,56,56,3,64-64-32/2x2,64,64,32,2,2,channel,1.0,1.245102081298828,0.31145984649658204,0.2501480410117721,7.887938409112394e-05,0.001953125,0.0003531323454808444
3x3@56,16,56,56,3,64-64-32/2x2,64,64,32,2,2,channel,0.85,1.3147750854492188,0.31145984649658204,0.23689211177147126,0.06598103791475296,3.283203125,0.3755829632282257
3x3@56,16,56,56,3,64-64-32/2x2,64,64,32,2,2,channel,0.75,1.425959014892578,0.31145984649658204,0.21842131733361586,0.1114378273487091,3.283203125,0.48904842138290405
3x3@56,16,56,56,3,64-64-32/2x2,64,64,32,2,2,channel,0.65,1.2204409790039064,0.31145984649658204,0.25520271103219416,0.1571718156337738,3.283203125,0.58188796043396
3x3@56,16,56,56,3,64-64-32/2x2,64,64,32,2,2,channel,0.5,1.052241897583008,0.31145984649658204,0.2959964312502696,0.22452056407928467,3.283203125,0.6971522569656372
3x3@56,16,56,56,3,64-64-32/2x2,64,64,32,2,2,channel,0.35,1.124352035522461,0.31145984649658204,0.2770127474815783,0.29229822754859924,3.283203125,0.7971453070640564
3x3@56,16,56,56,3,64-64-32/2x2,64,64,32,2,2,channel,0.25,0.9676185607910156,0.31145984649658204,0.3218828773209638,0.3390449583530426,3.283203125,0.8598080277442932
3x3@56,16,56,56,3,64-64-32/2x2,64,64,32,2,2,block,1.0,1.1738086700439454,0.31145984649658204,0.265341238691755,7.887938409112394e-05,0.001953125,0.0003531323454808444
3x3@56,16,56,56,3,64-64-32/2x2,64,64,32,2,2,block,0.85,1.2954783630371094,0.31145984649658204,0.24042072440823944,0.0706055611371994,2.919921875,0.3918136954307556
3x3@56,16,56,56,3,64-64-32/2x2,64,64,32,2,2,block,0.75,1.3071974182128907,0.31145984649658204,0.23826534703716618,0.11305787414312363,3.283203125,0.4962484538555145
3x3@56,16,56,56,3,64-64-32/2x2,64,64,32,2,2,block,0.65,1.216921615600586,0.31145984649658204,0.25594076274408817,0.1555105298757553,3.283203125,0.582270622253418
3x3@56,16,56,56,3,64-64-32/2x2,64,64,32,2,2,block,0.5,1.0575052642822265,0.31145984649658204,0.29452321138843973,0.22649677097797394,3.283203125,0.7033554315567017
3x3@56,16,56,56,3,64-64-32/2x2,64,64,32,2,2,block,0.35,0.969195556640625,0.31145984649658204,0.3213591357931395,0.2975679337978363,3.283203125,0.8066952228546143
3x3@56,16,56,56,3,64-64-32/2x2,64,64,32,2,2,block,0.25,0.99059326171875,0.31145984649658204,0.314417489531654,0.3404467701911926,3.283203125,0.863337516784668
3x3@56,16,56,56,3,64-64-32/2x2,64,64,32,2,2,input,1.0,1.1753683471679688,0.31145984649658204,0.26498913914692324,7.887938409112394e-05,0.001953125,0.0003531323454808444
3x3@56,16,56,56,3,64-64-32/2x2,64,64,32,2,2,input,0.85,1.1319462585449218,0.31145984649658204,0.2751542700418949,0.17663496732711792,1.3218994140625,0.38841795921325684
3x3@56,16,56,56,3,64-64-32/2x2,64,64,32,2,2,input,0.75,1.1490060424804687,0.31145984649658204,0.271068936960683,0.22428882122039795,1.5341796875,0.4929824471473694
3x3@56,16,56,56,3,64-64-32/2x2,64,64,32,2,2,input,0.65,1.0223411560058593,0.31145984649658204,0.30465353435775894,0.26345711946487427,1.882080078125,0.5788899660110474
3x3@56,16,56,56,3,64-64-32/2x2,64,64,32,2,2,input,0.5,0.9957376098632813,0.31145984649658204,0.31279309268969635,0.31860628724098206,2.2628173828125,0.6999634504318237
3x3@56,16,56,56,3,64-64-32/2x2,64,64,32,2,2,input,0.35,0.9268019104003906,0.31145984649658204,0.33605870143494554,0.36607131361961365,2.517578125,0.8041509389877319
3x3@56,16,56,56,3,64-64-32/2x2,64,64,32,2,2,input,0.25,0.870481948852539,0.31145984649658204,0.35780161427488005,0.3918350338935852,2.566162109375,0.8607099056243896
5x5@56,16,56,56,5,64-64-16/4x2,64,64,16,4,2,dense,1.0,3.298260498046875,0.6387712097167969,0.19366912046366772,7.970668957568705e-05,0.001953125,0.0003597970644477755
5x5@56,16,56,56,5,64-64-16/4x2,64,64,16,4,2,channel,1.0,3.2353076171875,0.6387712097167969,0.1974375500874597,7.970668957568705e-05,0.001953125,0.0003597970644477755
5x5@56,16,56,56,5,64-64-16/4x2,64,64,16,4,2,channel,0.85,3.311861877441406,0.6387712097167969,0.19287374696020912,0.0657915398478508,2.603515625,0.37933334708213806
5x5@56,16,56,56,5,64-64-16/4x2,64,64,16,4,2,channel,0.75,3.3722573852539064,0.6387712097167969,0.18941947091879585,0.11099284887313843,2.603515625,0.49339136481285095
5x5@56,16,56,56,5,64-64-16/4x2,64,64,16,4,2,channel,0.65,3.252613220214844,0.6387712097167969,0.19638707908670566,0.1563887894153595,2.716796875,0.5862942934036255
5x5@56,16,56,56,5,64-64-16/4x2,64,64,16,4,2,channel,0.5,2.306641845703125,0.6387712097167969,0.27692691472961756,0.22302362322807312,2.783203125,0.7012619972229004
5x5@56,16,56,56,5,64-64-16/4x2,64,64,16,4,2,channel,0.35,2.244751434326172,0.6387712097167969,0.2845621122895252,0.28984329104423523,2.78515625,0.8003247380256653
5x5@56,16,56,56,5,64-64-16/4x2,64,64,16,4,2,channel,0.25,2.215340118408203,0.6387712097167969,0.2883400180446223,0.3357113301753998,2.78515625,0.8619721531867981
5x5@56,16,56,56,5,64-64-16/4x2,64,64,16,4,2,block,1.0,3.195823974609375,0.6387712097167969,0.19987684390373028,7.970668957568705e-05,0.001953125,0.0003597970644477755
5x5@56,16,56,56,5,64-64-16/4x2,64,64,16,4,2,block,0.85,3.2344671630859376,0.6387712097167969,0.19748885288028667,0.06970560550689697,2.716796875,0.3917192816734314
5x5@56,16,56,56,5,64-64-16/4x2,64,64,16,4,2,block,0.75,3.3512274169921876,0.6387712097167969,0.19060813553802636,0.1117490902543068,2.81640625,0.4966976046562195
5x5@56,16,56,56,5,64-64-16/4x2,64,64,16,4,2,block,0.65,3.223471374511719,0.6387712097167969,0.19816251968843865,0.15376552939414978,2.81640625,0.5829832553863525
5x5@56,16,56,56,5,64-64-16/4x2,64,64,16,4,2,block,0.5,2.3097549438476563,0.6387712097167969,0.27655367138329984,0.2239338606595993,2.81640625,0.7041022777557373
5x5@56,16,56,56,5,64-64-16/4x2,64,64,16,4,2,block,0.35,2.2056959533691405,0.6387712097167969,0.2896007533318866,0.29428502917289734,2.81640625,0.8077802062034607
5x5@56,16,56,56,5,64-64-16/4x2,64,64,16,4,2,block,0.25,2.2383999633789062,0.6387712097167969,0.28536955868805497,0.3364938795566559,2.81640625,0.864041268825531
5x5@56,16,56,56,5,64-64-16/4x2,64,64,16,4,2,input,1.0,3.2324365234375,0.6387712097167969,0.19761291678436504,7.970668957568705e-05,0.001953125,0.0003597970644477755
5x5@56,16,56,56,5,64-64-16/4x2,64,64,16,4,2,input,0.85,2.864394226074219,0.6387712097167969,0.22300394404588003,0.1751173734664917,1.2431640625,0.38961243629455566
5x5@56,16,56,56,5,64-64-16/4x2,64,64,16,4,2,input,0.75,2.6064077758789064,0.6387712097167969,0.24507723450962962,0.22205117344856262,1.4716796875,0.49384382367134094
5x5@56,16,56,56,5,64-64-16/4x2,64,64,16,4,2,input,0.65,2.3529983520507813,0.6387712097167969,0.27147116748299843,0.2609815299510956,1.740234375,0.5804044008255005
5x5@56,16,56,56,5,64-64-16/4x2,64,64,16,4,2,input,0.5,1.9639910888671874,0.6387712097167969,0.3252413991782592,0.31556493043899536,2.157684326171875,0.7018571496009827
5x5@56,16,56,56,5,64-64-16/4x2,64,64,16,4,2,input,0.35,1.5517491149902343,0.6387712097167969,0.4116459313855107,0.362486332654953,2.423828125,0.8060727715492249
5x5@56,16,56,56,5,64-64-16/4x2,64,64,16,4,2,input,0.25,1.3110246276855468,0.6387712097167969,0.4872305189601733,0.3880198001861572,2.6513671875,0.8628667593002319
5x5@56,16,56,56,5,64-64-32/4x2,64,64,32,4,2,dense,1.0,2.255482940673828,0.6387712097167969,0.2832081760396571,7.970668957568705e-05,0.001953125,0.0003597970644477755
5x5@56,16,56,56,5,64-64-32/4x2,64,64,32,4,2,channel,1.0,2.2778675842285154,0.6387712097167969,0.28042508446913983,7.970668957568705e-05,0.001953125,0.0003597970644477755
5x5@56,16,56,56,5,64-64-32/4x2,64,64,32,4,2,channel,0.85,2.4369529724121093,0.6387712097167969,0.26211880858929243,0.0657915398478508,2.603515625,0.37933334708213806
5x5@56,16,56,56,5,64-64-32/4x2,64,64,32,4,2,channel,0.75,2.395873260498047,0.6387712097167969,0.26661310522911846,0.11099284887313843,2.603515625,0.49339136481285095
5x5@56,16,56,56,5,64-64-32/4x2,64,64,32,4,2,channel,0.65,2.3566131591796875,0.6387712097167969,0.27105475806608265,0.1563887894153595,2.716796875,0.5862942934036255
5x5@56,16,56,56,5,64-64-32/4x2,64,64,32,4,2,channel,0.5,1.8458419799804688,0.6387712097167969,0.3460595309049997,0.22302362322807312,2.783203125,0.7012619972229004
5x5@56,16,56,56,5,64-64-32/4x2,64,64,32,4,2,channel,0.35,1.82540283203125,0.6387712097167969,0.34993438078870115,0.28984329104423523,2.78515625,0.8003247380256653
5x5@56,16,56,56,5,64-64-32/4x2,64,64,32,4,2,channel,0.25,1.8495167541503905,0.6387712097167969,0.3453719509614435,0.3357113301753998,2.78515625,0.8619721531867981
5x5@56,16,56,56,5,64-64-32/4x2,64,64,32,4,2,block,1.0,2.3350706481933594,0.6387712097167969,0.2735554105016108,7.970668957568705e-05,0.001953125,0.0003597970644477755
5x5@56,16,56,56,5,64-64-32/4x2,64,64,32,4,2,block,0.85,2.5192652893066407,0.6387712097167969,0.25355456308160434,0.06970560550689697,2.716796875,0.3917192816734314
5x5@56,16,56,56,5,64-64-32/4x2,64,64,32,4,2,block,0.75,2.529669189453125,0.6387712097167969,0.2525117562327939,0.1117490902543068,2.81640625,0.4966976046562195
5x5@56,16,56,56,5,64-64-32/4x2,64,64,32,4,2,block,0.65,2.4854092407226562,0.6387712097167969,0.2570084633350233,0.15376552939414978,2.81640625,0.5829832553863525
5x5@56,16,56,56,5,64-64-32/4x2,64,64,32,4,2,block,0.5,1.93115966796875,0.6387712097167969,0.33077079037626916,0.2239338606595993,2.81640625,0.7041022777557373
5x5@56,16,56,56,5,64-64-32/4x2,64,64,32,4,2,block,0.35,1.8189427185058593,0.6387712097167969,0.35117719937959624,0.29428502917289734,2.81640625,0.8077802062034607
5x5@56,16,56,56,5,64-64-32/4x2,64,64,32,4,2,block,0.25,1.84268798828125,0.6387712097167969,0.34665185521321207,0.3364938795566559,2.81640625,0.864041268825531
5x5@56,16,56,56,5,64-64-32/4x2,64,64,32,4,2,input,1.0,2.3022105407714846,0.6387712097167969,0.2774599448679185,7.970668957568705e-05,0.001953125,0.0003597970644477755
5x5@56,16,56,56,5,64-64-32/4x2,64,64,32,4,2,input,0.85,2.2182681274414064,0.6387712097167969,0.28795942285550846,0.1751173734664917,1.2431640625,0.38961243629455566
5x5@56,16,56,56,5,64-64-32/4x2,64,64,32,4,2,input,0.75,1.996390380859375,0.6387712097167969,0.3199630772824244,0.22205117344856262,1.4716796875,0.49384382367134094
5x5@56,16,56,56,5,64-64-32/4x2,64,64,32,4,2,input,0.65,1.8324940490722657,0.6387712097167969,0.348580236885455,0.2609815299510956,1.740234375,0.5804044008255005
5x5@56,16,56,56,5,64-64-32/4x2,64,64,32,4,2,input,0.5,1.517813720703125,0.6387712097167969,0.4208495423409976,0.31556493043899536,2.157684326171875,0.7018571496009827
5x5@56,16,56,56,5,64-64-32/4x2,64,64,32,4,2,input,0.35,1.295810546875,0.6387712097167969,0.49295108089471024,0.362486332654953,2.423828125,0.8060727715492249
5x5@56,16,56,56,5,64-64-32/4x2,64,64,32,4,2,input,0.25,1.1302476501464844,0.6387712097167969,0.5651603961609738,0.3880198001861572,2.6513671875,0.8628667593002319
5x5@56,16,56,56,5,64-64-64/4x2,64,64,64,4,2,dense,1.0,1.8857574462890625,0.6387712097167969,0.3387345551644617,7.970668957568705e-05,0.001953125,0.0003597970644477755
5x5@56,16,56,56,5,64-64-64/4x2,64,64,64,4,2,channel,1.0,1.8852217102050781,0.6387712097167969,0.33883081563245426,7.970668957568705e-05,0.001953125,0.0003597970644477755
5x5@56,16,56,56,5,64-64-64/4x2,64,64,64,4,2,channel,0.85,2.14044677734375,0.6387712097167969,0.2984289151583104,0.0657915398478508,2.603515625,0.37933334708213806
5x5@56,16,56,56,5,64-64-64/4x2,64,64,64,4,2,channel,0.75,2.017751007080078,0.6387712097167969,0.3165758349149203,0.11099284887313843,2.603515625,0.49339136481285095
5x5@56,16,56,56,5,64-64-64/4x2,64,64,64,4,2,channel,0.65,2.0755250549316404,0.6387712097167969,0.307763670787311,0.1563887894153595,2.716796875,0.5862942934036255
5x5@56,16,56,56,5,64-64-64/4x2,64,64,64,4,2,channel,0.5,1.69891845703125,0.6387712097167969,0.37598697399109327,0.22302362322807312,2.783203125,0.7012619972229004
5x5@56,16,56,56,5,64-64-64/4x2,64,64,64,4,2,channel,0.35,1.7453260803222657,0.6387712097167969,0.3659896090012309,0.28984329104423523,2.78515625,0.8003247380256653
5x5@56,16,56,56,5,64-64-64/4x2,64,64,64,4,2,channel,0.25,1.6575897216796875,0.6387712097167969,0.3853614687411973,0.3357113301753998,2.78515625,0.8619721531867981
5x5@56,16,56,56,5,64-64-64/4x2,64,64,64,4,2,block,1.0,2.0282162475585936,0.6387712097167969,0.3149423590732493,7.970668957568705e-05,0.001953125,0.0003597970644477755
5x5@56,16,56,56,5,64-64-64/4x2,64,64,64,4,2,block,0.85,2.178355865478516,0.6387712097167969,0.29323547168748715,0.06970560550689697,2.716796875,0.3917192816734314
5x5@56,16,56,56,5,64-64-64/4x2,64,64,64,4,2,block,0.75,2.019284515380859,0.6387712097167969,0.31633541724867714,0.1117490902543068,2.81640625,0.4966976046562195
5x5@56,16,56,56,5,64-64-64/4x2,64,64,64,4,2,block,0.65,2.0737228393554688,0.6387712097167969,0.30803113974253793,0.15376552939414978,2.81640625,0.5829832553863525
5x5@56,16,56,56,5,64-64-64/4x2,64,64,64,4,2,block,0.5,1.6494560241699219,0.6387712097167969,0.3872617398443553,0.2239338606595993,2.81640625,0.7041022777557373
5x5@56,16,56,56,5,64-64-64/4x2,64,64,64,4,2,block,0.35,1.6328294372558594,0.6387712097167969,0.39120510393928143,0.29428502917289734,2.81640625,0.8077802062034607
5x5@56,16,56,56,5,64-64-64/4x2,64,64,64,4,2,block,0.25,1.5650810241699218,0.6387712097167969,0.40813938694042023,0.3364938795566559,2.81640625,0.864041268825531
5x5@56,16,56,56,5,64-64-64/4x2,64,64,64,4,2,input,1.0,1.9031436157226562,0.6387712097167969,0.33564004546984466,7.970668957568705e-05,0.001953125,0.0003597970644477755
5x5@56,16,56,56,5,64-64-64/4x2,64,64,64,4,2,input,0.85,1.8923724365234376,0.6387712097167969,0.3375504723004274,0.1751173734664917,1.2431640625,0.38961243629455566
5x5@56,16,56,56,5,64-64-64/4x2,64,64,64,4,2,input,0.75,1.7685484313964843,0.6387712097167969,0.36118389430387793,0.22205117344856262,1.4716796875,0.49384382367134094
5x5@56,16,56,56,5,64-64-64/4x2,64,64,64,4,2,input,0.65,1.681898193359375,0.6387712097167969,0.3797918400999847,0.2609815299510956,1.740234375,0.5804044008255005
5x5@56,16,56,56,5,64-64-64/4x2,64,64,64,4,2,input,0.5,1.4675967407226562,0.6387712097167969,0.4352498148791615,0.31556493043899536,2.157684326171875,0.7018571496009827
5x5@56,16,56,56,5,64-64-64/4x2,64,64,64,4,2,input,0.35,1.2980224609375,0.6387712097167969,0.492111060432223,0.362486332654953,2.423828125,0.8060727715492249
5x5@56,16,56,56,5,64-64-64/4x2,64,64,64,4,2,input,0.25,1.151036834716797,0.6387712097167969,0.5549528828709998,0.3880198001861572,2.6513671875,0.8628667593002319
5x5@56,16,56,56,5,64-128-32/4x2,64,128,32,4,2,dense,1.0,1.935257568359375,0.6387712097167969,0.33007038451130755,7.970668957568705e-05,0.001953125,0.0003597970644477755
5x5@56,16,56,56,5,64-128-32/4x2,64,128,32,4,2,channel,1.0,1.8270413208007812,0.6387712097167969,0.34962055999742103,7.970668957568705e-05,0.001953125,0.0003597970644477755
5x5@56,16,56,56,5,64-128-32/4x2,64,128,32,4,2,channel,0.85,2.134176025390625,0.6387712097167969,0.2993057752112461,0.0657915398478508,2.603515625,0.37933334708213806
5x5@56,16,56,56,5,64-128-32/4x2,64,128,32,4,2,channel,0.75,1.9463987731933594,0.6387712097167969,0.3281810585344733,0.11099284887313843,2.603515625,0.49339136481285095
5x5@56,16,56,56,5,64-128-32/4x2,64,128,32,4,2,channel,0.65,2.0137779235839846,0.6387712097167969,0.31720042326214176,0.1563887894153595,2.716796875,0.5862942934036255
5x5@56,16,56,56,5,64-128-32/4x2,64,128,32,4,2,channel,0.5,1.8675302124023438,0.6387712097167969,0.34204062963730997,0.22302362322807312,2.783203125,0.7012619972229004
5x5@56,16,56,56,5,64-128-32/4x2,64,128,32,4,2,channel,0.35,1.90097412109375,0.6387712097167969,0.33602309606891,0.28984329104423523,2.78515625,0.8003247380256653
5x5@56,16,56,56,5,64-128-32/4x2,64,128,32,4,2,channel,0.25,1.7970994567871095,0.6387712097167969,0.3554456640139466,0.3357113301753998,2.78515625,0.8619721531867981
5x5@56,16,56,56,5,64-128-32/4x2,64,128,32,4,2,block,1.0,1.8154905700683595,0.6387712097167969,0.35184496149310485,7.970668957568705e-05,0.001953125,0.0003597970644477755
5x5@56,16,56,56,5,64-128-32/4x2,64,128,32,4,2,block,0.85,2.0859494018554687,0.6387712097167969,0.30622564916896106,0.06970560550689697,2.716796875,0.3917192816734314
5x5@56,16,56,56,5,64-128-32/4x2,64,128,32,4,2,block,0.75,1.9463168334960939,0.6387712097167969,0.3281948749163294,0.1117490902543068,2.81640625,0.4966976046562195
5x5@56,16,56,56,5,64-128-32/4x2,64,128,32,4,2,block,0.65,2.0135321044921874,0.6387712097167969,0.3172391482071228,0.15376552939414978,2.81640625,0.5829832553863525
5x5@56,16,56,56,5,64-128-32/4x2,64,128,32,4,2,block,0.5,1.8837913513183593,0.6387712097167969,0.3390880891717424,0.2239338606595993,2.81640625,0.7041022777557373
5x5@56,16,56,56,5,64-128-32/4x2,64,128,32,4,2,block,0.35,1.8983935546875,0.6387712097167969,0.3364798664320934,0.29428502917289734,2.81640625,0.8077802062034607
5x5@56,16,56,56,5,64-128-32/4x2,64,128,32,4,2,block,0.25,1.7761024475097655,0.6387712097167969,0.3596477278731326,0.3364938795566559,2.81640625,0.864041268825531
5x5@56,16,56,56,5,64-128-32/4x2,64,128,32,4,2,input,1.0,1.8123776245117187,0.6387712097167969,0.35244929151500165,7.970668957568705e-05,0.001953125,0.0003597970644477755
5x5@56,16,56,56,5,64-128-32/4x2,64,128,32,4,2,input,0.85,1.7974476623535156,0.6387712097167969,0.3553768062878738,0.1751173734664917,1.2431640625,0.38961243629455566
5x5@56,16,56,56,5,64-128-32/4x2,64,128,32,4,2,input,0.75,1.7180058288574218,0.6387712097167969,0.3718096871310492,0.22205117344856262,1.4716796875,0.49384382367134094
5x5@56,16,56,56,5,64-128-32/4x2,64,128,32,4,2,input,0.65,1.6890675354003906,0.6387712097167969,0.3781797922990553,0.2609815299510956,1.740234375,0.5804044008255005
5x5@56,16,56,56,5,64-128-32/4x2,64,128,32,4,2,input,0.5,1.38395263671875,0.6387712097167969,0.46155568678367237,0.31556493043899536,2.157684326171875,0.7018571496009827
5x5@56,16,56,56,5,64-128-32/4x2,64,128,32,4,2,input,0.35,1.2342272186279297,0.6387712097167969,0.5175474986096227,0.362486332654953,2.423828125,0.8060727715492249
5x5@56,16,56,56,5,64-128-32/4x2,64,128,32,4,2,input,0.25,1.061212158203125,0.6387712097167969,0.6019260190143153,0.3880198001861572,2.6513671875,0.8628667593002319
5x5@56,16,56,56,5,128-64-32/8x2,128,64,32,8,2,dense,1.0,2.2382386779785155,0.6387712097167969,0.2853901221534196,7.970668957568705e-05,0.001953125,0.0003597970644477755
5x5@56,16,56,56,5,128-64-32/8x2,128,64,32,8,2,channel,1.0,2.2609715270996094,0.6387712097167969,0.2825206784165996,7.970668957568705e-05,0.001953125,0.0003597970644477755
5x5@56,16,56,56,5,128-64-32/8x2,128,64,32,8,2,channel,0.85,2.5032089233398436,0.6387712097167969,0.2551809414551513,0.0657915398478508,2.603515625,0.37933334708213806
5x5@56,16,56,56,5,128-64-32/8x2,128,64,32,8,2,channel,0.75,2.37770751953125,0.6387712097167969,0.2686500355782727,0.11099284887313843,2.603515625,0.49339136481285095
5x5@56,16,56,56,5,128-64-32/8x2,128,64,32,8,2,channel,0.65,2.4533401489257813,0.6387712097167969,0.2603679762859174,0.1563887894153595,2.716796875,0.5862942934036255
5x5@56,16,56,56,5,128-64-32/8x2,128,64,32,8,2,channel,0.5,1.8383462524414063,0.6387712097167969,0.34747056430119194,0.22302362322807312,2.783203125,0.7012619972229004
5x5@56,16,56,56,5,128-64-32/8x2,128,64,32,8,2,channel,0.35,1.8300518798828125,0.6387712097167969,0.34904541053650384,0.28984329104423523,2.78515625,0.8003247380256653
5x5@56,16,56,56,5,128-64-32/8x2,128,64,32,8,2,channel,0.25,1.7228390502929687,0.6387712097167969,0.370766618975913,0.3357113301753998,2.78515625,0.8619721531867981
5x5@56,16,56,56,5,128-64-32/8x2,128,64,32,8,2,block,1.0,2.241474609375,0.6387712097167969,0.2849781153197663,7.970668957568705e-05,0.001953125,0.0003597970644477755
5x5@56,16,56,56,5,128-64-32/8x2,128,64,32,8,2,block,0.85,2.500833282470703,0.6387712097167969,0.255423347967331,0.06970560550689697,2.716796875,0.3917192816734314
5x5@56,16,56,56,5,128-64-32/8x2,128,64,32,8,2,block,0.75,2.4068914794921876,0.6387712097167969,0.2653926091639024,0.1117490902543068,2.81640625,0.4966976046562195
5x5@56,16,56,56,5,128-64-32/8x2,128,64,32,8,2,block,0.65,2.465259552001953,0.6387712097167969,0.2591091105186359,0.15376552939414978,2.81640625,0.5829832553863525
5x5@56,16,56,56,5,128-64-32/8x2,128,64,32,8,2,block,0.5,1.8198118591308594,0.6387712097167969,0.35100947744228544,0.2239338606595993,2.81640625,0.7041022777557373
5x5@56,16,56,56,5,128-64-32/8x2,128,64,32,8,2,block,0.35,1.8666496276855469,0.6387712097167969,0.34220198597677237,0.29428502917289734,2.81640625,0.8077802062034607
5x5@56,16,56,56,5,128-64-32/8x2,128,64,32,8,2,block,0.25,1.8356019592285155,0.6387712097167969,0.34799004572062336,0.3364938795566559,2.81640625,0.864041268825531
5x5@56,16,56,56,5,128-64-32/8x2,128,64,32,8,2,input,1.0,2.3503077697753905,0.6387712097167969,0.2717819418934405,7.970668957568705e-05,0.001953125,0.0003597970644477755
5x5@56,16,56,56,5,128-64-32/8x2,128,64,32,8,2,input,0.85,2.129203186035156,0.6387712097167969,0.30000481584205646,0.1751173734664917,1.2431640625,0.38961243629455566
5x5@56,16,56,56,5,128-64-32/8x2,128,64,32,8,2,input,0.75,2.0962098693847655,0.6387712097167969,0.30472674470532635,0.22205117344856262,1.4716796875,0.49384382367134094
5x5@56,16,56,56,5,128-64-32/8x2,128,64,32,8,2,input,0.65,1.8585804748535155,0.6387712097167969,0.34368767904286834,0.2609815299510956,1.740234375,0.5804044008255005
5x5@56,16,56,56,5,128-64-32/8x2,128,64,32,8,2,input,0.5,1.5097036743164063,0.6387712097167969,0.42311032329310083,0.31556493043899536,2.157684326171875,0.7018571496009827
5x5@56,16,56,56,5,128-64-32/8x2,128,64,32,8,2,input,0.35,1.242071075439453,0.6387712097167969,0.5142791119991225,0.362486332654953,2.423828125,0.8060727715492249
5x5@56,16,56,56,5,128-64-32/8x2,128,64,32,8,2,input,0.25,1.1226726531982423,0.6387712097167969,0.5689736967379415,0.3880198001861572,2.6513671875,0.8628667593002319
5x5@56,16,56,56,5,128-128-32/8x2,128,128,32,8,2,dense,1.0,1.8769305419921876,0.6387712097167969,0.34032756962801647,7.970668957568705e-05,0.001953125,0.0003597970644477755
5x5@56,16,56,56,5,128-128-32/8x2,128,128,32,8,2,channel,1.0,1.8775814819335936,0.6387712097167969,0.3402095812422318,7.970668957568705e-05,0.001953125,0.0003597970644477755
5x5@56,16,56,56,5,128-128-32/8x2,128,128,32,8,2,channel,0.85,2.5102745056152345,0.6387712097167969,0.25446269254136517,0.0657915398478508,2.603515625,0.37933334708213806
5x5@56,16,56,56,5,128-128-32/8x2,128,128,32,8,2,channel,0.75,2.1189222717285157,0.6387712097167969,0.30146042553779845,0.11099284887313843,2.603515625,0.49339136481285095
5x5@56,16,56,56,5,128-128-32/8x2,128,128,32,8,2,channel,0.65,2.4143667602539063,0.6387712097167969,0.26457090953721574,0.1563887894153595,2.716796875,0.5862942934036255
5x5@56,16,56,56,5,128-128-32/8x2,128,128,32,8,2,channel,0.5,1.8949325561523438,0.6387712097167969,0.3370944299008828,0.22302362322807312,2.783203125,0.7012619972229004
5x5@56,16,56,56,5,128-128-32/8x2,128,128,32,8,2,channel,0.35,2.3004159545898437,0.6387712097167969,0.2776763951937934,0.28984329104423523,2.78515625,0.8003247380256653
5x5@56,16,56,56,5,128-128-32/8x2,128,128,32,8,2,channel,0.25,1.830584259033203,0.6387712097167969,0.3489438995035141,0.3357113301753998,2.78515625,0.8619721531867981
5x5@56,16,56,56,5,128-128-32/8x2,128,128,32,8,2,block,1.0,1.9009977722167968,0.6387712097167969,0.336018915462437,7.970668957568705e-05,0.001953125,0.0003597970644477755
5x5@56,16,56,56,5,128-128-32/8x2,128,128,32,8,2,block,0.85,2.7158111572265624,0.6387712097167969,0.23520457525814206,0.06970560550689697,2.716796875,0.3917192816734314
5x5@56,16,56,56,5,128-128-32/8x2,128,128,32,8,2,block,0.75,2.1054054260253907,0.6387712097167969,0.30339582192617254,0.1117490902543068,2.81640625,0.4966976046562195
5x5@56,16,56,56,5,128-128-32/8x2,128,128,32,8,2,block,0.65,2.4872140502929687,0.6387712097167969,0.25682196899842863,0.15376552939414978,2.81640625,0.5829832553863525
5x5@56,16,56,56,5,128-128-32/8x2,128,128,32,8,2,block,0.5,1.91320068359375,0.6387712097167969,0.3338756959447302,0.2239338606595993,2.81640625,0.7041022777557373
5x5@56,16,56,56,5,128-128-32/8x2,128,128,32,8,2,block,0.35,2.3011737060546875,0.6387712097167969,0.2775849593779499,0.29428502917289734,2.81640625,0.8077802062034607
5x5@56,16,56,56,5,128-128-32/8x2,128,128,32,8,2,block,0.25,1.8315878295898438,0.6387712097167969,0.34875270483744153,0.3364938795566559,2.81640625,0.864041268825531
5x5@56,16,56,56,5,128-128-32/8x2,128,128,32,8,2,input,1.0,1.8785440063476562,0.6387712097167969,0.3400352653748701,7.970668957568705e-05,0.001953125,0.0003597970644477755
5x5@56,16,56,56,5,128-128-32/8x2,128,128,32,8,2,input,0.85,2.0071629333496093,0.6387712097167969,0.318245818066597,0.1751173734664917,1.2431640625,0.38961243629455566
5x5@56,16,56,56,5,128-128-32/8x2,128,128,32,8,2,input,0.75,1.6502374267578126,0.6387712097167969,0.38707836785145366,0.22205117344856262,1.4716796875,0.49384382367134094
5x5@56,16,56,56,5,128-128-32/8x2,128,128,32,8,2,input,0.65,1.7046937561035156,0.6387712097167969,0.37471317497921797,0.2609815299510956,1.740234375,0.5804044008255005
5x5@56,16,56,56,5,128-128-32/8x2,128,128,32,8,2,input,0.5,1.3213285827636718,0.6387712097167969,0.48343100879627704,0.31556493043899536,2.157684326171875,0.7018571496009827
5x5@56,16,56,56,5,128-128-32/8x2,128,128,32,8,2,input,0.35,1.241743392944336,0.6387712097167969,0.5144148246298994,0.362486332654953,2.423828125,0.8060727715492249
5x5@56,16,56,56,5,128-128-32/8x2,128,128,32,8,2,input,0.25,1.0248806762695313,0.6387712097167969,0.6232639803902477,0.3880198001861572,2.6513671875,0.8628667593002319
5x5@56,16,56,56,5,128-128-64/8x2,128,128,64,8,2,dense,1.0,1.926796875,0.6387712097167969,0.3315197455449459,7.970668957568705e-05,0.001953125,0.0003597970644477755
5x5@56,16,56,56,5,128-128-64/8x2,128,128,64,8,2,channel,1.0,1.9454566955566406,0.6387712097167969,0.3283399785642772,7.970668957568705e-05,0.001953125,0.0003597970644477755
5x5@56,16,56,56,5,128-128-64/8x2,128,128,64,8,2,channel,0.85,2.3021363830566406,0.6387712097167969,0.27746888256406177,0.0657915398478508,2.603515625,0.37933334708213806
5x5@56,16,56,56,5,128-128-64/8x2,128,128,64,8,2,channel,0.75,2.065548858642578,0.6387712097167969,0.3092501090177938,0.11099284887313843,2.603515625,0.49339136481285095
5x5@56,16,56,56,5,128-128-64/8x2,128,128,64,8,2,channel,0.65,2.2097549438476562,0.6387712097167969,0.2890687999116135,0.1563887894153595,2.716796875,0.5862942934036255
5x5@56,16,56,56,5,128-128-64/8x2,128,128,64,8,2,channel,0.5,1.9807232666015624,0.6387712097167969,0.32249391951293244,0.22302362322807312,2.783203125,0.7012619972229004
5x5@56,16,56,56,5,128-128-64/8x2,128,128,64,8,2,channel,0.35,2.0863821411132815,0.6387712097167969,0.3061621345052121,0.28984329104423523,2.78515625,0.8003247380256653
5x5@56,16,56,56,5,128-128-64/8x2,128,128,64,8,2,channel,0.25,1.8833619689941405,0.6387712097167969,0.33916539689815955,0.3357113301753998,2.78515625,0.8619721531867981
5x5@56,16,56,56,5,128-128-64/8x2,128,128,64,8,2,block,1.0,1.9241778564453125,0.6387712097167969,0.33197098052923757,7.970668957568705e-05,0.001953125,0.0003597970644477755
5x5@56,16,56,56,5,128-128-64/8x2,128,128,64,8,2,block,0.85,2.299535369873047,0.6387712097167969,0.2777827286701236,0.06970560550689697,2.716796875,0.3917192816734314
5x5@56,16,56,56,5,128-128-64/8x2,128,128,64,8,2,block,0.75,2.0860108947753906,0.6387712097167969,0.306216622030431,0.1117490902543068,2.81640625,0.4966976046562195
5x5@56,16,56,56,5,128-128-64/8x2,128,128,64,8,2,block,0.65,2.2018048095703127,0.6387712097167969,0.29011255082209336,0.15376552939414978,2.81640625,0.5829832553863525
5x5@56,16,56,56,5,128-128-64/8x2,128,128,64,8,2,block,0.5,1.9709132385253907,0.6387712097167969,0.3240991014879561,0.2239338606595993,2.81640625,0.7041022777557373
5x5@56,16,56,56,5,128-128-64/8x2,128,128,64,8,2,block,0.35,2.080522918701172,0.6387712097167969,0.3070243562207759,0.29428502917289734,2.81640625,0.8077802062034607
5x5@56,16,56,56,5,128-128-64/8x2,128,128,64,8,2,block,0.25,1.9065446472167968,0.6387712097167969,0.33504130661156295,0.3364938795566559,2.81640625,0.864041268825531
5x5@56,16,56,56,5,128-128-64/8x2,128,128,64,8,2,input,1.0,1.9206962585449219,0.6387712097167969,0.3325727359935174,7.970668957568705e-05,0.001953125,0.0003597970644477755
5x5@56,16,56,56,5,128-128-64/8x2,128,128,64,8,2,input,0.85,1.9356672668457031,0.6387712097167969,0.33000052264029683,0.1751173734664917,1.2431640625,0.38961243629455566
5x5@56,16,56,56,5,128-128-64/8x2,128,128,64,8,2,input,0.75,1.8448384094238282,0.6387712097167969,0.3462477832496425,0.22205117344856262,1.4716796875,0.49384382367134094
5x5@56,16,56,56,5,128-128-64/8x2,128,128,64,8,2,input,0.65,1.7203794860839843,0.6387712097167969,0.37129669057540354,0.2609815299510956,1.740234375,0.5804044008255005
5x5@56,16,56,56,5,128-128-64/8x2,128,128,64,8,2,input,0.5,1.4291909790039063,0.6387712097167969,0.4469460128848539,0.31556493043899536,2.157684326171875,0.7018571496009827
5x5@56,16,56,56,5,128-128-64/8x2,128,128,64,8,2,input,0.35,1.3721420288085937,0.6387712097167969,0.46552849217178377,0.362486332654953,2.423828125,0.8060727715492249
5x5@56,16,56,56,5,128-128-64/8x2,128,128,64,8,2,input,0.25,1.1342642974853516,0.6387712097167969,0.563159054845457,0.3880198001861572,2.6513671875,0.8628667593002319
5x5@56,16,56,56,5,128-64-32/8x3,128,64,32,8,3,dense,1.0,2.4098809814453124,0.6387712097167969,0.26506338472105684,7.970668957568705e-05,0.001953125,0.0003597970644477755
5x5@56,16,56,56,5,128-64-32/8x3,128,64,32,8,3,channel,1.0,2.4542002868652344,0.6387712097167969,0.26027672359728365,7.970668957568705e-05,0.001953125,0.0003597970644477755
5x5@56,16,56,56,5,128-64-32/8x3,128,64,32,8,3,channel,0.85,2.4954266357421875,0.6387712097167969,0.25597675386149515,0.0657915398478508,2.603515625,0.37933334708213806
5x5@56,16,56,56,5,128-64-32/8x3,128,64,32,8,3,channel,0.75,2.604769287109375,0.6387712097167969,0.24523139645341446,0.11099284887313843,2.603515625,0.49339136481285095
5x5@56,16,56,56,5,128-64-32/8x3,128,64,32,8,3,channel,0.65,2.5094554138183596,0.6387712097167969,0.25454574972696953,0.1563887894153595,2.716796875,0.5862942934036255
5x5@56,16,56,56,5,128-64-32/8x3,128,64,32,8,3,channel,0.5,2.0260659790039064,0.6387712097167969,0.31527660813437175,0.22302362322807312,2.783203125,0.7012619972229004
5x5@56,16,56,56,5,128-64-32/8x3,128,64,32,8,3,channel,0.35,1.9523992919921875,0.6387712097167969,0.3271724243789333,0.28984329104423523,2.78515625,0.8003247380256653
5x5@56,16,56,56,5,128-64-32/8x3,128,64,32,8,3,channel,0.25,1.8081382751464843,0.6387712097167969,0.3532756418560121,0.3357113301753998,2.78515625,0.8619721531867981
5x5@56,16,56,56,5,128-64-32/8x3,128,64,32,8,3,block,1.0,2.3406387329101563,0.6387712097167969,0.2729046566372939,7.970668957568705e-05,0.001953125,0.0003597970644477755
5x5@56,16,56,56,5,128-64-32/8x3,128,64,32,8,3,block,0.85,2.411745300292969,0.6387712097167969,0.264858486358075,0.06970560550689697,2.716796875,0.3917192816734314
5x5@56,16,56,56,5,128-64-32/8x3,128,64,32,8,3,block,0.75,2.391859130859375,0.6387712097167969,0.26706054778706456,0.1117490902543068,2.81640625,0.4966976046562195
5x5@56,16,56,56,5,128-64-32/8x3,128,64,32,8,3,block,0.65,2.3104287719726564,0.6387712097167969,0.2764730155136575,0.15376552939414978,2.81640625,0.5829832553863525
5x5@56,16,56,56,5,128-64-32/8x3,128,64,32,8,3,block,0.5,1.848115234375,0.6387712097167969,0.3456338640771056,0.2239338606595993,2.81640625,0.7041022777557373
5x5@56,16,56,56,5,128-64-32/8x3,128,64,32,8,3,block,0.35,1.7844032287597655,0.6387712097167969,0.35797469956427364,0.29428502917289734,2.81640625,0.8077802062034607
5x5@56,16,56,56,5,128-64-32/8x3,128,64,32,8,3,block,0.25,1.7673011779785157,0.6387712097167969,0.3614387958748716,0.3364938795566559,2.81640625,0.864041268825531
5x5@56,16,56,56,5,128-64-32/8x3,128,64,32,8,3,input,1.0,2.2769842529296875,0.6387712097167969,0.2805338723335132,7.970668957568705e-05,0.001953125,0.0003597970644477755
5x5@56,16,56,56,5,128-64-32/8x3,128,64,32,8,3,input,0.85,2.0569293212890627,0.6387712097167969,0.3105460178459042,0.1751173734664917,1.2431640625,0.38961243629455566
5x5@56,16,56,56,5,128-64-32/8x3,128,64,32,8,3,input,0.75,2.074398651123047,0.6387712097167969,0.30793078725295936,0.22205117344856262,1.4716796875,0.49384382367134094
5x5@56,16,56,56,5,128-64-32/8x3,128,64,32,8,3,input,0.65,1.9053977966308593,0.6387712097167969,0.3352429665061425,0.2609815299510956,1.740234375,0.5804044008255005
5x5@56,16,56,56,5,128-64-32/8x3,128,64,32,8,3,input,0.5,1.6139263916015625,0.6387712097167969,0.39578707742855557,0.31556493043899536,2.157684326171875,0.7018571496009827
5x5@56,16,56,56,5,128-64-32/8x3,128,64,32,8,3,input,0.35,1.34076416015625,0.6387712097167969,0.47642324332592223,0.362486332654953,2.423828125,0.8060727715492249
5x5@56,16,56,56,5,128-64-32/8x3,128,64,32,8,3,input,0.25,1.2152422332763673,0.6387712097167969,0.525632826300507,0.3880198001861572,2.6513671875,0.8628667593002319
5x5@56,16,56,56,5,64-128-32/4x3,64,128,32,4,3,dense,1.0,1.9243008422851562,0.6387712097167969,0.33194976361297013,7.970668957568705e-05,0.001953125,0.0003597970644477755
5x5@56,16,56,56,5,64-128-32/4x3,64,128,32,4,3,channel,1.0,1.9049267578125,0.6387712097167969,0.3353258633682705,7.970668957568705e-05,0.001953125,0.0003597970644477755
5x5@56,16,56,56,5,64-128-32/4x3,64,128,32,4,3,channel,0.85,2.194022369384766,0.6387712097167969,0.29114161215043455,0.0657915398478508,2.603515625,0.37933334708213806
5x5@56,16,56,56,5,64-128-32/4x3,64,128,32,4,3,channel,0.75,2.0322093200683593,0.6387712097167969,0.3143235312469239,0.11099284887313843,2.603515625,0.49339136481285095
5x5@56,16,56,56,5,64-128-32/4x3,64,128,32,4,3,channel,0.65,2.201886749267578,0.6387712097167969,0.29010175474704764,0.1563887894153595,2.716796875,0.5862942934036255
5x5@56,16,56,56,5,64-128-32/4x3,64,128,32,4,3,channel,0.5,1.9650151062011718,0.6387712097167969,0.32507190794664637,0.22302362322807312,2.783203125,0.7012619972229004
5x5@56,16,56,56,5,64-128-32/4x3,64,128,32,4,3,channel,0.35,2.0224819946289063,0.6387712097167969,0.3158353010870692,0.28984329104423523,2.78515625,0.8003247380256653
5x5@56,16,56,56,5,64-128-32/4x3,64,128,32,4,3,channel,0.25,1.9121221923828124,0.6387712097167969,0.3340640113175953,0.3357113301753998,2.78515625,0.8619721531867981
5x5@56,16,56,56,5,64-128-32/4x3,64,128,32,4,3,block,1.0,1.8788934326171876,0.6387712097167969,0.3399720274858944,7.970668957568705e-05,0.001953125,0.0003597970644477755
5x5@56,16,56,56,5,64-128-32/4x3,64,128,32,4,3,block,0.85,2.295316467285156,0.6387712097167969,0.2782933067492518,0.06970560550689697,2.716796875,0.3917192816734314
5x5@56,16,56,56,5,64-128-32/4x3,64,128,32,4,3,block,0.75,2.1461605834960937,0.6387712097167969,0.2976343963396435,0.1117490902543068,2.81640625,0.4966976046562195
5x5@56,16,56,56,5,64-128-32/4x3,64,128,32,4,3,block,0.65,2.04980224609375,0.6387712097167969,0.311625773136938,0.15376552939414978,2.81640625,0.5829832553863525
5x5@56,16,56,56,5,64-128-32/4x3,64,128,32,4,3,block,0.5,1.8434457397460937,0.6387712097167969,0.34650936338640365,0.2239338606595993,2.81640625,0.7041022777557373
5x5@56,16,56,56,5,64-128-32/4x3,64,128,32,4,3,block,0.35,1.9255897521972656,0.6387712097167969,0.331727570209544,0.29428502917289734,2.81640625,0.8077802062034607
5x5@56,16,56,56,5,64-128-32/4x3,64,128,32,4,3,block,0.25,1.7580851745605468,0.6387712097167969,0.363333482905039,0.3364938795566559,2.81640625,0.864041268825531
5x5@56,16,56,56,5,64-128-32/4x3,64,128,32,4,3,input,1.0,1.8038150024414064,0.6387712097167969,0.3541223511569869,7.970668957568705e-05,0.001953125,0.0003597970644477755
5x5@56,16,56,56,5,64-128-32/4x3,64,128,32,4,3,input,0.85,1.8442649841308594,0.6387712097167969,0.34635543981649064,0.1751173734664917,1.2431640625,0.38961243629455566
5x5@56,16,56,56,5,64-128-32/4x3,64,128,32,4,3,input,0.75,1.6147251892089844,0.6387712097167969,0.39559128326332466,0.22205117344856262,1.4716796875,0.49384382367134094
5x5@56,16,56,56,5,64-128-32/4x3,64,128,32,4,3,input,0.65,1.63162109375,0.6387712097167969,0.39149482202923186,0.2609815299510956,1.740234375,0.5804044008255005
5x5@56,16,56,56,5,64-128-32/4x3,64,128,32,4,3,input,0.5,1.3626162719726562,0.6387712097167969,0.468782901580978,0.31556493043899536,2.157684326171875,0.7018571496009827
5x5@56,16,56,56,5,64-128-32/4x3,64,128,32,4,3,input,0.35,1.2285747528076172,0.6387712097167969,0.5199286476114182,0.362486332654953,2.423828125,0.8060727715492249
5x5@56,16,56,56,5,64-128-32/4x3,64,128,32,4,3,input,0.25,1.0762649536132813,0.6387712097167969,0.5935073957135626,0.3880198001861572,2.6513671875,0.8628667593002319
5x5@56,16,56,56,5,64-64-32/2x2,64,64,32,2,2,dense,1.0,2.3206886291503905,0.6387712097167969,0.27525071726259653,7.970668957568705e-05,0.001953125,0.0003597970644477755
5x5@56,16,56,56,5,64-64-32/2x2,64,64,32,2,2,channel,1.0,2.3070310974121093,0.6387712097167969,0.27688019048955714,7.970668957568705e-05,0.001953125,0.0003597970644477755
5x5@56,16,56,56,5,64-64-32/2x2,64,64,32,2,2,channel,0.85,2.563445739746094,0.6387712097167969,0.24918460329106337,0.0657915398478508,2.603515625,0.37933334708213806
5x5@56,16,56,56,5,64-64-32/2x2,64,64,32,2,2,channel,0.75,2.443837432861328,0.6387712097167969,0.26138040162880305,0.11099284887313843,2.603515625,0.49339136481285095
5x5@56,16,56,56,5,64-64-32/2x2,64,64,32,2,2,channel,0.65,2.468229064941406,0.6387712097167969,0.2587973777595723,0.1563887894153595,2.716796875,0.5862942934036255
5x5@56,16,56,56,5,64-64-32/2x2,64,64,32,2,2,channel,0.5,1.8825830078125,0.6387712097167969,0.33930573423109145,0.22302362322807312,2.783203125,0.7012619972229004
5x5@56,16,56,56,5,64-64-32/2x2,64,64,32,2,2,channel,0.35,1.827368927001953,0.6387712097167969,0.34955788088439693,0.28984329104423523,2.78515625,0.8003247380256653
5x5@56,16,56,56,5,64-64-32/2x2,64,64,32,2,2,channel,0.25,1.7893991088867187,0.6387712097167969,0.3569752586465804,0.3357113301753998,2.78515625,0.8619721531867981
5x5@56,16,56,56,5,64-64-32/2x2,64,64,32,2,2,block,1.0,2.324725799560547,0.6387712097167969,0.27477271075906956,7.970668957568705e-05,0.001953125,0.0003597970644477755
5x5@56,16,56,56,5,64-64-32/2x2,64,64,32,2,2,block,0.85,2.571796569824219,0.6387712097167969,0.2483754808649024,0.06970560550689697,2.716796875,0.3917192816734314
5x5@56,16,56,56,5,64-64-32/2x2,64,64,32,2,2,block,0.75,2.488299560546875,0.6387712097167969,0.2567099314908887,0.1117490902543068,2.81640625,0.4966976046562195
5x5@56,16,56,56,5,64-64-32/2x2,64,64,32,2,2,block,0.65,2.4441407775878905,0.6387712097167969,0.26134796144892963,0.15376552939414978,2.81640625,0.5829832553863525
5x5@56,16,56,56,5,64-64-32/2x2,64,64,32,2,2,block,0.5,1.8924134826660157,0.6387712097167969,0.33754315088523973,0.2239338606595993,2.81640625,0.7041022777557373
5x5@56,16,56,56,5,64-64-32/2x2,64,64,32,2,2,block,0.35,1.8545663452148438,0.6387712097167969,0.34443157634395544,0.29428502917289734,2.81640625,0.8077802062034607
5x5@56,16,56,56,5,64-64-32/2x2,64,64,32,2,2,block,0.25,1.8123992919921874,0.6387712097167969,0.3524450779357016,0.3364938795566559,2.81640625,0.864041268825531
5x5@56,16,56,56,5,64-64-32/2x2,64,64,32,2,2,input,1.0,2.3133413696289065,0.6387712097167969,0.27612492393168286,7.970668957568705e-05,0.001953125,0.0003597970644477755
5x5@56,16,56,56,5,64-64-32/2x2,64,64,32,2,2,input,0.85,2.091294708251953,0.6387712097167969,0.3054429426882285,0.1751173734664917,1.2431640625,0.38961243629455566
5x5@56,16,56,56,5,64-64-32/2x2,64,64,32,2,2,input,0.75,2.082877502441406,0.6387712097167969,0.30667728129382216,0.22205117344856262,1.4716796875,0.49384382367134094
5x5@56,16,56,56,5,64-64-32/2x2,64,64,32,2,2,input,0.65,1.8018695068359376,0.6387712097167969,0.35450470041999427,0.2609815299510956,1.740234375,0.5804044008255005
5x5@56,16,56,56,5,64-64-32/2x2,64,64,32,2,2,input,0.5,1.5517503356933593,0.6387712097167969,0.4116456075592718,0.31556493043899536,2.157684326171875,0.7018571496009827
5x5@56,16,56,56,5,64-64-32/2x2,64,64,32,2,2,input,0.35,1.2766201782226563,0.6387712097167969,0.5003612042276433,0.362486332654953,2.423828125,0.8060727715492249
5x5@56,16,56,56,5,64-64-32/2x2,64,64,32,2,2,input,0.25,1.1779686737060546,0.6387712097167969,0.5422650228100999,0.3880198001861572,2.6513671875,0.8628667593002319
7x7@56,16,56,56,7,64-64-16/4x2,64,64,16,4,2,dense,1.0,5.90874755859375,1.0496192169189453,0.1776381892288438,8.188269566744566e-05,0.001953125,0.0003655000764410943
7x7@56,16,56,56,7,64-64-16/4x2,64,64,16,4,2,channel,1.0,5.859800415039063,1.0496192169189453,0.17912200801670963,8.188269566744566e-05,0.001953125,0.0003655000764410943
7x7@56,16,56,56,7,64-64-16/4x2,64,64,16,4,2,channel,0.85,6.113585205078125,1.0496192169189453,0.17168636433611828,0.06537116318941116,2.58984375,0.38002732396125793
7x7@56,16,56,56,7,64-64-16/4x2,64,64,16,4,2,channel,0.75,5.965107421875,1.0496192169189453,0.17595981810316177,0.11046448349952698,2.912109375,0.49522367119789124
7x7@56,16,56,56,7,64-64-16/4x2,64,64,16,4,2,channel,0.65,6.07193115234375,1.0496192169189453,0.17286414990291762,0.15559552609920502,2.912109375,0.5883733630180359
7x7@56,16,56,56,7,64-64-16/4x2,64,64,16,4,2,channel,0.5,4.007893676757813,1.0496192169189453,0.26188798944587655,0.22170530259609222,2.912109375,0.7030171751976013
7x7@56,16,56,56,7,64-64-16/4x2,64,64,16,4,2,channel,0.35,3.9991134643554687,1.0496192169189453,0.2624629749253966,0.2879222631454468,2.912109375,0.8017253279685974
7x7@56,16,56,56,7,64-64-16/4x2,64,64,16,4,2,channel,0.25,3.9545242309570314,1.0496192169189453,0.26542237589600703,0.33344322443008423,3.037109375,0.8633710741996765
7x7@56,16,56,56,7,64-64-16/4x2,64,64,16,4,2,block,1.0,5.868810424804687,1.0496192169189453,0.17884701343950404,8.188269566744566e-05,0.001953125,0.0003655000764410943
7x7@56,16,56,56,7,64-64-16/4x2,64,64,16,4,2,block,0.85,6.426214599609375,1.0496192169189453,0.16333398156089396,0.0693306252360344,2.912109375,0.3930954337120056
7x7@56,16,56,56,7,64-64-16/4x2,64,64,16,4,2,block,0.75,5.9780712890625,1.0496192169189453,0.17557823688709304,0.11109207570552826,3.037109375,0.49804145097732544
7x7@56,16,56,56,7,64-64-16/4x2,64,64,16,4,2,block,0.65,6.001029052734375,1.0496192169189453,0.17490653814460125,0.15284442901611328,3.037109375,0.5844298005104065
7x7@56,16,56,56,7,64-64-16/4x2,64,64,16,4,2,block,0.5,3.996712951660156,1.0496192169189453,0.2626206158946076,0.2225693315267563,3.037109375,0.7057253122329712
7x7@56,16,56,56,7,64-64-16/4x2,64,64,16,4,2,block,0.35,3.94397705078125,1.0496192169189453,0.26613218165430996,0.29229670763015747,3.037109375,0.808997392654419
7x7@56,16,56,56,7,64-64-16/4x2,64,64,16,4,2,block,0.25,4.187877807617188,1.0496192169189453,0.2506327226190384,0.3341505527496338,3.037109375,0.8652173280715942
7x7@56,16,56,56,7,64-64-16/4x2,64,64,16,4,2,input,1.0,6.0614862060546875,1.0496192169189453,0.17316202351009286,8.188269566744566e-05,0.001953125,0.0003655000764410943
7x7@56,16,56,56,7,64-64-16/4x2,64,64,16,4,2,input,0.85,5.2377392578125,1.0496192169189453,0.20039546935318625,0.17443811893463135,1.2109375,0.39121168851852417
7x7@56,16,56,56,7,64-64-16/4x2,64,64,16,4,2,input,0.75,4.628111267089844,1.0496192169189453,0.22679213103252502,0.2210218757390976,1.5126953125,0.4956643879413605
7x7@56,16,56,56,7,64-64-16/4x2,64,64,16,4,2,input,0.65,4.183674926757813,1.0496192169189453,0.25088450591747097,0.2597707211971283,1.76220703125,0.5826500058174133
7x7@56,16,56,56,7,64-64-16/4x2,64,64,16,4,2,input,0.5,3.2256396484375,1.0496192169189453,0.3253987832854736,0.3138672411441803,2.263153076171875,0.7038652300834656
7x7@56,16,56,56,7,64-64-16/4x2,64,64,16,4,2,input,0.35,2.3797760009765625,1.0496192169189453,0.4410579888561884,0.36021527647972107,2.5814208984375,0.807720959186554
7x7@56,16,56,56,7,64-64-16/4x2,64,64,16,4,2,input,0.25,1.992069091796875,1.0496192169189453,0.52689900226913,0.3853643834590912,2.5814208984375,0.86407071352005
7x7@56,16,56,56,7,64-64-32/4x2,64,64,32,4,2,dense,1.0,4.128993225097656,1.0496192169189453,0.2542070571922821,8.188269566744566e-05,0.001953125,0.0003655000764410943
7x7@56,16,56,56,7,64-64-32/4x2,64,64,32,4,2,channel,1.0,4.246835327148437,1.0496192169189453,0.24715326497571508,8.188269566744566e-05,0.001953125,0.0003655000764410943
7x7@56,16,56,56,7,64-64-32/4x2,64,64,32,4,2,channel,0.85,4.6884371948242185,1.0496192169189453,0.2238740060499623,0.06537116318941116,2.58984375,0.38002732396125793
7x7@56,16,56,56,7,64-64-32/4x2,64,64,32,4,2,channel,0.75,4.36611083984375,1.0496192169189453,0.24040141339071183,0.11046448349952698,2.912109375,0.49522367119789124
7x7@56,16,56,56,7,64-64-32/4x2,64,64,32,4,2,channel,0.65,4.5299508666992185,1.0496192169189453,0.23170653453108156,0.15559552609920502,2.912109375,0.5883733630180359
7x7@56,16,56,56,7,64-64-32/4x2,64,64,32,4,2,channel,0.5,3.1418975830078124,1.0496192169189453,0.3340717477856551,0.22170530259609222,2.912109375,0.7030171751976013
7x7@56,16,56,56,7,64-64-32/4x2,64,64,32,4,2,channel,0.35,3.1479782104492187,1.0496192169189453,0.33342645556913303,0.2879222631454468,2.912109375,0.8017253279685974
7x7@56,16,56,56,7,64-64-32/4x2,64,64,32,4,2,channel,0.25,2.964930419921875,1.0496192169189453,0.35401141620942406,0.33344322443008423,3.037109375,0.8633710741996765
7x7@56,16,56,56,7,64-64-32/4x2,64,64,32,4,2,block,1.0,3.9752908325195313,1.0496192169189453,0.2640358306196427,8.188269566744566e-05,0.001953125,0.0003655000764410943
7x7@56,16,56,56,7,64-64-32/4x2,64,64,32,4,2,block,0.85,4.333793334960937,1.0496192169189453,0.2421941093617945,0.0693306252360344,2.912109375,0.3930954337120056
7x7@56,16,56,56,7,64-64-32/4x2,64,64,32,4,2,block,0.75,4.059053955078125,1.0496192169189453,0.2585871556611874,0.11109207570552826,3.037109375,0.49804145097732544
7x7@56,16,56,56,7,64-64-32/4x2,64,64,32,4,2,block,0.65,4.228587646484375,1.0496192169189453,0.2482198087561442,0.15284442901611328,3.037109375,0.5844298005104065
7x7@56,16,56,56,7,64-64-32/4x2,64,64,32,4,2,block,0.5,3.0070745849609377,1.0496192169189453,0.34904994447704396,0.2225693315267563,3.037109375,0.7057253122329712
7x7@56,16,56,56,7,64-64-32/4x2,64,64,32,4,2,block,0.35,3.078164367675781,1.0496192169189453,0.3409886840160773,0.29229670763015747,3.037109375,0.808997392654419
7x7@56,16,56,56,7,64-64-32/4x2,64,64,32,4,2,block,0.25,2.9628414916992187,1.0496192169189453,0.3542610091898566,0.3341505527496338,3.037109375,0.8652173280715942
7x7@56,16,56,56,7,64-64-32/4x2,64,64,32,4,2,input,1.0,4.056334838867188,1.0496192169189453,0.2587604965107053,8.188269566744566e-05,0.001953125,0.0003655000764410943
7x7@56,16,56,56,7,64-64-32/4x2,64,64,32,4,2,input,0.85,3.7216256713867186,1.0496192169189453,0.28203245291132295,0.17443811893463135,1.2109375,0.39121168851852417
7x7@56,16,56,56,7,64-64-32/4x2,64,64,32,4,2,input,0.75,3.3851800537109376,1.0496192169189453,0.31006303956220016,0.2210218757390976,1.5126953125,0.4956643879413605
7x7@56,16,56,56,7,64-64-32/4x2,64,64,32,4,2,input,0.65,3.1375973510742186,1.0496192169189453,0.33452960959429273,0.2597707211971283,1.76220703125,0.5826500058174133
7x7@56,16,56,56,7,64-64-32/4x2,64,64,32,4,2,input,0.5,2.3849964904785157,1.0496192169189453,0.4400925624458064,0.3138672411441803,2.263153076171875,0.7038652300834656
7x7@56,16,56,56,7,64-64-32/4x2,64,64,32,4,2,input,0.35,1.8930265808105469,1.0496192169189453,0.5544661800097517,0.36021527647972107,2.5814208984375,0.807720959186554
7x7@56,16,56,56,7,64-64-32/4x2,64,64,32,4,2,input,0.25,1.594388427734375,1.0496192169189453,0.6583208951224349,0.3853643834590912,2.5814208984375,0.86407071352005
7x7@56,16,56,56,7,64-64-64/4x2,64,64,64,4,2,dense,1.0,3.1461376953125,1.0496192169189453,0.3336215126511456,8.188269566744566e-05,0.001953125,0.0003655000764410943
7x7@56,16,56,56,7,64-64-64/4x2,64,64,64,4,2,channel,1.0,3.0873599243164063,1.0496192169189453,0.3399730652237927,8.188269566744566e-05,0.001953125,0.0003655000764410943
7x7@56,16,56,56,7,64-64-64/4x2,64,64,64,4,2,channel,0.85,3.4041036987304687,1.0496192169189453,0.30833937794268484,0.06537116318941116,2.58984375,0.38002732396125793
7x7@56,16,56,56,7,64-64-64/4x2,64,64,64,4,2,channel,0.75,3.2945294189453125,1.0496192169189453,0.31859458011911246,0.11046448349952698,2.912109375,0.49522367119789124
7x7@56,16,56,56,7,64-64-64/4x2,64,64,64,4,2,channel,0.65,3.4618426513671876,1.0496192169189453,0.3031966852983392,0.15559552609920502,2.912109375,0.5883733630180359
7x7@56,16,56,56,7,64-64-64/4x2,64,64,64,4,2,channel,0.5,2.6126950073242186,1.0496192169189453,0.401738133986756,0.22170530259609222,2.912109375,0.7030171751976013
7x7@56,16,56,56,7,64-64-64/4x2,64,64,64,4,2,channel,0.35,2.7277926635742187,1.0496192169189453,0.3847870224651284,0.2879222631454468,2.912109375,0.8017253279685974
7x7@56,16,56,56,7,64-64-64/4x2,64,64,64,4,2,channel,0.25,2.555555877685547,1.0496192169189453,0.4107205113705198,0.33344322443008423,3.037109375,0.8633710741996765
7x7@56,16,56,56,7,64-64-64/4x2,64,64,64,4,2,block,1.0,3.0983782958984376,1.0496192169189453,0.3387640619314973,8.188269566744566e-05,0.001953125,0.0003655000764410943
7x7@56,16,56,56,7,64-64-64/4x2,64,64,64,4,2,block,0.85,3.3975909423828123,1.0496192169189453,0.3089304259160822,0.0693306252360344,2.912109375,0.3930954337120056
7x7@56,16,56,56,7,64-64-64/4x2,64,64,64,4,2,block,0.75,3.224698791503906,1.0496192169189453,0.32549372353299183,0.11109207570552826,3.037109375,0.49804145097732544
7x7@56,16,56,56,7,64-64-64/4x2,64,64,64,4,2,block,0.65,3.3219378662109373,1.0496192169189453,0.31596593891629887,0.15284442901611328,3.037109375,0.5844298005104065
7x7@56,16,56,56,7,64-64-64/4x2,64,64,64,4,2,block,0.5,2.5813778686523436,1.0496192169189453,0.40661199960892147,0.2225693315267563,3.037109375,0.7057253122329712
7x7@56,16,56,56,7,64-64-64/4x2,64,64,64,4,2,block,0.35,2.586644592285156,1.0496192169189453,0.4057840880225703,0.29229670763015747,3.037109375,0.808997392654419
7x7@56,16,56,56,7,64-64-64/4x2,64,64,64,4,2,block,0.25,2.4930712890625,1.0496192169189453,0.42101452193677397,0.3341505527496338,3.037109375,0.8652173280715942
7x7@56,16,56,56,7,64-64-64/4x2,64,64,64,4,2,input,1.0,3.0841650390625,1.0496192169189453,0.34032524317764795,8.188269566744566e-05,0.001953125,0.0003655000764410943
7x7@56,16,56,56,7,64-64-64/4x2,64,64,64,4,2,input,0.85,3.0664703369140627,1.0496192169189453,0.34228904949239713,0.17443811893463135,1.2109375,0.39121168851852417
7x7@56,16,56,56,7,64-64-64/4x2,64,64,64,4,2,input,0.75,2.877091979980469,1.0496192169189453,0.36481948586366386,0.2210218757390976,1.5126953125,0.4956643879413605
7x7@56,16,56,56,7,64-64-64/4x2,64,64,64,4,2,input,0.65,2.7630795288085936,1.0496192169189453,0.37987296636790197,0.2597707211971283,1.76220703125,0.5826500058174133
7x7@56,16,56,56,7,64-64-64/4x2,64,64,64,4,2,input,0.5,2.0277638244628906,1.0496192169189453,0.5176239975565035,0.3138672411441803,2.263153076171875,0.7038652300834656
7x7@56,16,56,56,7,64-64-64/4x2,64,64,64,4,2,input,0.35,1.708605499267578,1.0496192169189453,0.6143133785820553,0.36021527647972107,2.5814208984375,0.807720959186554
7x7@56,16,56,56,7,64-64-64/4x2,64,64,64,4,2,input,0.25,1.4137139892578126,1.0496192169189453,0.742455139366617,0.3853643834590912,2.5814208984375,0.86407071352005
7x7@56,16,56,56,7,64-128-32/4x2,64,128,32,4,2,dense,1.0,3.1651019287109374,1.0496192169189453,0.33162256399951945,8.188269566744566e-05,0.001953125,0.0003655000764410943
7x7@56,16,56,56,7,64-128-32/4x2,64,128,32,4,2,channel,1.0,3.210813293457031,1.0496192169189453,0.3269013551980275,8.188269566744566e-05,0.001953125,0.0003655000764410943
7x7@56,16,56,56,7,64-128-32/4x2,64,128,32,4,2,channel,0.85,3.4068069458007812,1.0496192169189453,0.3080947155554859,0.06537116318941116,2.58984375,0.38002732396125793
7x7@56,16,56,56,7,64-128-32/4x2,64,128,32,4,2,channel,0.75,3.206246337890625,1.0496192169189453,0.3273669912741281,0.11046448349952698,2.912109375,0.49522367119789124
7x7@56,16,56,56,7,64-128-32/4x2,64,128,32,4,2,channel,0.65,3.3221835327148437,1.0496192169189453,0.3159425740880759,0.15559552609920502,2.912109375,0.5883733630180359
7x7@56,16,56,56,7,64-128-32/4x2,64,128,32,4,2,channel,0.5,3.095203857421875,1.0496192169189453,0.339111498068892,0.22170530259609222,2.912109375,0.7030171751976013
7x7@56,16,56,56,7,64-128-32/4x2,64,128,32,4,2,channel,0.35,3.1986074829101563,1.0496192169189453,0.3281488030422479,0.2879222631454468,2.912109375,0.8017253279685974
7x7@56,16,56,56,7,64-128-32/4x2,64,128,32,4,2,channel,0.25,3.0063616943359377,1.0496192169189453,0.3491327137704205,0.33344322443008423,3.037109375,0.8633710741996765
7x7@56,16,56,56,7,64-128-32/4x2,64,128,32,4,2,block,1.0,3.0555514526367187,1.0496192169189453,0.3435122049779919,8.188269566744566e-05,0.001953125,0.0003655000764410943
7x7@56,16,56,56,7,64-128-32/4x2,64,128,32,4,2,block,0.85,3.3959115600585936,1.0496192169189453,0.30908320147796636,0.0693306252360344,2.912109375,0.3930954337120056
7x7@56,16,56,56,7,64-128-32/4x2,64,128,32,4,2,block,0.75,3.2062258911132813,1.0496192169189453,0.3273690789623346,0.11109207570552826,3.037109375,0.49804145097732544
7x7@56,16,56,56,7,64-128-32/4x2,64,128,32,4,2,block,0.65,3.4165963745117187,1.0496192169189453,0.30721194483177755,0.15284442901611328,3.037109375,0.5844298005104065
7x7@56,16,56,56,7,64-128-32/4x2,64,128,32,4,2,block,0.5,3.1867495727539064,1.0496192169189453,0.32936984628255295,0.2225693315267563,3.037109375,0.7057253122329712
7x7@56,16,56,56,7,64-128-32/4x2,64,128,32,4,2,block,0.35,3.1815838623046875,1.0496192169189453,0.3299046205743005,0.29229670763015747,3.037109375,0.808997392654419
7x7@56,16,56,56,7,64-128-32/4x2,64,128,32,4,2,block,0.25,2.99939697265625,1.0496192169189453,0.349943414122142,0.3341505527496338,3.037109375,0.8652173280715942
7x7@56,16,56,56,7,64-128-32/4x2,64,128,32,4,2,input,1.0,3.0899188232421877,1.0496192169189453,0.3396915184385335,8.188269566744566e-05,0.001953125,0.0003655000764410943
7x7@56,16,56,56,7,64-128-32/4x2,64,128,32,4,2,input,0.85,2.918293151855469,1.0496192169189453,0.35966887570962186,0.17443811893463135,1.2109375,0.39121168851852417
7x7@56,16,56,56,7,64-128-32/4x2,64,128,32,4,2,input,0.75,2.8172903442382813,1.0496192169189453,0.37256338135881195,0.2210218757390976,1.5126953125,0.4956643879413605
7x7@56,16,56,56,7,64-128-32/4x2,64,128,32,4,2,input,0.65,2.42450439453125,1.0496192169189453,0.4329211443322119,0.2597707211971283,1.76220703125,0.5826500058174133
7x7@56,16,56,56,7,64-128-32/4x2,64,128,32,4,2,input,0.5,1.9053773498535156,1.0496192169189453,0.5508720973300325,0.3138672411441803,2.263153076171875,0.7038652300834656
7x7@56,16,56,56,7,64-128-32/4x2,64,128,32,4,2,input,0.35,1.5832473754882812,1.0496192169189453,0.6629533913455803,0.36021527647972107,2.5814208984375,0.807720959186554
7x7@56,16,56,56,7,64-128-32/4x2,64,128,32,4,2,input,0.25,1.3095071411132813,1.0496192169189453,0.8015376044659127,0.3853643834590912,2.5814208984375,0.86407071352005
7x7@56,16,56,56,7,128-64-32/8x2,128,64,32,8,2,dense,1.0,4.009144287109375,1.0496192169189453,0.26180629624476026,8.188269566744566e-05,0.001953125,0.0003655000764410943
7x7@56,16,56,56,7,128-64-32/8x2,128,64,32,8,2,channel,1.0,4.084046630859375,1.0496192169189453,0.2570047092479162,8.188269566744566e-05,0.001953125,0.0003655000764410943
7x7@56,16,56,56,7,128-64-32/8x2,128,64,32,8,2,channel,0.85,4.428984375,1.0496192169189453,0.23698869267718864,0.06537116318941116,2.58984375,0.38002732396125793
7x7@56,16,56,56,7,128-64-32/8x2,128,64,32,8,2,channel,0.75,4.063539123535156,1.0496192169189453,0.25830173772408727,0.11046448349952698,2.912109375,0.49522367119789124
7x7@56,16,56,56,7,128-64-32/8x2,128,64,32,8,2,channel,0.65,4.437749633789062,1.0496192169189453,0.2365206024529045,0.15559552609920502,2.912109375,0.5883733630180359
7x7@56,16,56,56,7,128-64-32/8x2,128,64,32,8,2,channel,0.5,2.998476867675781,1.0496192169189453,0.350050796867591,0.22170530259609222,2.912109375,0.7030171751976013
7x7@56,16,56,56,7,128-64-32/8x2,128,64,32,8,2,channel,0.35,3.1239764404296877,1.0496192169189453,0.33598819867366714,0.2879222631454468,2.912109375,0.8017253279685974
7x7@56,16,56,56,7,128-64-32/8x2,128,64,32,8,2,channel,0.25,2.9143807983398435,1.0496192169189453,0.360151706158939,0.33344322443008423,3.037109375,0.8633710741996765
7x7@56,16,56,56,7,128-64-32/8x2,128,64,32,8,2,block,1.0,3.9360305786132814,1.0496192169189453,0.26666947727035717,8.188269566744566e-05,0.001953125,0.0003655000764410943
7x7@56,16,56,56,7,128-64-32/8x2,128,64,32,8,2,block,0.85,4.442173461914063,1.0496192169189453,0.23628505863584193,0.0693306252360344,2.912109375,0.3930954337120056
7x7@56,16,56,56,7,128-64-32/8x2,128,64,32,8,2,block,0.75,4.060303344726562,1.0496192169189453,0.25850758620834796,0.11109207570552826,3.037109375,0.49804145097732544
7x7@56,16,56,56,7,128-64-32/8x2,128,64,32,8,2,block,0.65,4.445839233398438,1.0496192169189453,0.23609023219595984,0.15284442901611328,3.037109375,0.5844298005104065
7x7@56,16,56,56,7,128-64-32/8x2,128,64,32,8,2,block,0.5,3.0719955444335936,1.0496192169189453,0.3416734177303214,0.2225693315267563,3.037109375,0.7057253122329712
7x7@56,16,56,56,7,128-64-32/8x2,128,64,32,8,2,block,0.35,3.1449700927734376,1.0496192169189453,0.3337453730739052,0.29229670763015747,3.037109375,0.808997392654419
7x7@56,16,56,56,7,128-64-32/8x2,128,64,32,8,2,block,0.25,2.9168231201171877,1.0496192169189453,0.3598501430133944,0.3341505527496338,3.037109375,0.8652173280715942
7x7@56,16,56,56,7,128-64-32/8x2,128,64,32,8,2,input,1.0,3.920465393066406,1.0496192169189453,0.2677282188934161,8.188269566744566e-05,0.001953125,0.0003655000764410943
7x7@56,16,56,56,7,128-64-32/8x2,128,64,32,8,2,input,0.85,3.9185614013671874,1.0496192169189453,0.26785830548750184,0.17443811893463135,1.2109375,0.39121168851852417
7x7@56,16,56,56,7,128-64-32/8x2,128,64,32,8,2,input,0.75,3.612405090332031,1.0496192169189453,0.2905596661149845,0.2210218757390976,1.5126953125,0.4956643879413605
7x7@56,16,56,56,7,128-64-32/8x2,128,64,32,8,2,input,0.65,3.2508108520507815,1.0496192169189453,0.32287920297078826,0.2597707211971283,1.76220703125,0.5826500058174133
7x7@56,16,56,56,7,128-64-32/8x2,128,64,32,8,2,input,0.5,2.479636535644531,1.0496192169189453,0.4232955926527023,0.3138672411441803,2.263153076171875,0.7038652300834656
7x7@56,16,56,56,7,128-64-32/8x2,128,64,32,8,2,input,0.35,1.9551846313476562,1.0496192169189453,0.5368389256391971,0.36021527647972107,2.5814208984375,0.807720959186554
7x7@56,16,56,56,7,128-64-32/8x2,128,64,32,8,2,input,0.25,1.641922607421875,1.0496192169189453,0.6392622966359197,0.3853643834590912,2.5814208984375,0.86407071352005
7x7@56,16,56,56,7,128-128-32/8x2,128,128,32,8,2,dense,1.0,3.3860403442382814,1.0496192169189453,0.3099842619137682,8.188269566744566e-05,0.001953125,0.0003655000764410943
7x7@56,16,56,56,7,128-128-32/8x2,128,128,32,8,2,channel,1.0,3.31905029296875,1.0496192169189453,0.31624082923434865,8.188269566744566e-05,0.001953125,0.0003655000764410943
7x7@56,16,56,56,7,128-128-32/8x2,128,128,32,8,2,channel,0.85,4.313205871582031,1.0496192169189453,0.24335013170469366,0.06537116318941116,2.58984375,0.38002732396125793
7x7@56,16,56,56,7,128-128-32/8x2,128,128,32,8,2,channel,0.75,3.2894757080078123,1.0496192169189453,0.319084045631886,0.11046448349952698,2.912109375,0.49522367119789124
7x7@56,16,56,56,7,128-128-32/8x2,128,128,32,8,2,channel,0.65,4.168949890136719,1.0496192169189453,0.2517706483837165,0.15559552609920502,2.912109375,0.5883733630180359
7x7@56,16,56,56,7,128-128-32/8x2,128,128,32,8,2,channel,0.5,3.15009033203125,1.0496192169189453,0.3332028946110021,0.22170530259609222,2.912109375,0.7030171751976013
7x7@56,16,56,56,7,128-128-32/8x2,128,128,32,8,2,channel,0.35,3.9743283081054686,1.0496192169189453,0.2640997762510694,0.2879222631454468,2.912109375,0.8017253279685974
7x7@56,16,56,56,7,128-128-32/8x2,128,128,32,8,2,channel,0.25,3.225865478515625,1.0496192169189453,0.32537600340418577,0.33344322443008423,3.037109375,0.8633710741996765
7x7@56,16,56,56,7,128-128-32/8x2,128,128,32,8,2,block,1.0,3.249397888183594,1.0496192169189453,0.3230196033350905,8.188269566744566e-05,0.001953125,0.0003655000764410943
7x7@56,16,56,56,7,128-128-32/8x2,128,128,32,8,2,block,0.85,4.235242309570313,1.0496192169189453,0.2478297911189489,0.0693306252360344,2.912109375,0.3930954337120056
7x7@56,16,56,56,7,128-128-32/8x2,128,128,32,8,2,block,0.75,3.45153076171875,1.0496192169189453,0.30410252417865435,0.11109207570552826,3.037109375,0.49804145097732544
7x7@56,16,56,56,7,128-128-32/8x2,128,128,32,8,2,block,0.65,4.143841247558594,1.0496192169189453,0.25329619408980597,0.15284442901611328,3.037109375,0.5844298005104065
7x7@56,16,56,56,7,128-128-32/8x2,128,128,32,8,2,block,0.5,3.1509344482421877,1.0496192169189453,0.3331136315782439,0.2225693315267563,3.037109375,0.7057253122329712
7x7@56,16,56,56,7,128-128-32/8x2,128,128,32,8,2,block,0.35,3.951513671875,1.0496192169189453,0.26562459454199466,0.29229670763015747,3.037109375,0.808997392654419
7x7@56,16,56,56,7,128-128-32/8x2,128,128,32,8,2,block,0.25,3.1714508056640627,1.0496192169189453,0.33095869406026246,0.3341505527496338,3.037109375,0.8652173280715942
7x7@56,16,56,56,7,128-128-32/8x2,128,128,32,8,2,input,1.0,3.2506060791015625,1.0496192169189453,0.32289954284742195,8.188269566744566e-05,0.001953125,0.0003655000764410943
7x7@56,16,56,56,7,128-128-32/8x2,128,128,32,8,2,input,0.85,3.3163986206054688,1.0496192169189453,0.31649368396110306,0.17443811893463135,1.2109375,0.39121168851852417
7x7@56,16,56,56,7,128-128-32/8x2,128,128,32,8,2,input,0.75,2.798837890625,1.0496192169189453,0.3750196538480326,0.2210218757390976,1.5126953125,0.4956643879413605
7x7@56,16,56,56,7,128-128-32/8x2,128,128,32,8,2,input,0.65,2.70350341796875,1.0496192169189453,0.38824408726198917,0.2597707211971283,1.76220703125,0.5826500058174133
7x7@56,16,56,56,7,128-128-32/8x2,128,128,32,8,2,input,0.5,1.9282534790039063,1.0496192169189453,0.5443367422114834,0.3138672411441803,2.263153076171875,0.7038652300834656
7x7@56,16,56,56,7,128-128-32/8x2,128,128,32,8,2,input,0.35,1.8827737426757813,1.0496192169189453,0.5574855826421479,0.36021527647972107,2.5814208984375,0.807720959186554
7x7@56,16,56,56,7,128-128-32/8x2,128,128,32,8,2,input,0.25,1.3366680908203126,1.0496192169189453,0.7852504478316636,0.3853643834590912,2.5814208984375,0.86407071352005
7x7@56,16,56,56,7,128-128-64/8x2,128,128,64,8,2,dense,1.0,3.2498074340820313,1.0496192169189453,0.322978895891236,8.188269566744566e-05,0.001953125,0.0003655000764410943
7x7@56,16,56,56,7,128-128-64/8x2,128,128,64,8,2,channel,1.0,3.176202392578125,1.0496192169189453,0.3304635810902998,8.188269566744566e-05,0.001953125,0.0003655000764410943
7x7@56,16,56,56,7,128-128-64/8x2,128,128,64,8,2,channel,0.85,3.701002197265625,1.0496192169189453,0.2836040512741184,0.06537116318941116,2.58984375,0.38002732396125793
7x7@56,16,56,56,7,128-128-64/8x2,128,128,64,8,2,channel,0.75,3.524136962890625,1.0496192169189453,0.29783723730703404,0.11046448349952698,2.912109375,0.49522367119789124
7x7@56,16,56,56,7,128-128-64/8x2,128,128,64,8,2,channel,0.65,3.5812557983398436,1.0496192169189453,0.2930869158817182,0.15559552609920502,2.912109375,0.5883733630180359
7x7@56,16,56,56,7,128-128-64/8x2,128,128,64,8,2,channel,0.5,3.394498596191406,1.0496192169189453,0.3092118577090024,0.22170530259609222,2.912109375,0.7030171751976013
7x7@56,16,56,56,7,128-128-64/8x2,128,128,64,8,2,channel,0.35,3.457966003417969,1.0496192169189453,0.30353659228617824,0.2879222631454468,2.912109375,0.8017253279685974
7x7@56,16,56,56,7,128-128-64/8x2,128,128,64,8,2,channel,0.25,3.1415499877929687,1.0496192169189453,0.3341087109857939,0.33344322443008423,3.037109375,0.8633710741996765
7x7@56,16,56,56,7,128-128-64/8x2,128,128,64,8,2,block,1.0,3.1948345947265624,1.0496192169189453,0.3285363250577858,8.188269566744566e-05,0.001953125,0.0003655000764410943
7x7@56,16,56,56,7,128-128-64/8x2,128,128,64,8,2,block,0.85,3.8198681640625,1.0496192169189453,0.2747789116896265,0.0693306252360344,2.912109375,0.3930954337120056
7x7@56,16,56,56,7,128-128-64/8x2,128,128,64,8,2,block,0.75,3.368328857421875,1.0496192169189453,0.31161423404552185,0.11109207570552826,3.037109375,0.49804145097732544
7x7@56,16,56,56,7,128-128-64/8x2,128,128,64,8,2,block,0.65,3.5870925903320314,1.0496192169189453,0.2926100150712278,0.15284442901611328,3.037109375,0.5844298005104065
7x7@56,16,56,56,7,128-128-64/8x2,128,128,64,8,2,block,0.5,3.218575439453125,1.0496192169189453,0.32611297658360566,0.2225693315267563,3.037109375,0.7057253122329712
7x7@56,16,56,56,7,128-128-64/8x2,128,128,64,8,2,block,0.35,3.4590719604492186,1.0496192169189453,0.30343954358863195,0.29229670763015747,3.037109375,0.808997392654419
7x7@56,16,56,56,7,128-128-64/8x2,128,128,64,8,2,block,0.25,3.295047607421875,1.0496192169189453,0.3185444770372204,0.3341505527496338,3.037109375,0.8652173280715942
7x7@56,16,56,56,7,128-128-64/8x2,128,128,64,8,2,input,1.0,3.2255795288085936,1.0496192169189453,0.3254048481968866,8.188269566744566e-05,0.001953125,0.0003655000764410943
7x7@56,16,56,56,7,128-128-64/8x2,128,128,64,8,2,input,0.85,3.080560607910156,1.0496192169189453,0.3407234430719427,0.17443811893463135,1.2109375,0.39121168851852417
7x7@56,16,56,56,7,128-128-64/8x2,128,128,64,8,2,input,0.75,2.659921875,1.0496192169189453,0.3946052802467912,0.2210218757390976,1.5126953125,0.4956643879413605
7x7@56,16,56,56,7,128-128-64/8x2,128,128,64,8,2,input,0.65,2.644500427246094,1.0496192169189453,0.39690642743135734,0.2597707211971283,1.76220703125,0.5826500058174133
7x7@56,16,56,56,7,128-128-64/8x2,128,128,64,8,2,input,0.5,1.9937893676757812,1.0496192169189453,0.5264443847157824,0.3138672411441803,2.263153076171875,0.7038652300834656
7x7@56,16,56,56,7,128-128-64/8x2,128,128,64,8,2,input,0.35,1.6762879943847657,1.0496192169189453,0.6261568539743545,0.36021527647972107,2.5814208984375,0.807720959186554
7x7@56,16,56,56,7,128-128-64/8x2,128,128,64,8,2,input,0.25,1.3844306945800782,1.0496192169189453,0.7581594521330033,0.3853643834590912,2.5814208984375,0.86407071352005
7x7@56,16,56,56,7,128-64-32/8x3,128,64,32,8,3,dense,1.0,3.989462890625,1.0496192169189453,0.2630978770063228,8.188269566744566e-05,0.001953125,0.0003655000764410943
7x7@56,16,56,56,7,128-64-32/8x3,128,64,32,8,3,channel,1.0,4.00279541015625,1.0496192169189453,0.26222155003369835,8.188269566744566e-05,0.001953125,0.0003655000764410943
7x7@56,16,56,56,7,128-64-32/8x3,128,64,32,8,3,channel,0.85,4.317880249023437,1.0496192169189453,0.24308668985350734,0.06537116318941116,2.58984375,0.38002732396125793
7x7@56,16,56,56,7,128-64-32/8x3,128,64,32,8,3,channel,0.75,4.2214208984375,1.0496192169189453,0.24864121398258282,0.11046448349952698,2.912109375,0.49522367119789124
7x7@56,16,56,56,7,128-64-32/8x3,128,64,32,8,3,channel,0.65,4.2641818237304685,1.0496192169189453,0.2461478568005101,0.15559552609920502,2.912109375,0.5883733630180359
7x7@56,16,56,56,7,128-64-32/8x3,128,64,32,8,3,channel,0.5,3.1138201904296876,1.0496192169189453,0.3370840808807603,0.22170530259609222,2.912109375,0.7030171751976013
7x7@56,16,56,56,7,128-64-32/8x3,128,64,32,8,3,channel,0.35,3.1360818481445314,1.0496192169189453,0.33469127010825767,0.2879222631454468,2.912109375,0.8017253279685974
7x7@56,16,56,56,7,128-64-32/8x3,128,64,32,8,3,channel,0.25,3.0204928588867186,1.0496192169189453,0.34749932079157764,0.33344322443008423,3.037109375,0.8633710741996765
7x7@56,16,56,56,7,128-64-32/8x3,128,64,32,8,3,block,1.0,4.084141540527344,1.0496192169189453,0.25699873682228425,8.188269566744566e-05,0.001953125,0.0003655000764410943
7x7@56,16,56,56,7,128-64-32/8x3,128,64,32,8,3,block,0.85,4.363939819335937,1.0496192169189453,0.2405210109150099,0.0693306252360344,2.912109375,0.3930954337120056
7x7@56,16,56,56,7,128-64-32/8x3,128,64,32,8,3,block,0.75,4.221372680664063,1.0496192169189453,0.2486440540364302,0.11109207570552826,3.037109375,0.49804145097732544
7x7@56,16,56,56,7,128-64-32/8x3,128,64,32,8,3,block,0.65,4.260618286132813,1.0496192169189453,0.2463537323526913,0.15284442901611328,3.037109375,0.5844298005104065
7x7@56,16,56,56,7,128-64-32/8x3,128,64,32,8,3,block,0.5,3.17085693359375,1.0496192169189453,0.3310206795515494,0.2225693315267563,3.037109375,0.7057253122329712
7x7@56,16,56,56,7,128-64-32/8x3,128,64,32,8,3,block,0.35,3.159859313964844,1.0496192169189453,0.3321727686673278,0.29229670763015747,3.037109375,0.808997392654419
7x7@56,16,56,56,7,128-64-32/8x3,128,64,32,8,3,block,0.25,3.0348696899414063,1.0496192169189453,0.3458531417008584,0.3341505527496338,3.037109375,0.8652173280715942
7x7@56,16,56,56,7,128-64-32/8x3,128,64,32,8,3,input,1.0,4.0340869140625,1.0496192169189453,0.2601875565100142,8.188269566744566e-05,0.001953125,0.0003655000764410943
7x7@56,16,56,56,7,128-64-32/8x3,128,64,32,8,3,input,0.85,3.822633056640625,1.0496192169189453,0.2745801653903352,0.17443811893463135,1.2109375,0.39121168851852417
7x7@56,16,56,56,7,128-64-32/8x3,128,64,32,8,3,input,0.75,3.4769100952148437,1.0496192169189453,0.3018827603174156,0.2210218757390976,1.5126953125,0.4956643879413605
7x7@56,16,56,56,7,128-64-32/8x3,128,64,32,8,3,input,0.65,3.122974853515625,1.0496192169189453,0.33609595534762565,0.2597707211971283,1.76220703125,0.5826500058174133
7x7@56,16,56,56,7,128-64-32/8x3,128,64,32,8,3,input,0.5,2.407034912109375,1.0496192169189453,0.4360631462545446,0.3138672411441803,2.263153076171875,0.7038652300834656
7x7@56,16,56,56,7,128-64-32/8x3,128,64,32,8,3,input,0.35,1.9061375427246094,1.0496192169189453,0.5506524022493322,0.36021527647972107,2.5814208984375,0.807720959186554
7x7@56,16,56,56,7,128-64-32/8x3,128,64,32,8,3,input,0.25,1.6196620178222656,1.0496192169189453,0.6480482998114769,0.3853643834590912,2.5814208984375,0.86407071352005
7x7@56,16,56,56,7,64-128-32/4x3,64,128,32,4,3,dense,1.0,3.112837219238281,1.0496192169189453,0.3371905252327296,8.188269566744566e-05,0.001953125,0.0003655000764410943
7x7@56,16,56,56,7,64-128-32/4x3,64,128,32,4,3,channel,1.0,3.086988830566406,1.0496192169189453,0.34001393413735137,8.188269566744566e-05,0.001953125,0.0003655000764410943
7x7@56,16,56,56,7,64-128-32/4x3,64,128,32,4,3,channel,0.85,3.4165554809570313,1.0496192169189453,0.3072156219236722,0.06537116318941116,2.58984375,0.38002732396125793
7x7@56,16,56,56,7,64-128-32/4x3,64,128,32,4,3,channel,0.75,3.2225689697265625,1.0496192169189453,0.32570884495546,0.11046448349952698,2.912109375,0.49522367119789124
7x7@56,16,56,56,7,64-128-32/4x3,64,128,32,4,3,channel,0.65,3.3492376708984377,1.0496192169189453,0.31339048465837405,0.15559552609920502,2.912109375,0.5883733630180359
7x7@56,16,56,56,7,64-128-32/4x3,64,128,32,4,3,channel,0.5,3.095203857421875,1.0496192169189453,0.339111498068892,0.22170530259609222,2.912109375,0.7030171751976013
7x7@56,16,56,56,7,64-128-32/4x3,64,128,32,4,3,channel,0.35,3.19109130859375,1.0496192169189453,0.32892171217171834,0.2879222631454468,2.912109375,0.8017253279685974
7x7@56,16,56,56,7,64-128-32/4x3,64,128,32,4,3,channel,0.25,3.0370187377929687,1.0496192169189453,0.34560840993747505,0.33344322443008423,3.037109375,0.8633710741996765
7x7@56,16,56,56,7,64-128-32/4x3,64,128,32,4,3,block,1.0,3.055144958496094,1.0496192169189453,0.3435579100756071,8.188269566744566e-05,0.001953125,0.0003655000764410943
7x7@56,16,56,56,7,64-128-32/4x3,64,128,32,4,3,block,0.85,3.3804281616210936,1.0496192169189453,0.31049889739872405,0.0693306252360344,2.912109375,0.3930954337120056
7x7@56,16,56,56,7,64-128-32/4x3,64,128,32,4,3,block,0.75,3.2549478149414064,1.0496192169189453,0.32246883102113266,0.11109207570552826,3.037109375,0.49804145097732544
7x7@56,16,56,56,7,64-128-32/4x3,64,128,32,4,3,block,0.65,3.37944580078125,1.0496192169189453,0.31058915538053533,0.15284442901611328,3.037109375,0.5844298005104065
7x7@56,16,56,56,7,64-128-32/4x3,64,128,32,4,3,block,0.5,3.1411572265625,1.0496192169189453,0.33415048697437777,0.2225693315267563,3.037109375,0.7057253122329712
7x7@56,16,56,56,7,64-128-32/4x3,64,128,32,4,3,block,0.35,3.1615386962890626,1.0496192169189453,0.3319963213326988,0.29229670763015747,3.037109375,0.808997392654419
7x7@56,16,56,56,7,64-128-32/4x3,64,128,32,4,3,block,0.25,3.0145535278320312,1.0496192169189453,0.34818397060403083,0.3341505527496338,3.037109375,0.8652173280715942
7x7@56,16,56,56,7,64-128-32/4x3,64,128,32,4,3,input,1.0,3.075051574707031,1.0496192169189453,0.3413338577968227,8.188269566744566e-05,0.001953125,0.0003655000764410943
7x7@56,16,56,56,7,64-128-32/4x3,64,128,32,4,3,input,0.85,2.9898956298828123,1.0496192169189453,0.35105547044131596,0.17443811893463135,1.2109375,0.39121168851852417
7x7@56,16,56,56,7,64-128-32/4x3,64,128,32,4,3,input,0.75,2.6980966186523436,1.0496192169189453,0.389022101604061,0.2210218757390976,1.5126953125,0.4956643879413605
7x7@56,16,56,56,7,64-128-32/4x3,64,128,32,4,3,input,0.65,2.5654067993164062,1.0496192169189453,0.4091433831073626,0.2597707211971283,1.76220703125,0.5826500058174133
7x7@56,16,56,56,7,64-128-32/4x3,64,128,32,4,3,input,0.5,1.9558808898925781,1.0496192169189453,0.5366478206025077,0.3138672411441803,2.263153076171875,0.7038652300834656
7x7@56,16,56,56,7,64-128-32/4x3,64,128,32,4,3,input,0.35,1.6438887023925781,1.0496192169189453,0.638497737341518,0.36021527647972107,2.5814208984375,0.807720959186554
7x7@56,16,56,56,7,64-128-32/4x3,64,128,32,4,3,input,0.25,1.3576806640625,1.0496192169189453,0.7730972714734241,0.3853643834590912,2.5814208984375,0.86407071352005
7x7@56,16,56,56,7,64-64-32/2x2,64,64,32,2,2,dense,1.0,4.192808837890625,1.0496192169189453,0.25033796137650816,8.188269566744566e-05,0.001953125,0.0003655000764410943
7x7@56,16,56,56,7,64-64-32/2x2,64,64,32,2,2,channel,1.0,4.1612939453125,1.0496192169189453,0.25223385579413143,8.188269566744566e-05,0.001953125,0.0003655000764410943
7x7@56,16,56,56,7,64-64-32/2x2,64,64,32,2,2,channel,0.85,4.822466430664062,1.0496192169189453,0.21765194885439793,0.06537116318941116,2.58984375,0.38002732396125793
7x7@56,16,56,56,7,64-64-32/2x2,64,64,32,2,2,channel,0.75,4.284415893554687,1.0496192169189453,0.24498537093421596,0.11046448349952698,2.912109375,0.49522367119789124
7x7@56,16,56,56,7,64-64-32/2x2,64,64,32,2,2,channel,0.65,4.497592468261718,1.0496192169189453,0.2333735713775362,0.15559552609920502,2.912109375,0.5883733630180359
7x7@56,16,56,56,7,64-64-32/2x2,64,64,32,2,2,channel,0.5,3.0481613159179686,1.0496192169189453,0.3443450356244835,0.22170530259609222,2.912109375,0.7030171751976013
7x7@56,16,56,56,7,64-64-32/2x2,64,64,32,2,2,channel,0.35,3.1322930908203124,1.0496192169189453,0.33509610578748933,0.2879222631454468,2.912109375,0.8017253279685974
7x7@56,16,56,56,7,64-64-32/2x2,64,64,32,2,2,channel,0.25,2.941767578125,1.0496192169189453,0.35679882555097814,0.33344322443008423,3.037109375,0.8633710741996765
7x7@56,16,56,56,7,64-64-32/2x2,64,64,32,2,2,block,1.0,3.969950866699219,1.0496192169189453,0.2643909842117623,8.188269566744566e-05,0.001953125,0.0003655000764410943
7x7@56,16,56,56,7,64-64-32/2x2,64,64,32,2,2,block,0.85,4.580208740234375,1.0496192169189453,0.22916405702182802,0.0693306252360344,2.912109375,0.3930954337120056
7x7@56,16,56,56,7,64-64-32/2x2,64,64,32,2,2,block,0.75,4.11146240234375,1.0496192169189453,0.25529096808002116,0.11109207570552826,3.037109375,0.49804145097732544
7x7@56,16,56,56,7,64-64-32/2x2,64,64,32,2,2,block,0.65,4.470865783691406,1.0496192169189453,0.23476867070080526,0.15284442901611328,3.037109375,0.5844298005104065
7x7@56,16,56,56,7,64-64-32/2x2,64,64,32,2,2,block,0.5,3.0443692016601562,1.0496192169189453,0.3447739572278443,0.2225693315267563,3.037109375,0.7057253122329712
7x7@56,16,56,56,7,64-64-32/2x2,64,64,32,2,2,block,0.35,3.157975158691406,1.0496192169189453,0.3323709542268483,0.29229670763015747,3.037109375,0.808997392654419
7x7@56,16,56,56,7,64-64-32/2x2,64,64,32,2,2,block,0.25,2.948362121582031,1.0496192169189453,0.3560007806489323,0.3341505527496338,3.037109375,0.8652173280715942
7x7@56,16,56,56,7,64-64-32/2x2,64,64,32,2,2,input,1.0,3.9660748291015624,1.0496192169189453,0.2646493730318034,8.188269566744566e-05,0.001953125,0.0003655000764410943
7x7@56,16,56,56,7,64-64-32/2x2,64,64,32,2,2,input,0.85,3.732705383300781,1.0496192169189453,0.2811953018351481,0.17443811893463135,1.2109375,0.39121168851852417
7x7@56,16,56,56,7,64-64-32/2x2,64,64,32,2,2,input,0.75,3.5131802368164062,1.0496192169189453,0.2987661167848579,0.2210218757390976,1.5126953125,0.4956643879413605
7x7@56,16,56,56,7,64-64-32/2x2,64,64,32,2,2,input,0.65,3.2962969970703124,1.0496192169189453,0.3184237396848122,0.2597707211971283,1.76220703125,0.5826500058174133
7x7@56,16,56,56,7,64-64-32/2x2,64,64,32,2,2,input,0.5,2.353623046875,1.0496192169189453,0.4459589305571115,0.3138672411441803,2.263153076171875,0.7038652300834656
7x7@56,16,56,56,7,64-64-32/2x2,64,64,32,2,2,input,0.35,1.961676788330078,1.0496192169189453,0.5350622605941407,0.36021527647972107,2.5814208984375,0.807720959186554
7x7@56,16,56,56,7,64-64-32/2x2,64,64,32,2,2,input,0.25,1.6842118835449218,1.0496192169189453,0.6232109078281239,0.3853643834590912,2.5814208984375,0.86407071352005
11x11@56,8,56,56,11,64-64-16/4x2,64,64,16,4,2,dense,1.0,7.276503295898437,1.3528492736816407,0.1859202447478041,7.736668339930475e-05,0.001953125,0.00035940948873758316
11x11@56,8,56,56,11,64-64-16/4x2,64,64,16,4,2,channel,1.0,7.284940795898438,1.3528492736816407,0.18570490983857013,7.736668339930475e-05,0.001953125,0.00035940948873758316
11x11@56,8,56,56,11,64-64-16/4x2,64,64,16,4,2,channel,0.85,7.434874877929688,1.3528492736816407,0.18195992479948156,0.06435902416706085,2.787109375,0.3825811445713043
11x11@56,8,56,56,11,64-64-16/4x2,64,64,16,4,2,channel,0.75,7.352770385742187,1.3528492736816407,0.18399177489684174,0.10850878059864044,2.787109375,0.4973548650741577
11x11@56,8,56,56,11,64-64-16/4x2,64,64,16,4,2,channel,0.65,7.09285888671875,1.3528492736816407,0.19073398967725505,0.15263067185878754,2.787109375,0.5900652408599854
11x11@56,8,56,56,11,64-64-16/4x2,64,64,16,4,2,channel,0.5,5.273046875,1.3528492736816407,0.25655931110637825,0.21732069551944733,2.798828125,0.7046086192131042
11x11@56,8,56,56,11,64-64-16/4x2,64,64,16,4,2,channel,0.35,5.02192138671875,1.3528492736816407,0.26938877961320945,0.28217917680740356,2.89453125,0.8033522367477417
11x11@56,8,56,56,11,64-64-16/4x2,64,64,16,4,2,channel,0.25,5.092761535644531,1.3528492736816407,0.26564159036565343,0.3265678286552429,2.89453125,0.8644919395446777
11x11@56,8,56,56,11,64-64-16/4x2,64,64,16,4,2,block,1.0,7.141724243164062,1.3528492736816407,0.18942894287420367,7.736668339930475e-05,0.001953125,0.00035940948873758316
11x11@56,8,56,56,11,64-64-16/4x2,64,64,16,4,2,block,0.85,7.004712524414063,1.3528492736816407,0.1931341606049429,0.06809768825769424,2.787109375,0.3946295976638794
11x11@56,8,56,56,11,64-64-16/4x2,64,64,16,4,2,block,0.75,7.202877197265625,1.3528492736816407,0.18782067729756838,0.10881530493497849,2.787109375,0.49873700737953186
11x11@56,8,56,56,11,64-64-16/4x2,64,64,16,4,2,block,0.65,7.13175048828125,1.3528492736816407,0.18969385929928642,0.14967487752437592,2.89453125,0.5850745439529419
11x11@56,8,56,56,11,64-64-16/4x2,64,64,16,4,2,block,0.5,4.919255065917969,1.3528492736816407,0.27501100381124255,0.2177501618862152,2.89453125,0.7058829069137573
11x11@56,8,56,56,11,64-64-16/4x2,64,64,16,4,2,block,0.35,4.630507507324219,1.3528492736816407,0.29216004326562406,0.28599274158477783,2.89453125,0.8092793226242065
11x11@56,8,56,56,11,64-64-16/4x2,64,64,16,4,2,block,0.25,4.779208984375,1.3528492736816407,0.2830697042344465,0.3268945515155792,2.89453125,0.865381121635437
11x11@56,8,56,56,11,64-64-16/4x2,64,64,16,4,2,input,1.0,7.113297119140625,1.3528492736816407,0.1901859645425695,7.736668339930475e-05,0.001953125,0.00035940948873758316
11x11@56,8,56,56,11,64-64-16/4x2,64,64,16,4,2,input,0.85,6.240148315429687,1.3528492736816407,0.21679761526445152,0.1715175062417984,1.12353515625,0.3933069407939911
11x11@56,8,56,56,11,64-64-16/4x2,64,64,16,4,2,input,0.75,5.720227661132813,1.3528492736816407,0.23650269776390812,0.2169593870639801,1.53173828125,0.4974372982978821
11x11@56,8,56,56,11,64-64-16/4x2,64,64,16,4,2,input,0.65,4.964761657714844,1.3528492736816407,0.27249027585834273,0.2547619044780731,1.69580078125,0.5840826034545898
11x11@56,8,56,56,11,64-64-16/4x2,64,64,16,4,2,input,0.5,3.7596978759765625,1.3528492736816407,0.3598292517933359,0.3077698051929474,1.983154296875,0.7056899070739746
11x11@56,8,56,56,11,64-64-16/4x2,64,64,16,4,2,input,0.35,2.7445452880859373,1.3528492736816407,0.49292291861765053,0.35286808013916016,2.561279296875,0.80897057056427
11x11@56,8,56,56,11,64-64-16/4x2,64,64,16,4,2,input,0.25,2.1351167297363283,1.3528492736816407,0.6336184129139899,0.37734097242355347,2.81787109375,0.8651084303855896
11x11@56,8,56,56,11,64-64-32/4x2,64,64,32,4,2,dense,1.0,4.662599792480469,1.3528492736816407,0.29014913007619186,7.736668339930475e-05,0.001953125,0.00035940948873758316
11x11@56,8,56,56,11,64-64-32/4x2,64,64,32,4,2,channel,1.0,4.514959411621094,1.3528492736816407,0.29963708426692165,7.736668339930475e-05,0.001953125,0.00035940948873758316
11x11@56,8,56,56,11,64-64-32/4x2,64,64,32,4,2,channel,0.85,5.088911437988282,1.3528492736816407,0.2658425657760004,0.06435902416706085,2.787109375,0.3825811445713043
11x11@56,8,56,56,11,64-64-32/4x2,64,64,32,4,2,channel,0.75,4.750028686523438,1.3528492736816407,0.28480865337084854,0.10850878059864044,2.787109375,0.4973548650741577
11x11@56,8,56,56,11,64-64-32/4x2,64,64,32,4,2,channel,0.65,4.9515142822265625,1.3528492736816407,0.27321930152512874,0.15263067185878754,2.787109375,0.5900652408599854
11x11@56,8,56,56,11,64-64-32/4x2,64,64,32,4,2,channel,0.5,3.4133810424804687,1.3528492736816407,0.396337020931756,0.21732069551944733,2.798828125,0.7046086192131042
11x11@56,8,56,56,11,64-64-32/4x2,64,64,32,4,2,channel,0.35,3.6941409301757813,1.3528492736816407,0.3662148519107166,0.28217917680740356,2.89453125,0.8033522367477417
11x11@56,8,56,56,11,64-64-32/4x2,64,64,32,4,2,channel,0.25,3.3364376831054687,1.3528492736816407,0.405477159226437,0.3265678286552429,2.89453125,0.8644919395446777
11x11@56,8,56,56,11,64-64-32/4x2,64,64,32,4,2,block,1.0,4.713366394042969,1.3528492736816407,0.2870239995327865,7.736668339930475e-05,0.001953125,0.00035940948873758316
11x11@56,8,56,56,11,64-64-32/4x2,64,64,32,4,2,block,0.85,4.825821533203125,1.3528492736816407,0.28033553756052204,0.06809768825769424,2.787109375,0.3946295976638794
11x11@56,8,56,56,11,64-64-32/4x2,64,64,32,4,2,block,0.75,4.616089477539062,1.3528492736816407,0.2930725845467957,0.10881530493497849,2.787109375,0.49873700737953186
11x11@56,8,56,56,11,64-64-32/4x2,64,64,32,4,2,block,0.65,5.582807006835938,1.3528492736816407,0.24232420573111832,0.14967487752437592,2.89453125,0.5850745439529419
11x11@56,8,56,56,11,64-64-32/4x2,64,64,32,4,2,block,0.5,3.4239486694335937,1.3528492736816407,0.3951137719320528,0.2177501618862152,2.89453125,0.7058829069137573
11x11@56,8,56,56,11,64-64-32/4x2,64,64,32,4,2,block,0.35,3.5696026611328127,1.3528492736816407,0.3789915579153883,0.28599274158477783,2.89453125,0.8092793226242065
11x11@56,8,56,56,11,64-64-32/4x2,64,64,32,4,2,block,0.25,3.3666867065429686,1.3528492736816407,0.4018340260329104,0.3268945515155792,2.89453125,0.865381121635437
11x11@56,8,56,56,11,64-64-32/4x2,64,64,32,4,2,input,1.0,4.512767944335938,1.3528492736816407,0.29978259249506234,7.736668339930475e-05,0.001953125,0.00035940948873758316
11x11@56,8,56,56,11,64-64-32/4x2,64,64,32,4,2,input,0.85,4.721827697753906,1.3528492736816407,0.28650966538342093,0.1715175062417984,1.12353515625,0.3933069407939911
11x11@56,8,56,56,11,64-64-32/4x2,64,64,32,4,2,input,0.75,3.921817626953125,1.3528492736816407,0.3449546619363518,0.2169593870639801,1.53173828125,0.4974372982978821
11x11@56,8,56,56,11,64-64-32/4x2,64,64,32,4,2,input,0.65,3.6886117553710935,1.3528492736816407,0.3667638025909661,0.2547619044780731,1.69580078125,0.5840826034545898
11x11@56,8,56,56,11,64-64-32/4x2,64,64,32,4,2,input,0.5,2.570403747558594,1.3528492736816407,0.5263178109534723,0.3077698051929474,1.983154296875,0.7056899070739746
11x11@56,8,56,56,11,64-64-32/4x2,64,64,32,4,2,input,0.35,2.100635528564453,1.3528492736816407,0.6440190386602478,0.35286808013916016,2.561279296875,0.80897057056427
11x11@56,8,56,56,11,64-64-32/4x2,64,64,32,4,2,input,0.25,1.7644953918457031,1.3528492736816407,0.7667060395473909,0.37734097242355347,2.81787109375,0.8651084303855896
11x11@56,8,56,56,11,64-64-64/4x2,64,64,64,4,2,dense,1.0,3.776553039550781,1.3528492736816407,0.3582232950295228,7.736668339930475e-05,0.001953125,0.00035940948873758316
11x11@56,8,56,56,11,64-64-64/4x2,64,64,64,4,2,channel,1.0,3.7380096435546877,1.3528492736816407,0.3619170100361589,7.736668339930475e-05,0.001953125,0.00035940948873758316
11x11@56,8,56,56,11,64-64-64/4x2,64,64,64,4,2,channel,0.85,4.075581359863281,1.3528492736816407,0.33194019557666815,0.06435902416706085,2.787109375,0.3825811445713043
11x11@56,8,56,56,11,64-64-64/4x2,64,64,64,4,2,channel,0.75,3.857799072265625,1.3528492736816407,0.3506790396128986,0.10850878059864044,2.787109375,0.4973548650741577
11x11@56,8,56,56,11,64-64-64/4x2,64,64,64,4,2,channel,0.65,4.018360290527344,1.3528492736816407,0.33666699247222087,0.15263067185878754,2.787109375,0.5900652408599854
11x11@56,8,56,56,11,64-64-64/4x2,64,64,64,4,2,channel,0.5,2.947379150390625,1.3528492736816407,0.4590007612364169,0.21732069551944733,2.798828125,0.7046086192131042
11x11@56,8,56,56,11,64-64-64/4x2,64,64,64,4,2,channel,0.35,2.985635986328125,1.3528492736816407,0.45311929514402655,0.28217917680740356,2.89453125,0.8033522367477417
11x11@56,8,56,56,11,64-64-64/4x2,64,64,64,4,2,channel,0.25,2.855423889160156,1.3528492736816407,0.4737822915950822,0.3265678286552429,2.89453125,0.8644919395446777
11x11@56,8,56,56,11,64-64-64/4x2,64,64,64,4,2,block,1.0,3.591045227050781,1.3528492736816407,0.3767285534280769,7.736668339930475e-05,0.001953125,0.00035940948873758316
11x11@56,8,56,56,11,64-64-64/4x2,64,64,64,4,2,block,0.85,3.8548480224609376,1.3528492736816407,0.3509474993045201,0.06809768825769424,2.787109375,0.3946295976638794
11x11@56,8,56,56,11,64-64-64/4x2,64,64,64,4,2,block,0.75,3.6880807495117187,1.3528492736816407,0.36681660884479017,0.10881530493497849,2.787109375,0.49873700737953186
11x11@56,8,56,56,11,64-64-64/4x2,64,64,64,4,2,block,0.65,3.7643621826171874,1.3528492736816407,0.3593833983161171,0.14967487752437592,2.89453125,0.5850745439529419
11x11@56,8,56,56,11,64-64-64/4x2,64,64,64,4,2,block,0.5,2.91051513671875,1.3528492736816407,0.46481437482122595,0.2177501618862152,2.89453125,0.7058829069137573
11x11@56,8,56,56,11,64-64-64/4x2,64,64,64,4,2,block,0.35,2.9670809936523437,1.3528492736816407,0.4559529303635031,0.28599274158477783,2.89453125,0.8092793226242065
11x11@56,8,56,56,11,64-64-64/4x2,64,64,64,4,2,block,0.25,2.867712097167969,1.3528492736816407,0.4717521242866944,0.3268945515155792,2.89453125,0.865381121635437
11x11@56,8,56,56,11,64-64-64/4x2,64,64,64,4,2,input,1.0,3.542732849121094,1.3528492736816407,0.38186601454221,7.736668339930475e-05,0.001953125,0.00035940948873758316
11x11@56,8,56,56,11,64-64-64/4x2,64,64,64,4,2,input,0.85,3.753226318359375,1.3528492736816407,0.3604496928586506,0.1715175062417984,1.12353515625,0.3933069407939911
11x11@56,8,56,56,11,64-64-64/4x2,64,64,64,4,2,input,0.75,3.195596008300781,1.3528492736816407,0.4233480296531606,0.2169593870639801,1.53173828125,0.4974372982978821
11x11@56,8,56,56,11,64-64-64/4x2,64,64,64,4,2,input,0.65,3.059261474609375,1.3528492736816407,0.44221433339704336,0.2547619044780731,1.69580078125,0.5840826034545898
11x11@56,8,56,56,11,64-64-64/4x2,64,64,64,4,2,input,0.5,2.202767333984375,1.3528492736816407,0.6141589503393448,0.3077698051929474,1.983154296875,0.7056899070739746
11x11@56,8,56,56,11,64-64-64/4x2,64,64,64,4,2,input,0.35,1.7882086181640624,1.3528492736816407,0.756538840009953,0.35286808013916016,2.561279296875,0.80897057056427
11x11@56,8,56,56,11,64-64-64/4x2,64,64,64,4,2,input,0.25,1.41121337890625,1.3528492736816407,0.9586426077749887,0.37734097242355347,2.81787109375,0.8651084303855896
11x11@56,8,56,56,11,64-128-32/4x2,64,128,32,4,2,dense,1.0,3.53112060546875,1.3528492736816407,0.38312179753544623,7.736668339930475e-05,0.001953125,0.00035940948873758316
11x11@56,8,56,56,11,64-128-32/4x2,64,128,32,4,2,channel,1.0,3.4909991455078124,1.3528492736816407,0.38752495125141334,7.736668339930475e-05,0.001953125,0.00035940948873758316
11x11@56,8,56,56,11,64-128-32/4x2,64,128,32,4,2,channel,0.85,3.8423757934570313,1.3528492736816407,0.3520866636692155,0.06435902416706085,2.787109375,0.3825811445713043
11x11@56,8,56,56,11,64-128-32/4x2,64,128,32,4,2,channel,0.75,3.5991552734375,1.3528492736816407,0.37587966367162434,0.10850878059864044,2.787109375,0.4973548650741577
11x11@56,8,56,56,11,64-128-32/4x2,64,128,32,4,2,channel,0.65,3.763056640625,1.3528492736816407,0.3595080815623727,0.15263067185878754,2.787109375,0.5900652408599854
11x11@56,8,56,56,11,64-128-32/4x2,64,128,32,4,2,channel,0.5,3.5379815673828126,1.3528492736816407,0.38237883604419054,0.21732069551944733,2.798828125,0.7046086192131042
11x11@56,8,56,56,11,64-128-32/4x2,64,128,32,4,2,channel,0.35,3.710013427734375,1.3528492736816407,0.3646480801304799,0.28217917680740356,2.89453125,0.8033522367477417
11x11@56,8,56,56,11,64-128-32/4x2,64,128,32,4,2,channel,0.25,3.473879089355469,1.3528492736816407,0.3894347612232651,0.3265678286552429,2.89453125,0.8644919395446777
11x11@56,8,56,56,11,64-128-32/4x2,64,128,32,4,2,block,1.0,3.500421142578125,1.3528492736816407,0.3864818599185017,7.736668339930475e-05,0.001953125,0.00035940948873758316
11x11@56,8,56,56,11,64-128-32/4x2,64,128,32,4,2,block,0.85,3.8272000122070313,1.3528492736816407,0.35348277314137366,0.06809768825769424,2.787109375,0.3946295976638794
11x11@56,8,56,56,11,64-128-32/4x2,64,128,32,4,2,block,0.75,3.593438720703125,1.3528492736816407,0.37647762459044515,0.10881530493497849,2.787109375,0.49873700737953186
11x11@56,8,56,56,11,64-128-32/4x2,64,128,32,4,2,block,0.65,3.7698355102539063,1.3528492736816407,0.35886161876344663,0.14967487752437592,2.89453125,0.5850745439529419
11x11@56,8,56,56,11,64-128-32/4x2,64,128,32,4,2,block,0.5,3.5292568969726563,1.3528492736816407,0.38332411416184936,0.2177501618862152,2.89453125,0.7058829069137573
11x11@56,8,56,56,11,64-128-32/4x2,64,128,32,4,2,block,0.35,3.6894580078125,1.3528492736816407,0.36667967783261274,0.28599274158477783,2.89453125,0.8092793226242065
11x11@56,8,56,56,11,64-128-32/4x2,64,128,32,4,2,block,0.25,3.4876824951171876,1.3528492736816407,0.38789347240629035,0.3268945515155792,2.89453125,0.865381121635437
11x11@56,8,56,56,11,64-128-32/4x2,64,128,32,4,2,input,1.0,3.50023681640625,1.3528492736816407,0.38650221246190797,7.736668339930475e-05,0.001953125,0.00035940948873758316
11x11@56,8,56,56,11,64-128-32/4x2,64,128,32,4,2,input,0.85,3.4451864624023436,1.3528492736816407,0.3926780998489971,0.1715175062417984,1.12353515625,0.3933069407939911
11x11@56,8,56,56,11,64-128-32/4x2,64,128,32,4,2,input,0.75,2.9584613037109375,1.3528492736816407,0.457281382042989,0.2169593870639801,1.53173828125,0.4974372982978821
11x11@56,8,56,56,11,64-128-32/4x2,64,128,32,4,2,input,0.65,2.785545654296875,1.3528492736816407,0.48566760038371215,0.2547619044780731,1.69580078125,0.5840826034545898
11x11@56,8,56,56,11,64-128-32/4x2,64,128,32,4,2,input,0.5,2.062233581542969,1.3528492736816407,0.656011659294887,0.3077698051929474,1.983154296875,0.7056899070739746
11x11@56,8,56,56,11,64-128-32/4x2,64,128,32,4,2,input,0.35,1.68237060546875,1.3528492736816407,0.8041327334679053,0.35286808013916016,2.561279296875,0.80897057056427
11x11@56,8,56,56,11,64-128-32/4x2,64,128,32,4,2,input,0.25,1.3135699462890624,1.3528492736816407,1.0299027299639014,0.37734097242355347,2.81787109375,0.8651084303855896
11x11@56,8,56,56,11,128-64-32/8x2,128,64,32,8,2,dense,1.0,4.451921997070312,1.3528492736816407,0.3038798241685083,7.736668339930475e-05,0.001953125,0.00035940948873758316
11x11@56,8,56,56,11,128-64-32/8x2,128,64,32,8,2,channel,1.0,4.449871215820313,1.3528492736816407,0.30401987115311363,7.736668339930475e-05,0.001953125,0.00035940948873758316
11x11@56,8,56,56,11,128-64-32/8x2,128,64,32,8,2,channel,0.85,5.022760925292968,1.3528492736816407,0.26934375213224615,0.06435902416706085,2.787109375,0.3825811445713043
11x11@56,8,56,56,11,128-64-32/8x2,128,64,32,8,2,channel,0.75,4.552703857421875,1.3528492736816407,0.2971529262717602,0.10850878059864044,2.787109375,0.4973548650741577
11x11@56,8,56,56,11,128-64-32/8x2,128,64,32,8,2,channel,0.65,5.032714233398438,1.3528492736816407,0.26881106515124004,0.15263067185878754,2.787109375,0.5900652408599854
11x11@56,8,56,56,11,128-64-32/8x2,128,64,32,8,2,channel,0.5,3.4259353637695313,1.3528492736816407,0.3948846460994263,0.21732069551944733,2.798828125,0.7046086192131042
11x11@56,8,56,56,11,128-64-32/8x2,128,64,32,8,2,channel,0.35,3.657152099609375,1.3528492736816407,0.36991878839989734,0.28217917680740356,2.89453125,0.8033522367477417
11x11@56,8,56,56,11,128-64-32/8x2,128,64,32,8,2,channel,0.25,3.326402587890625,1.3528492736816407,0.40670040319428813,0.3265678286552429,2.89453125,0.8644919395446777
11x11@56,8,56,56,11,128-64-32/8x2,128,64,32,8,2,block,1.0,4.446474304199219,1.3528492736816407,0.30425212901916904,7.736668339930475e-05,0.001953125,0.00035940948873758316
11x11@56,8,56,56,11,128-64-32/8x2,128,64,32,8,2,block,0.85,5.002731628417969,1.3528492736816407,0.2704221161888424,0.06809768825769424,2.787109375,0.3946295976638794
11x11@56,8,56,56,11,128-64-32/8x2,128,64,32,8,2,block,0.75,4.5546701049804685,1.3528492736816407,0.29702464558351194,0.10881530493497849,2.787109375,0.49873700737953186
11x11@56,8,56,56,11,128-64-32/8x2,128,64,32,8,2,block,0.65,5.064393615722656,1.3528492736816407,0.2671295669992266,0.14967487752437592,2.89453125,0.5850745439529419
11x11@56,8,56,56,11,128-64-32/8x2,128,64,32,8,2,block,0.5,3.3811239624023437,1.3528492736816407,0.40011821179144796,0.2177501618862152,2.89453125,0.7058829069137573
11x11@56,8,56,56,11,128-64-32/8x2,128,64,32,8,2,block,0.35,3.6319232177734375,1.3528492736816407,0.372488401478655,0.28599274158477783,2.89453125,0.8092793226242065
11x11@56,8,56,56,11,128-64-32/8x2,128,64,32,8,2,block,0.25,3.332669372558594,1.3528492736816407,0.4059356397070425,0.3268945515155792,2.89453125,0.865381121635437
11x11@56,8,56,56,11,128-64-32/8x2,128,64,32,8,2,input,1.0,4.4417138671875,1.3528492736816407,0.30457821330536694,7.736668339930475e-05,0.001953125,0.00035940948873758316
11x11@56,8,56,56,11,128-64-32/8x2,128,64,32,8,2,input,0.85,4.612587585449218,1.3528492736816407,0.2932950862438501,0.1715175062417984,1.12353515625,0.3933069407939911
11x11@56,8,56,56,11,128-64-32/8x2,128,64,32,8,2,input,0.75,3.8949273681640624,1.3528492736816407,0.3473362006027158,0.2169593870639801,1.53173828125,0.4974372982978821
11x11@56,8,56,56,11,128-64-32/8x2,128,64,32,8,2,input,0.65,3.669381103515625,1.3528492736816407,0.3686859542568307,0.2547619044780731,1.69580078125,0.5840826034545898
11x11@56,8,56,56,11,128-64-32/8x2,128,64,32,8,2,input,0.5,2.554671325683594,1.3528492736816407,0.5295590317551466,0.3077698051929474,1.983154296875,0.7056899070739746
11x11@56,8,56,56,11,128-64-32/8x2,128,64,32,8,2,input,0.35,2.0200653076171875,1.3528492736816407,0.6697057112858513,0.35286808013916016,2.561279296875,0.80897057056427
11x11@56,8,56,56,11,128-64-32/8x2,128,64,32,8,2,input,0.25,1.6201318359375,1.3528492736816407,0.8350241898053965,0.37734097242355347,2.81787109375,0.8651084303855896
11x11@56,8,56,56,11,128-128-32/8x2,128,128,32,8,2,dense,1.0,3.6437811279296874,1.3528492736816407,0.3712762172546567,7.736668339930475e-05,0.001953125,0.00035940948873758316
11x11@56,8,56,56,11,128-128-32/8x2,128,128,32,8,2,channel,1.0,3.6365716552734373,1.3528492736816407,0.372012269226115,7.736668339930475e-05,0.001953125,0.00035940948873758316
11x11@56,8,56,56,11,128-128-32/8x2,128,128,32,8,2,channel,0.85,4.948029479980469,1.3528492736816407,0.273411724638104,0.06435902416706085,2.787109375,0.3825811445713043
11x11@56,8,56,56,11,128-128-32/8x2,128,128,32,8,2,channel,0.75,3.7308856201171876,1.3528492736816407,0.36260808060879324,0.10850878059864044,2.787109375,0.4973548650741577
11x11@56,8,56,56,11,128-128-32/8x2,128,128,32,8,2,channel,0.65,4.830842895507812,1.3528492736816407,0.2800441461136423,0.15263067185878754,2.787109375,0.5900652408599854
11x11@56,8,56,56,11,128-128-32/8x2,128,128,32,8,2,channel,0.5,3.6930355834960937,1.3528492736816407,0.3663244621111763,0.21732069551944733,2.798828125,0.7046086192131042
11x11@56,8,56,56,11,128-128-32/8x2,128,128,32,8,2,channel,0.35,4.695979614257812,1.3528492736816407,0.28808670071185033,0.28217917680740356,2.89453125,0.8033522367477417
11x11@56,8,56,56,11,128-128-32/8x2,128,128,32,8,2,channel,0.25,3.640100402832031,1.3528492736816407,0.3716516370342729,0.3265678286552429,2.89453125,0.8644919395446777
11x11@56,8,56,56,11,128-128-32/8x2,128,128,32,8,2,block,1.0,3.6467303466796874,1.3528492736816407,0.37097595519048915,7.736668339930475e-05,0.001953125,0.00035940948873758316
11x11@56,8,56,56,11,128-128-32/8x2,128,128,32,8,2,block,0.85,4.940492858886719,1.3528492736816407,0.2738288086477447,0.06809768825769424,2.787109375,0.3946295976638794
11x11@56,8,56,56,11,128-128-32/8x2,128,128,32,8,2,block,0.75,3.766108093261719,1.3528492736816407,0.3592167936183628,0.10881530493497849,2.787109375,0.49873700737953186
11x11@56,8,56,56,11,128-128-32/8x2,128,128,32,8,2,block,0.65,4.834893493652344,1.3528492736816407,0.27980952950830773,0.14967487752437592,2.89453125,0.5850745439529419
11x11@56,8,56,56,11,128-128-32/8x2,128,128,32,8,2,block,0.5,3.712757873535156,1.3528492736816407,0.3643785347072756,0.2177501618862152,2.89453125,0.7058829069137573
11x11@56,8,56,56,11,128-128-32/8x2,128,128,32,8,2,block,0.35,4.689696044921875,1.3528492736816407,0.2884726985977143,0.28599274158477783,2.89453125,0.8092793226242065
11x11@56,8,56,56,11,128-128-32/8x2,128,128,32,8,2,block,0.25,3.6499456787109374,1.3528492736816407,0.37064915282778416,0.3268945515155792,2.89453125,0.865381121635437
11x11@56,8,56,56,11,128-128-32/8x2,128,128,32,8,2,input,1.0,3.669725341796875,1.3528492736816407,0.3686513697014775,7.736668339930475e-05,0.001953125,0.00035940948873758316
11x11@56,8,56,56,11,128-128-32/8x2,128,128,32,8,2,input,0.85,3.848826904296875,1.3528492736816407,0.351496522790179,0.1715175062417984,1.12353515625,0.3933069407939911
11x11@56,8,56,56,11,128-128-32/8x2,128,128,32,8,2,input,0.75,3.107737731933594,1.3528492736816407,0.43531642319119235,0.2169593870639801,1.53173828125,0.4974372982978821
11x11@56,8,56,56,11,128-128-32/8x2,128,128,32,8,2,input,0.65,3.125941162109375,1.3528492736816407,0.43278142598459607,0.2547619044780731,1.69580078125,0.5840826034545898
11x11@56,8,56,56,11,128-128-32/8x2,128,128,32,8,2,input,0.5,2.1309849548339845,1.3528492736816407,0.6348469380850392,0.3077698051929474,1.983154296875,0.7056899070739746
11x11@56,8,56,56,11,128-128-32/8x2,128,128,32,8,2,input,0.35,1.8865151977539063,1.3528492736816407,0.717115491723761,0.35286808013916016,2.561279296875,0.80897057056427
11x11@56,8,56,56,11,128-128-32/8x2,128,128,32,8,2,input,0.25,1.3633126831054687,1.3528492736816407,0.992325011309956,0.37734097242355347,2.81787109375,0.8651084303855896
11x11@56,8,56,56,11,128-128-64/8x2,128,128,64,8,2,dense,1.0,3.823841247558594,1.3528492736816407,0.35379326339590944,7.736668339930475e-05,0.001953125,0.00035940948873758316
11x11@56,8,56,56,11,128-128-64/8x2,128,128,64,8,2,channel,1.0,3.8336102294921877,1.3528492736816407,0.3528917111275664,7.736668339930475e-05,0.001953125,0.00035940948873758316
11x11@56,8,56,56,11,128-128-64/8x2,128,128,64,8,2,channel,0.85,4.329717712402344,1.3528492736816407,0.312456691993209,0.06435902416706085,2.787109375,0.3825811445713043
11x11@56,8,56,56,11,128-128-64/8x2,128,128,64,8,2,channel,0.75,3.9351910400390624,1.3528492736816407,0.34378236276636054,0.10850878059864044,2.787109375,0.4973548650741577
11x11@56,8,56,56,11,128-128-64/8x2,128,128,64,8,2,channel,0.65,4.2290380859375,1.3528492736816407,0.3198952684252639,0.15263067185878754,2.787109375,0.5900652408599854
11x11@56,8,56,56,11,128-128-64/8x2,128,128,64,8,2,channel,0.5,3.8575924682617186,1.3528492736816407,0.3506978211960405,0.21732069551944733,2.798828125,0.7046086192131042
11x11@56,8,56,56,11,128-128-64/8x2,128,128,64,8,2,channel,0.35,4.170690612792969,1.3528492736816407,0.3243705657600154,0.28217917680740356,2.89453125,0.8033522367477417
11x11@56,8,56,56,11,128-128-64/8x2,128,128,64,8,2,channel,0.25,3.8434603881835936,1.3528492736816407,0.35198730754214763,0.3265678286552429,2.89453125,0.8644919395446777
11x11@56,8,56,56,11,128-128-64/8x2,128,128,64,8,2,block,1.0,3.797135314941406,1.3528492736816407,0.35628155477059065,7.736668339930475e-05,0.001953125,0.00035940948873758316
11x11@56,8,56,56,11,128-128-64/8x2,128,128,64,8,2,block,0.85,4.320993347167969,1.3528492736816407,0.3130875622773903,0.06809768825769424,2.787109375,0.3946295976638794
11x11@56,8,56,56,11,128-128-64/8x2,128,128,64,8,2,block,0.75,3.934268798828125,1.3528492736816407,0.3438629495993271,0.10881530493497849,2.787109375,0.49873700737953186
11x11@56,8,56,56,11,128-128-64/8x2,128,128,64,8,2,block,0.65,4.274873046875,1.3528492736816407,0.31646536840914957,0.14967487752437592,2.89453125,0.5850745439529419
11x11@56,8,56,56,11,128-128-64/8x2,128,128,64,8,2,block,0.5,3.84927734375,1.3528492736816407,0.35145539093935046,0.2177501618862152,2.89453125,0.7058829069137573
11x11@56,8,56,56,11,128-128-64/8x2,128,128,64,8,2,block,0.35,4.1563546752929685,1.3528492736816407,0.3254893721470684,0.28599274158477783,2.89453125,0.8092793226242065
11x11@56,8,56,56,11,128-128-64/8x2,128,128,64,8,2,block,0.25,3.795865478515625,1.3528492736816407,0.35640074215977563,0.3268945515155792,2.89453125,0.865381121635437
11x11@56,8,56,56,11,128-128-64/8x2,128,128,64,8,2,input,1.0,3.79082763671875,1.3528492736816407,0.3568743829388758,7.736668339930475e-05,0.001953125,0.00035940948873758316
11x11@56,8,56,56,11,128-128-64/8x2,128,128,64,8,2,input,0.85,3.62966796875,1.3528492736816407,0.3727198425115288,0.1715175062417984,1.12353515625,0.3933069407939911
11x11@56,8,56,56,11,128-128-64/8x2,128,128,64,8,2,input,0.75,3.0108651733398437,1.3528492736816407,0.4493224358435731,0.2169593870639801,1.53173828125,0.4974372982978821
11x11@56,8,56,56,11,128-128-64/8x2,128,128,64,8,2,input,0.65,2.9266085815429688,1.3528492736816407,0.4622583567251041,0.2547619044780731,1.69580078125,0.5840826034545898
11x11@56,8,56,56,11,128-128-64/8x2,128,128,64,8,2,input,0.5,2.185543670654297,1.3528492736816407,0.6189989666400175,0.3077698051929474,1.983154296875,0.7056899070739746
11x11@56,8,56,56,11,128-128-64/8x2,128,128,64,8,2,input,0.35,1.7823948669433594,1.3528492736816407,0.7590064910822206,0.35286808013916016,2.561279296875,0.80897057056427
11x11@56,8,56,56,11,128-128-64/8x2,128,128,64,8,2,input,0.25,1.3849189758300782,1.3528492736816407,0.9768436257224247,0.37734097242355347,2.81787109375,0.8651084303855896
11x11@56,8,56,56,11,128-64-32/8x3,128,64,32,8,3,dense,1.0,4.450017395019532,1.3528492736816407,0.30400988436489085,7.736668339930475e-05,0.001953125,0.00035940948873758316
11x11@56,8,56,56,11,128-64-32/8x3,128,64,32,8,3,channel,1.0,4.471029663085938,1.3528492736816407,0.3025811447531068,7.736668339930475e-05,0.001953125,0.00035940948873758316
11x11@56,8,56,56,11,128-64-32/8x3,128,64,32,8,3,channel,0.85,4.738846740722656,1.3528492736816407,0.2854806976676642,0.06435902416706085,2.787109375,0.3825811445713043
11x11@56,8,56,56,11,128-64-32/8x3,128,64,32,8,3,channel,0.75,4.548794860839844,1.3528492736816407,0.2974082839672977,0.10850878059864044,2.787109375,0.4973548650741577
11x11@56,8,56,56,11,128-64-32/8x3,128,64,32,8,3,channel,0.65,4.700078125,1.3528492736816407,0.28783548649665064,0.15263067185878754,2.787109375,0.5900652408599854
11x11@56,8,56,56,11,128-64-32/8x3,128,64,32,8,3,channel,0.5,3.3685678100585936,1.3528492736816407,0.40160963055041154,0.21732069551944733,2.798828125,0.7046086192131042
11x11@56,8,56,56,11,128-64-32/8x3,128,64,32,8,3,channel,0.35,3.475599365234375,1.3528492736816407,0.3892420073538631,0.28217917680740356,2.89453125,0.8033522367477417
11x11@56,8,56,56,11,128-64-32/8x3,128,64,32,8,3,channel,0.25,3.3279949951171877,1.3528492736816407,0.40650580174144857,0.3265678286552429,2.89453125,0.8644919395446777
11x11@56,8,56,56,11,128-64-32/8x3,128,64,32,8,3,block,1.0,4.4536831665039065,1.3528492736816407,0.30375965759226037,7.736668339930475e-05,0.001953125,0.00035940948873758316
11x11@56,8,56,56,11,128-64-32/8x3,128,64,32,8,3,block,0.85,4.746588134765625,1.3528492736816407,0.2850150961641084,0.06809768825769424,2.787109375,0.3946295976638794
11x11@56,8,56,56,11,128-64-32/8x3,128,64,32,8,3,block,0.75,4.550364074707031,1.3528492736816407,0.2973057213600523,0.10881530493497849,2.787109375,0.49873700737953186
11x11@56,8,56,56,11,128-64-32/8x3,128,64,32,8,3,block,0.65,4.708208618164062,1.3528492736816407,0.2873384302603771,0.14967487752437592,2.89453125,0.5850745439529419
11x11@56,8,56,56,11,128-64-32/8x3,128,64,32,8,3,block,0.5,3.3763327026367187,1.3528492736816407,0.4006860084094036,0.2177501618862152,2.89453125,0.7058829069137573
11x11@56,8,56,56,11,128-64-32/8x3,128,64,32,8,3,block,0.35,3.477278747558594,1.3528492736816407,0.38905401950633944,0.28599274158477783,2.89453125,0.8092793226242065
11x11@56,8,56,56,11,128-64-32/8x3,128,64,32,8,3,block,0.25,3.33705078125,1.3528492736816407,0.4054026631188655,0.3268945515155792,2.89453125,0.865381121635437
11x11@56,8,56,56,11,128-64-32/8x3,128,64,32,8,3,input,1.0,4.4518194580078125,1.3528492736816407,0.3038868234533123,7.736668339930475e-05,0.001953125,0.00035940948873758316
11x11@56,8,56,56,11,128-64-32/8x3,128,64,32,8,3,input,0.85,4.601487426757813,1.3528492736816407,0.29400260137945267,0.1715175062417984,1.12353515625,0.3933069407939911
11x11@56,8,56,56,11,128-64-32/8x3,128,64,32,8,3,input,0.75,3.894087829589844,1.3528492736816407,0.34741108390052244,0.2169593870639801,1.53173828125,0.4974372982978821
11x11@56,8,56,56,11,128-64-32/8x3,128,64,32,8,3,input,0.65,3.6586868286132814,1.3528492736816407,0.3697636165799954,0.2547619044780731,1.69580078125,0.5840826034545898
11x11@56,8,56,56,11,128-64-32/8x3,128,64,32,8,3,input,0.5,2.5386585998535156,1.3528492736816407,0.532899253865684,0.3077698051929474,1.983154296875,0.7056899070739746
11x11@56,8,56,56,11,128-64-32/8x3,128,64,32,8,3,input,0.35,2.0328863525390624,1.3528492736816407,0.6654819990266255,0.35286808013916016,2.561279296875,0.80897057056427
11x11@56,8,56,56,11,128-64-32/8x3,128,64,32,8,3,input,0.25,1.5909478759765625,1.3528492736816407,0.8503416699627754,0.37734097242355347,2.81787109375,0.8651084303855896
11x11@56,8,56,56,11,64-128-32/4x3,64,128,32,4,3,dense,1.0,3.4099365234375,1.3528492736816407,0.396737377479935,7.736668339930475e-05,0.001953125,0.00035940948873758316
11x11@56,8,56,56,11,64-128-32/4x3,64,128,32,4,3,channel,1.0,3.4044723510742188,1.3528492736816407,0.39737414029953094,7.736668339930475e-05,0.001953125,0.00035940948873758316
11x11@56,8,56,56,11,64-128-32/4x3,64,128,32,4,3,channel,0.85,3.8076416015625,1.3528492736816407,0.35529848006873516,0.06435902416706085,2.787109375,0.3825811445713043
11x11@56,8,56,56,11,64-128-32/4x3,64,128,32,4,3,channel,0.75,3.4922329711914064,1.3528492736816407,0.3873880364917648,0.10850878059864044,2.787109375,0.4973548650741577
11x11@56,8,56,56,11,64-128-32/4x3,64,128,32,4,3,channel,0.65,3.7117959594726564,1.3528492736816407,0.36447296361458487,0.15263067185878754,2.787109375,0.5900652408599854
11x11@56,8,56,56,11,64-128-32/4x3,64,128,32,4,3,channel,0.5,3.448586120605469,1.3528492736816407,0.39229099299515846,0.21732069551944733,2.798828125,0.7046086192131042
11x11@56,8,56,56,11,64-128-32/4x3,64,128,32,4,3,channel,0.35,3.704954833984375,1.3528492736816407,0.3651459557002918,0.28217917680740356,2.89453125,0.8033522367477417
11x11@56,8,56,56,11,64-128-32/4x3,64,128,32,4,3,channel,0.25,3.5181549072265623,1.3528492736816407,0.3845337426452666,0.3265678286552429,2.89453125,0.8644919395446777
11x11@56,8,56,56,11,64-128-32/4x3,64,128,32,4,3,block,1.0,3.3918533325195312,1.3528492736816407,0.39885252723375253,7.736668339930475e-05,0.001953125,0.00035940948873758316
11x11@56,8,56,56,11,64-128-32/4x3,64,128,32,4,3,block,0.85,3.93302001953125,1.3528492736816407,0.34397213005869154,0.06809768825769424,2.787109375,0.3946295976638794
11x11@56,8,56,56,11,64-128-32/4x3,64,128,32,4,3,block,0.75,3.5024282836914065,1.3528492736816407,0.38626037825842263,0.10881530493497849,2.787109375,0.49873700737953186
11x11@56,8,56,56,11,64-128-32/4x3,64,128,32,4,3,block,0.65,3.915200500488281,1.3528492736816407,0.34553767387210976,0.14967487752437592,2.89453125,0.5850745439529419
11x11@56,8,56,56,11,64-128-32/4x3,64,128,32,4,3,block,0.5,3.51752197265625,1.3528492736816407,0.38460293473590984,0.2177501618862152,2.89453125,0.7058829069137573
11x11@56,8,56,56,11,64-128-32/4x3,64,128,32,4,3,block,0.35,3.8329959106445313,1.3528492736816407,0.352948269504977,0.28599274158477783,2.89453125,0.8092793226242065
11x11@56,8,56,56,11,64-128-32/4x3,64,128,32,4,3,block,0.25,3.6498226928710937,1.3528492736816407,0.3706616423652724,0.3268945515155792,2.89453125,0.865381121635437
11x11@56,8,56,56,11,64-128-32/4x3,64,128,32,4,3,input,1.0,3.4028134155273437,1.3528492736816407,0.39756786766752117,7.736668339930475e-05,0.001953125,0.00035940948873758316
11x11@56,8,56,56,11,64-128-32/4x3,64,128,32,4,3,input,0.85,3.6968231201171875,1.3528492736816407,0.36594914869466516,0.1715175062417984,1.12353515625,0.3933069407939911
11x11@56,8,56,56,11,64-128-32/4x3,64,128,32,4,3,input,0.75,2.930769958496094,1.3528492736816407,0.4616019997611299,0.2169593870639801,1.53173828125,0.4974372982978821
11x11@56,8,56,56,11,64-128-32/4x3,64,128,32,4,3,input,0.65,2.7923660278320312,1.3528492736816407,0.4844813538760823,0.2547619044780731,1.69580078125,0.5840826034545898
11x11@56,8,56,56,11,64-128-32/4x3,64,128,32,4,3,input,0.5,2.1344224548339845,1.3528492736816407,0.6338245133327485,0.3077698051929474,1.983154296875,0.7056899070739746
11x11@56,8,56,56,11,64-128-32/4x3,64,128,32,4,3,input,0.35,1.7547673034667968,1.3528492736816407,0.7709565085974027,0.35286808013916016,2.561279296875,0.80897057056427
11x11@56,8,56,56,11,64-128-32/4x3,64,128,32,4,3,input,0.25,1.319564208984375,1.3528492736816407,1.025224285768469,0.37734097242355347,2.81787109375,0.8651084303855896
11x11@56,8,56,56,11,64-64-32/2x2,64,64,32,2,2,dense,1.0,4.644966430664063,1.3528492736816407,0.2912506029646875,7.736668339930475e-05,0.001953125,0.00035940948873758316
11x11@56,8,56,56,11,64-64-32/2x2,64,64,32,2,2,channel,1.0,4.603514099121094,1.3528492736816407,0.2938731683128607,7.736668339930475e-05,0.001953125,0.00035940948873758316
11x11@56,8,56,56,11,64-64-32/2x2,64,64,32,2,2,channel,0.85,4.948374328613281,1.3528492736816407,0.2733926707724958,0.06435902416706085,2.787109375,0.3825811445713043
11x11@56,8,56,56,11,64-64-32/2x2,64,64,32,2,2,channel,0.75,4.715663452148437,1.3528492736816407,0.2868841865857259,0.10850878059864044,2.787109375,0.4973548650741577
11x11@56,8,56,56,11,64-64-32/2x2,64,64,32,2,2,channel,0.65,4.836085815429687,1.3528492736816407,0.2797405433471283,0.15263067185878754,2.787109375,0.5900652408599854
11x11@56,8,56,56,11,64-64-32/2x2,64,64,32,2,2,channel,0.5,3.53976318359375,1.3528492736816407,0.3821863790074675,0.21732069551944733,2.798828125,0.7046086192131042
11x11@56,8,56,56,11,64-64-32/2x2,64,64,32,2,2,channel,0.35,3.666572265625,1.3528492736816407,0.3689683921860559,0.28217917680740356,2.89453125,0.8033522367477417
11x11@56,8,56,56,11,64-64-32/2x2,64,64,32,2,2,channel,0.25,3.4824600219726562,1.3528492736816407,0.38847517707190005,0.3265678286552429,2.89453125,0.8644919395446777
11x11@56,8,56,56,11,64-64-32/2x2,64,64,32,2,2,block,1.0,4.620733947753906,1.3528492736816407,0.2927780064764922,7.736668339930475e-05,0.001953125,0.00035940948873758316
11x11@56,8,56,56,11,64-64-32/2x2,64,64,32,2,2,block,0.85,4.942868347167969,1.3528492736816407,0.2736972095274922,0.06809768825769424,2.787109375,0.3946295976638794
11x11@56,8,56,56,11,64-64-32/2x2,64,64,32,2,2,block,0.75,4.702023620605469,1.3528492736816407,0.28771639252365927,0.10881530493497849,2.787109375,0.49873700737953186
11x11@56,8,56,56,11,64-64-32/2x2,64,64,32,2,2,block,0.65,4.846409606933594,1.3528492736816407,0.2791446417872243,0.14967487752437592,2.89453125,0.5850745439529419
11x11@56,8,56,56,11,64-64-32/2x2,64,64,32,2,2,block,0.5,3.729858703613281,1.3528492736816407,0.3627079150132618,0.2177501618862152,2.89453125,0.7058829069137573
11x11@56,8,56,56,11,64-64-32/2x2,64,64,32,2,2,block,0.35,3.7174642944335936,1.3528492736816407,0.3639172205923677,0.28599274158477783,2.89453125,0.8092793226242065
11x11@56,8,56,56,11,64-64-32/2x2,64,64,32,2,2,block,0.25,3.457966003417969,1.3528492736816407,0.3912268866566182,0.3268945515155792,2.89453125,0.865381121635437
11x11@56,8,56,56,11,64-64-32/2x2,64,64,32,2,2,input,1.0,4.633992309570313,1.3528492736816407,0.2919403363893549,7.736668339930475e-05,0.001953125,0.00035940948873758316
11x11@56,8,56,56,11,64-64-32/2x2,64,64,32,2,2,input,0.85,4.587088012695313,1.3528492736816407,0.29492551046273124,0.1715175062417984,1.12353515625,0.3933069407939911
11x11@56,8,56,56,11,64-64-32/2x2,64,64,32,2,2,input,0.75,4.019548034667968,1.3528492736816407,0.33656751008161334,0.2169593870639801,1.53173828125,0.4974372982978821
11x11@56,8,56,56,11,64-64-32/2x2,64,64,32,2,2,input,0.65,3.6589364624023437,1.3528492736816407,0.3697383891693495,0.2547619044780731,1.69580078125,0.5840826034545898
11x11@56,8,56,56,11,64-64-32/2x2,64,64,32,2,2,input,0.5,2.6484530639648436,1.3528492736816407,0.5108073433842053,0.3077698051929474,1.983154296875,0.7056899070739746
11x11@56,8,56,56,11,64-64-32/2x2,64,64,32,2,2,input,0.35,2.0598329162597655,1.3528492736816407,0.6567762185964762,0.35286808013916016,2.561279296875,0.80897057056427
11x11@56,8,56,56,11,64-64-32/2x2,64,64,32,2,2,input,0.25,1.7388339233398438,1.3528492736816407,0.7780209803378877,0.37734097242355347,2.81787109375,0.8651084303855896
3x3@112,16,112,112,3,64-64-16/4x2,64,64,16,4,2,dense,1.0,5.251665649414062,1.2261785888671874,0.23348374986591053,8.191441156668589e-05,0.001953125,0.0003604204975999892
3x3@112,16,112,112,3,64-64-16/4x2,64,64,16,4,2,channel,1.0,4.995972595214844,1.2261785888671874,0.2454334097111791,8.191441156668589e-05,0.001953125,0.0003604204975999892
3x3@112,16,112,112,3,64-64-16/4x2,64,64,16,4,2,channel,0.85,5.280194702148438,1.2261785888671874,0.2322222300568334,0.06625448912382126,3.544921875,0.37420424818992615
3x3@112,16,112,112,3,64-64-16/4x2,64,64,16,4,2,channel,0.75,5.4386279296875,1.2261785888671874,0.22545734047624819,0.11215022951364517,3.544921875,0.48837369680404663
3x3@112,16,112,112,3,64-64-16/4x2,64,64,16,4,2,channel,0.65,4.8624639892578125,1.2261785888671874,0.2521722714196073,0.15833987295627594,3.544921875,0.5815834999084473
3x3@112,16,112,112,3,64-64-16/4x2,64,64,16,4,2,channel,0.5,3.70155517578125,1.2261785888671874,0.33126038398398056,0.2262498140335083,3.544921875,0.6969850063323975
3x3@112,16,112,112,3,64-64-16/4x2,64,64,16,4,2,channel,0.35,3.344527282714844,1.2261785888671874,0.36662239091434917,0.29448142647743225,3.544921875,0.7966587543487549
3x3@112,16,112,112,3,64-64-16/4x2,64,64,16,4,2,channel,0.25,3.2917300415039064,1.2261785888671874,0.37250277920937225,0.34146085381507874,3.544921875,0.8589478135108948
3x3@112,16,112,112,3,64-64-16/4x2,64,64,16,4,2,block,1.0,4.991201782226563,1.2261785888671874,0.24566800589660637,8.191441156668589e-05,0.001953125,0.0003604204975999892
3x3@112,16,112,112,3,64-64-16/4x2,64,64,16,4,2,block,0.85,4.995399780273438,1.2261785888671874,0.24546155318925625,0.07097878307104111,3.01171875,0.39073869585990906
3x3@112,16,112,112,3,64-64-16/4x2,64,64,16,4,2,block,0.75,5.297313842773438,1.2261785888671874,0.23147176574027847,0.11369543522596359,3.544921875,0.4950806200504303
3x3@112,16,112,112,3,64-64-16/4x2,64,64,16,4,2,block,0.65,4.809338989257813,1.2261785888671874,0.25495782094088026,0.15650387108325958,3.544921875,0.5813040733337402
3x3@112,16,112,112,3,64-64-16/4x2,64,64,16,4,2,block,0.5,3.6678451538085937,1.2261785888671874,0.3343048949582716,0.22801008820533752,3.544921875,0.7024203538894653
3x3@112,16,112,112,3,64-64-16/4x2,64,64,16,4,2,block,0.35,3.322755126953125,1.2261785888671874,0.36902466237154213,0.2996343970298767,3.544921875,0.8058054447174072
3x3@112,16,112,112,3,64-64-16/4x2,64,64,16,4,2,block,0.25,3.3144012451171876,1.2261785888671874,0.36995478162869,0.34284085035324097,3.544921875,0.862471878528595
3x3@112,16,112,112,3,64-64-16/4x2,64,64,16,4,2,input,1.0,4.9951513671875,1.2261785888671874,0.2454737601990993,8.191441156668589e-05,0.001953125,0.0003604204975999892
3x3@112,16,112,112,3,64-64-16/4x2,64,64,16,4,2,input,0.85,4.449873962402344,1.2261785888671874,0.2755535548259019,0.17681582272052765,1.222412109375,0.38564327359199524
3x3@112,16,112,112,3,64-64-16/4x2,64,64,16,4,2,input,0.75,4.330352783203125,1.2261785888671874,0.2831590519884141,0.2249697744846344,1.6400146484375,0.4905202388763428
3x3@112,16,112,112,3,64-64-16/4x2,64,64,16,4,2,input,0.65,3.689246826171875,1.2261785888671874,0.33236556040885024,0.2649136185646057,1.85205078125,0.577515721321106
3x3@112,16,112,112,3,64-64-16/4x2,64,64,16,4,2,input,0.5,3.0177517700195313,1.2261785888671874,0.4063218854012142,0.3207659423351288,2.313720703125,0.6990968585014343
3x3@112,16,112,112,3,64-64-16/4x2,64,64,16,4,2,input,0.35,2.5922119140625,1.2261785888671874,0.47302405417369103,0.3686618208885193,2.5283203125,0.803466796875
3x3@112,16,112,112,3,64-64-16/4x2,64,64,16,4,2,input,0.25,2.417541046142578,1.2261785888671874,0.5072007322579588,0.39485684037208557,2.729736328125,0.8604445457458496
3x3@112,16,112,112,3,64-64-32/4x2,64,64,32,4,2,dense,1.0,3.7922406005859375,1.2261785888671874,0.32333881681392557,8.191441156668589e-05,0.001953125,0.0003604204975999892
3x3@112,16,112,112,3,64-64-32/4x2,64,64,32,4,2,channel,1.0,3.8124102783203124,1.2261785888671874,0.3216281825279892,8.191441156668589e-05,0.001953125,0.0003604204975999892
3x3@112,16,112,112,3,64-64-32/4x2,64,64,32,4,2,channel,0.85,4.0756838989257815,1.2261785888671874,0.30085222977924475,0.06625448912382126,3.544921875,0.37420424818992615
3x3@112,16,112,112,3,64-64-32/4x2,64,64,32,4,2,channel,0.75,4.08479736328125,1.2261785888671874,0.30018100772622375,0.11215022951364517,3.544921875,0.48837369680404663
3x3@112,16,112,112,3,64-64-32/4x2,64,64,32,4,2,channel,0.65,3.729059753417969,1.2261785888671874,0.32881709330168307,0.15833987295627594,3.544921875,0.5815834999084473
3x3@112,16,112,112,3,64-64-32/4x2,64,64,32,4,2,channel,0.5,3.0873031616210938,1.2261785888671874,0.3971681835817318,0.2262498140335083,3.544921875,0.6969850063323975
3x3@112,16,112,112,3,64-64-32/4x2,64,64,32,4,2,channel,0.35,2.77465087890625,1.2261785888671874,0.4419217560627085,0.29448142647743225,3.544921875,0.7966587543487549
3x3@112,16,112,112,3,64-64-32/4x2,64,64,32,4,2,channel,0.25,2.7296563720703126,1.2261785888671874,0.4492062083027653,0.34146085381507874,3.544921875,0.8589478135108948
3x3@112,16,112,112,3,64-64-32/4x2,64,64,32,4,2,block,1.0,3.8033816528320314,1.2261785888671874,0.3223916768789596,8.191441156668589e-05,0.001953125,0.0003604204975999892
3x3@112,16,112,112,3,64-64-32/4x2,64,64,32,4,2,block,0.85,4.025442504882813,1.2261785888671874,0.30460715495994484,0.07097878307104111,3.01171875,0.39073869585990906
3x3@112,16,112,112,3,64-64-32/4x2,64,64,32,4,2,block,0.75,4.077730407714844,1.2261785888671874,0.3007012397257367,0.11369543522596359,3.544921875,0.4950806200504303
3x3@112,16,112,112,3,64-64-32/4x2,64,64,32,4,2,block,0.65,3.69033203125,1.2261785888671874,0.33226782264680194,0.15650387108325958,3.544921875,0.5813040733337402
3x3@112,16,112,112,3,64-64-32/4x2,64,64,32,4,2,block,0.5,3.0683953857421873,1.2261785888671874,0.39961557580383267,0.22801008820533752,3.544921875,0.7024203538894653
3x3@112,16,112,112,3,64-64-32/4x2,64,64,32,4,2,block,0.35,2.7493792724609376,1.2261785888671874,0.44598379028647045,0.2996343970298767,3.544921875,0.8058054447174072
3x3@112,16,112,112,3,64-64-32/4x2,64,64,32,4,2,block,0.25,2.7160986328125,1.2261785888671874,0.45144847615400796,0.34284085035324097,3.544921875,0.862471878528595
3x3@112,16,112,112,3,64-64-32/4x2,64,64,32,4,2,input,1.0,3.812536315917969,1.2261785888671874,0.3216175499096728,8.191441156668589e-05,0.001953125,0.0003604204975999892
3x3@112,16,112,112,3,64-64-32/4x2,64,64,32,4,2,input,0.85,3.5142657470703127,1.2261785888671874,0.34891458902600014,0.17681582272052765,1.222412109375,0.38564327359199524
3x3@112,16,112,112,3,64-64-32/4x2,64,64,32,4,2,input,0.75,3.5637246704101564,1.2261785888671874,0.34407220037177116,0.2249697744846344,1.6400146484375,0.4905202388763428
3x3@112,16,112,112,3,64-64-32/4x2,64,64,32,4,2,input,0.65,3.021045837402344,1.2261785888671874,0.4058788429114075,0.2649136185646057,1.85205078125,0.577515721321106
3x3@112,16,112,112,3,64-64-32/4x2,64,64,32,4,2,input,0.5,2.7782962036132814,1.2261785888671874,0.4413419228923449,0.3207659423351288,2.313720703125,0.6990968585014343
3x3@112,16,112,112,3,64-64-32/4x2,64,64,32,4,2,input,0.35,2.4971878051757814,1.2261785888671874,0.4910237773569756,0.3686618208885193,2.5283203125,0.803466796875
3x3@112,16,112,112,3,64-64-32/4x2,64,64,32,4,2,input,0.25,2.349225616455078,1.2261785888671874,0.5219501184894535,0.39485684037208557,2.729736328125,0.8604445457458496
3x3@112,16,112,112,3,64-64-64/4x2,64,64,64,4,2,dense,1.0,3.3960345458984373,1.2261785888671874,0.36106187151367625,8.191441156668589e-05,0.001953125,0.0003604204975999892
3x3@112,16,112,112,3,64-64-64/4x2,64,64,64,4,2,channel,1.0,3.382169494628906,1.2261785888671874,0.3625420283680149,8.191441156668589e-05,0.001953125,0.0003604204975999892
3x3@112,16,112,112,3,64-64-64/4x2,64,64,64,4,2,channel,0.85,3.9613031005859374,1.2261785888671874,0.3095391990291823,0.06625448912382126,3.544921875,0.37420424818992615
3x3@112,16,112,112,3,64-64-64/4x2,64,64,64,4,2,channel,0.75,3.655679931640625,1.2261785888671874,0.335417381115445,0.11215022951364517,3.544921875,0.48837369680404663
3x3@112,16,112,112,3,64-64-64/4x2,64,64,64,4,2,channel,0.65,3.6635647583007813,1.2261785888671874,0.33469548643543245,0.15833987295627594,3.544921875,0.5815834999084473
3x3@112,16,112,112,3,64-64-64/4x2,64,64,64,4,2,channel,0.5,2.858823547363281,1.2261785888671874,0.4289102032890778,0.2262498140335083,3.544921875,0.6969850063323975
3x3@112,16,112,112,3,64-64-64/4x2,64,64,64,4,2,channel,0.35,2.7183877563476564,1.2261785888671874,0.4510683165063412,0.29448142647743225,3.544921875,0.7966587543487549
3x3@112,16,112,112,3,64-64-64/4x2,64,64,64,4,2,channel,0.25,2.524938201904297,1.2261785888671874,0.48562716819857576,0.34146085381507874,3.544921875,0.8589478135108948
3x3@112,16,112,112,3,64-64-64/4x2,64,64,64,4,2,block,1.0,3.404942626953125,1.2261785888671874,0.3601172540062502,8.191441156668589e-05,0.001953125,0.0003604204975999892
3x3@112,16,112,112,3,64-64-64/4x2,64,64,64,4,2,block,0.85,3.9216128540039064,1.2261785888671874,0.31267201391776295,0.07097878307104111,3.01171875,0.39073869585990906
3x3@112,16,112,112,3,64-64-64/4x2,64,64,64,4,2,block,0.75,3.649516906738281,1.2261785888671874,0.3359838083235713,0.11369543522596359,3.544921875,0.4950806200504303
3x3@112,16,112,112,3,64-64-64/4x2,64,64,64,4,2,block,0.65,3.590574035644531,1.2261785888671874,0.3414993192438324,0.15650387108325958,3.544921875,0.5813040733337402
3x3@112,16,112,112,3,64-64-64/4x2,64,64,64,4,2,block,0.5,2.8645172119140625,1.2261785888671874,0.4280576788881845,0.22801008820533752,3.544921875,0.7024203538894653
3x3@112,16,112,112,3,64-64-64/4x2,64,64,64,4,2,block,0.35,2.6727218627929688,1.2261785888671874,0.45877523057556113,0.2996343970298767,3.544921875,0.8058054447174072
3x3@112,16,112,112,3,64-64-64/4x2,64,64,64,4,2,block,0.25,2.5134080505371093,1.2261785888671874,0.48785496195301675,0.34284085035324097,3.544921875,0.862471878528595
3x3@112,16,112,112,3,64-64-64/4x2,64,64,64,4,2,input,1.0,3.378462219238281,1.2261785888671874,0.3629398552645782,8.191441156668589e-05,0.001953125,0.0003604204975999892
3x3@112,16,112,112,3,64-64-64/4x2,64,64,64,4,2,input,0.85,3.391058044433594,1.2261785888671874,0.3615917429900541,0.17681582272052765,1.222412109375,0.38564327359199524
3x3@112,16,112,112,3,64-64-64/4x2,64,64,64,4,2,input,0.75,3.195228271484375,1.2261785888671874,0.3837530481969459,0.2249697744846344,1.6400146484375,0.4905202388763428
3x3@112,16,112,112,3,64-64-64/4x2,64,64,64,4,2,input,0.65,3.032473449707031,1.2261785888671874,0.40434932381210104,0.2649136185646057,1.85205078125,0.577515721321106
3x3@112,16,112,112,3,64-64-64/4x2,64,64,64,4,2,input,0.5,2.7632403564453125,1.2261785888671874,0.4437466273996403,0.3207659423351288,2.313720703125,0.6990968585014343
3x3@112,16,112,112,3,64-64-64/4x2,64,64,64,4,2,input,0.35,2.527493743896484,1.2261785888671874,0.4851361519007608,0.3686618208885193,2.5283203125,0.803466796875
3x3@112,16,112,112,3,64-64-64/4x2,64,64,64,4,2,input,0.25,2.3424000549316406,1.2261785888671874,0.5234710382992078,0.39485684037208557,2.729736328125,0.8604445457458496
3x3@112,16,112,112,3,64-128-32/4x2,64,128,32,4,2,dense,1.0,3.1450726318359377,1.2261785888671874,0.3898729003760416,8.191441156668589e-05,0.001953125,0.0003604204975999892
3x3@112,16,112,112,3,64-128-32/4x2,64,128,32,4,2,channel,1.0,3.1445574951171875,1.2261785888671874,0.3899367687730867,8.191441156668589e-05,0.001953125,0.0003604204975999892
3x3@112,16,112,112,3,64-128-32/4x2,64,128,32,4,2,channel,0.85,3.7899468994140624,1.2261785888671874,0.3235345036250398,0.06625448912382126,3.544921875,0.37420424818992615
3x3@112,16,112,112,3,64-128-32/4x2,64,128,32,4,2,channel,0.75,3.440064697265625,1.2261785888671874,0.3564405605051061,0.11215022951364517,3.544921875,0.48837369680404663
3x3@112,16,112,112,3,64-128-32/4x2,64,128,32,4,2,channel,0.65,3.476990051269531,1.2261785888671874,0.35265519049140814,0.15833987295627594,3.544921875,0.5815834999084473
3x3@112,16,112,112,3,64-128-32/4x2,64,128,32,4,2,channel,0.5,3.058910217285156,1.2261785888671874,0.40085471680023527,0.2262498140335083,3.544921875,0.6969850063323975
3x3@112,16,112,112,3,64-128-32/4x2,64,128,32,4,2,channel,0.35,3.0609817504882812,1.2261785888671874,0.40058343656298834,0.29448142647743225,3.544921875,0.7966587543487549
3x3@112,16,112,112,3,64-128-32/4x2,64,128,32,4,2,channel,0.25,2.7671551513671875,1.2261785888671874,0.44311884292478537,0.34146085381507874,3.544921875,0.8589478135108948
3x3@112,16,112,112,3,64-128-32/4x2,64,128,32,4,2,block,1.0,3.141607666015625,1.2261785888671874,0.39030290196047956,8.191441156668589e-05,0.001953125,0.0003604204975999892
3x3@112,16,112,112,3,64-128-32/4x2,64,128,32,4,2,block,0.85,3.7631591796875,1.2261785888671874,0.32583755571270084,0.07097878307104111,3.01171875,0.39073869585990906
3x3@112,16,112,112,3,64-128-32/4x2,64,128,32,4,2,block,0.75,3.4442239379882813,1.2261785888671874,0.3560101233090493,0.11369543522596359,3.544921875,0.4950806200504303
3x3@112,16,112,112,3,64-128-32/4x2,64,128,32,4,2,block,0.65,3.4533990478515624,1.2261785888671874,0.3550642633176206,0.15650387108325958,3.544921875,0.5813040733337402
3x3@112,16,112,112,3,64-128-32/4x2,64,128,32,4,2,block,0.5,3.075788879394531,1.2261785888671874,0.39865499127123466,0.22801008820533752,3.544921875,0.7024203538894653
3x3@112,16,112,112,3,64-128-32/4x2,64,128,32,4,2,block,0.35,3.044454345703125,1.2261785888671874,0.40275808063858426,0.2996343970298767,3.544921875,0.8058054447174072
3x3@112,16,112,112,3,64-128-32/4x2,64,128,32,4,2,block,0.25,2.7661517333984373,1.2261785888671874,0.4432795837127595,0.34284085035324097,3.544921875,0.862471878528595
3x3@112,16,112,112,3,64-128-32/4x2,64,128,32,4,2,input,1.0,3.1679898071289063,1.2261785888671874,0.3870525675644303,8.191441156668589e-05,0.001953125,0.0003604204975999892
3x3@112,16,112,112,3,64-128-32/4x2,64,128,32,4,2,input,0.85,3.2003884887695313,1.2261785888671874,0.383134295467555,0.17681582272052765,1.222412109375,0.38564327359199524
3x3@112,16,112,112,3,64-128-32/4x2,64,128,32,4,2,input,0.75,3.0063821411132814,1.2261785888671874,0.4078585260665253,0.2249697744846344,1.6400146484375,0.4905202388763428
3x3@112,16,112,112,3,64-128-32/4x2,64,128,32,4,2,input,0.65,2.7948236083984375,1.2261785888671874,0.4387320134202832,0.2649136185646057,1.85205078125,0.577515721321106
3x3@112,16,112,112,3,64-128-32/4x2,64,128,32,4,2,input,0.5,2.569093017578125,1.2261785888671874,0.4772807292213584,0.3207659423351288,2.313720703125,0.6990968585014343
3x3@112,16,112,112,3,64-128-32/4x2,64,128,32,4,2,input,0.35,2.3616717529296873,1.2261785888671874,0.5191994134435048,0.3686618208885193,2.5283203125,0.803466796875
3x3@112,16,112,112,3,64-128-32/4x2,64,128,32,4,2,input,0.25,2.235842590332031,1.2261785888671874,0.5484190140080905,0.39485684037208557,2.729736328125,0.8604445457458496
3x3@112,16,112,112,3,128-64-32/8x2,128,64,32,8,2,dense,1.0,3.7057540893554686,1.2261785888671874,0.3308850396709549,8.191441156668589e-05,0.001953125,0.0003604204975999892
3x3@112,16,112,112,3,128-64-32/8x2,128,64,32,8,2,channel,1.0,3.6994049072265627,1.2261785888671874,0.33145292813769106,8.191441156668589e-05,0.001953125,0.0003604204975999892
3x3@112,16,112,112,3,128-64-32/8x2,128,64,32,8,2,channel,0.85,4.156189575195312,1.2261785888671874,0.2950247015163079,0.06625448912382126,3.544921875,0.37420424818992615
3x3@112,16,112,112,3,128-64-32/8x2,128,64,32,8,2,channel,0.75,3.9758233642578125,1.2261785888671874,0.3084087185286926,0.11215022951364517,3.544921875,0.48837369680404663
3x3@112,16,112,112,3,128-64-32/8x2,128,64,32,8,2,channel,0.65,3.883848876953125,1.2261785888671874,0.3157122297274149,0.15833987295627594,3.544921875,0.5815834999084473
3x3@112,16,112,112,3,128-64-32/8x2,128,64,32,8,2,channel,0.5,3.0194686889648437,1.2261785888671874,0.40609084417681274,0.2262498140335083,3.544921875,0.6969850063323975
3x3@112,16,112,112,3,128-64-32/8x2,128,64,32,8,2,channel,0.35,2.8102426147460937,1.2261785888671874,0.4363248149583601,0.29448142647743225,3.544921875,0.7966587543487549
3x3@112,16,112,112,3,128-64-32/8x2,128,64,32,8,2,channel,0.25,2.6357101440429687,1.2261785888671874,0.46521753981123565,0.34146085381507874,3.544921875,0.8589478135108948
3x3@112,16,112,112,3,128-64-32/8x2,128,64,32,8,2,block,1.0,3.6936090087890623,1.2261785888671874,0.33197303394849204,8.191441156668589e-05,0.001953125,0.0003604204975999892
3x3@112,16,112,112,3,128-64-32/8x2,128,64,32,8,2,block,0.85,4.132289428710937,1.2261785888671874,0.29673105188319115,0.07097878307104111,3.01171875,0.39073869585990906
3x3@112,16,112,112,3,128-64-32/8x2,128,64,32,8,2,block,0.75,3.9480319213867188,1.2261785888671874,0.31057970484607955,0.11369543522596359,3.544921875,0.4950806200504303
3x3@112,16,112,112,3,128-64-32/8x2,128,64,32,8,2,block,0.65,3.8384832763671874,1.2261785888671874,0.31944351468626586,0.15650387108325958,3.544921875,0.5813040733337402
3x3@112,16,112,112,3,128-64-32/8x2,128,64,32,8,2,block,0.5,3.0223974609375,1.2261785888671874,0.40569733290036786,0.22801008820533752,3.544921875,0.7024203538894653
3x3@112,16,112,112,3,128-64-32/8x2,128,64,32,8,2,block,0.35,2.7787469482421874,1.2261785888671874,0.4412703321699941,0.2996343970298767,3.544921875,0.8058054447174072
3x3@112,16,112,112,3,128-64-32/8x2,128,64,32,8,2,block,0.25,2.6780856323242186,1.2261785888671874,0.4578563784769754,0.34284085035324097,3.544921875,0.862471878528595
3x3@112,16,112,112,3,128-64-32/8x2,128,64,32,8,2,input,1.0,3.704010314941406,1.2261785888671874,0.33104081376905786,8.191441156668589e-05,0.001953125,0.0003604204975999892
3x3@112,16,112,112,3,128-64-32/8x2,128,64,32,8,2,input,0.85,3.459358825683594,1.2261785888671874,0.35445255917471524,0.17681582272052765,1.222412109375,0.38564327359199524
3x3@112,16,112,112,3,128-64-32/8x2,128,64,32,8,2,input,0.75,3.50455810546875,1.2261785888671874,0.3498810839956613,0.2249697744846344,1.6400146484375,0.4905202388763428
3x3@112,16,112,112,3,128-64-32/8x2,128,64,32,8,2,input,0.65,3.027268371582031,1.2261785888671874,0.40504456108937387,0.2649136185646057,1.85205078125,0.577515721321106
3x3@112,16,112,112,3,128-64-32/8x2,128,64,32,8,2,input,0.5,2.775326843261719,1.2261785888671874,0.4418141206842917,0.3207659423351288,2.313720703125,0.6990968585014343
3x3@112,16,112,112,3,128-64-32/8x2,128,64,32,8,2,input,0.35,2.501509094238281,1.2261785888671874,0.4901755471093194,0.3686618208885193,2.5283203125,0.803466796875
3x3@112,16,112,112,3,128-64-32/8x2,128,64,32,8,2,input,0.25,2.332054443359375,1.2261785888671874,0.5257932945599892,0.39485684037208557,2.729736328125,0.8604445457458496
3x3@112,16,112,112,3,128-128-32/8x2,128,128,32,8,2,dense,1.0,3.1988531494140626,1.2261785888671874,0.3833181867357018,8.191441156668589e-05,0.001953125,0.0003604204975999892
3x3@112,16,112,112,3,128-128-32/8x2,128,128,32,8,2,channel,1.0,3.194777526855469,1.2261785888671874,0.38380719112985656,8.191441156668589e-05,0.001953125,0.0003604204975999892
3x3@112,16,112,112,3,128-128-32/8x2,128,128,32,8,2,channel,0.85,4.32353271484375,1.2261785888671874,0.2836057154505655,0.06625448912382126,3.544921875,0.37420424818992615
3x3@112,16,112,112,3,128-128-32/8x2,128,128,32,8,2,channel,0.75,3.4681036376953127,1.2261785888671874,0.3535588082027531,0.11215022951364517,3.544921875,0.48837369680404663
3x3@112,16,112,112,3,128-128-32/8x2,128,128,32,8,2,channel,0.65,3.9757003784179688,1.2261785888671874,0.3084182589622397,0.15833987295627594,3.544921875,0.5815834999084473
3x3@112,16,112,112,3,128-128-32/8x2,128,128,32,8,2,channel,0.5,3.0921319580078124,1.2261785888671874,0.3965479499319898,0.2262498140335083,3.544921875,0.6969850063323975
3x3@112,16,112,112,3,128-128-32/8x2,128,128,32,8,2,channel,0.35,3.3464306640625,1.2261785888671874,0.3664138635935852,0.29448142647743225,3.544921875,0.7966587543487549
3x3@112,16,112,112,3,128-128-32/8x2,128,128,32,8,2,channel,0.25,2.8071322631835938,1.2261785888671874,0.4368082704719326,0.34146085381507874,3.544921875,0.8589478135108948
3x3@112,16,112,112,3,128-128-32/8x2,128,128,32,8,2,block,1.0,3.2005734252929687,1.2261785888671874,0.38311215708321006,8.191441156668589e-05,0.001953125,0.0003604204975999892
3x3@112,16,112,112,3,128-128-32/8x2,128,128,32,8,2,block,0.85,4.282818603515625,1.2261785888671874,0.28630177982804544,0.07097878307104111,3.01171875,0.39073869585990906
3x3@112,16,112,112,3,128-128-32/8x2,128,128,32,8,2,block,0.75,3.467121276855469,1.2261785888671874,0.3536589841989257,0.11369543522596359,3.544921875,0.4950806200504303
3x3@112,16,112,112,3,128-128-32/8x2,128,128,32,8,2,block,0.65,3.93344970703125,1.2261785888671874,0.3117310961610436,0.15650387108325958,3.544921875,0.5813040733337402
3x3@112,16,112,112,3,128-128-32/8x2,128,128,32,8,2,block,0.5,3.0957772827148435,1.2261785888671874,0.39608100870612034,0.22801008820533752,3.544921875,0.7024203538894653
3x3@112,16,112,112,3,128-128-32/8x2,128,128,32,8,2,block,0.35,3.3489471435546876,1.2261785888671874,0.36613853139696895,0.2996343970298767,3.544921875,0.8058054447174072
3x3@112,16,112,112,3,128-128-32/8x2,128,128,32,8,2,block,0.25,2.8097125244140626,1.2261785888671874,0.43640713354576893,0.34284085035324097,3.544921875,0.862471878528595
3x3@112,16,112,112,3,128-128-32/8x2,128,128,32,8,2,input,1.0,3.2111001586914063,1.2261785888671874,0.38185622629936344,8.191441156668589e-05,0.001953125,0.0003604204975999892
3x3@112,16,112,112,3,128-128-32/8x2,128,128,32,8,2,input,0.85,3.4622900390625,1.2261785888671874,0.3541524756831768,0.17681582272052765,1.222412109375,0.38564327359199524
3x3@112,16,112,112,3,128-128-32/8x2,128,128,32,8,2,input,0.75,3.030220947265625,1.2261785888671874,0.4046498952406926,0.2249697744846344,1.6400146484375,0.4905202388763428
3x3@112,16,112,112,3,128-128-32/8x2,128,128,32,8,2,input,0.65,3.025797119140625,1.2261785888671874,0.40524150846420326,0.2649136185646057,1.85205078125,0.577515721321106
3x3@112,16,112,112,3,128-128-32/8x2,128,128,32,8,2,input,0.5,2.6329498291015625,1.2261785888671874,0.4657052615718069,0.3207659423351288,2.313720703125,0.6990968585014343
3x3@112,16,112,112,3,128-128-32/8x2,128,128,32,8,2,input,0.35,2.546012115478516,1.2261785888671874,0.4816075231585183,0.3686618208885193,2.5283203125,0.803466796875
3x3@112,16,112,112,3,128-128-32/8x2,128,128,32,8,2,input,0.25,2.264290618896484,1.2261785888671874,0.5415288031643098,0.39485684037208557,2.729736328125,0.8604445457458496
3x3@112,16,112,112,3,128-128-64/8x2,128,128,64,8,2,dense,1.0,3.353415832519531,1.2261785888671874,0.3656506231575579,8.191441156668589e-05,0.001953125,0.0003604204975999892
3x3@112,16,112,112,3,128-128-64/8x2,128,128,64,8,2,channel,1.0,3.3337139892578125,1.2261785888671874,0.36781157376376267,8.191441156668589e-05,0.001953125,0.0003604204975999892
3x3@112,16,112,112,3,128-128-64/8x2,128,128,64,8,2,channel,0.85,4.1556832885742185,1.2261785888671874,0.29506064435624485,0.06625448912382126,3.544921875,0.37420424818992615
3x3@112,16,112,112,3,128-128-64/8x2,128,128,64,8,2,channel,0.75,3.617448425292969,1.2261785888671874,0.33896228631590847,0.11215022951364517,3.544921875,0.48837369680404663
3x3@112,16,112,112,3,128-128-64/8x2,128,128,64,8,2,channel,0.65,3.819310607910156,1.2261785888671874,0.321047098480981,0.15833987295627594,3.544921875,0.5815834999084473
3x3@112,16,112,112,3,128-128-64/8x2,128,128,64,8,2,channel,0.5,3.260498046875,1.2261785888671874,0.37607094721078244,0.2262498140335083,3.544921875,0.6969850063323975
3x3@112,16,112,112,3,128-128-64/8x2,128,128,64,8,2,channel,0.35,3.3252352905273437,1.2261785888671874,0.3687494212395207,0.29448142647743225,3.544921875,0.7966587543487549
3x3@112,16,112,112,3,128-128-64/8x2,128,128,64,8,2,channel,0.25,2.9339007568359374,1.2261785888671874,0.4179345828280704,0.34146085381507874,3.544921875,0.8589478135108948
3x3@112,16,112,112,3,128-128-64/8x2,128,128,64,8,2,block,1.0,3.3417178344726564,1.2261785888671874,0.36693061760574586,8.191441156668589e-05,0.001953125,0.0003604204975999892
3x3@112,16,112,112,3,128-128-64/8x2,128,128,64,8,2,block,0.85,4.156968994140625,1.2261785888671874,0.2949693852890228,0.07097878307104111,3.01171875,0.39073869585990906
3x3@112,16,112,112,3,128-128-64/8x2,128,128,64,8,2,block,0.75,3.6119961547851562,1.2261785888671874,0.33947394635034467,0.11369543522596359,3.544921875,0.4950806200504303
3x3@112,16,112,112,3,128-128-64/8x2,128,128,64,8,2,block,0.65,3.787980651855469,1.2261785888671874,0.3237024424257731,0.15650387108325958,3.544921875,0.5813040733337402
3x3@112,16,112,112,3,128-128-64/8x2,128,128,64,8,2,block,0.5,3.249459228515625,1.2261785888671874,0.3773485071321588,0.22801008820533752,3.544921875,0.7024203538894653
3x3@112,16,112,112,3,128-128-64/8x2,128,128,64,8,2,block,0.35,3.3606246948242187,1.2261785888671874,0.3648662674995085,0.2996343970298767,3.544921875,0.8058054447174072
3x3@112,16,112,112,3,128-128-64/8x2,128,128,64,8,2,block,0.25,3.172413330078125,1.2261785888671874,0.3865128724689198,0.34284085035324097,3.544921875,0.862471878528595
3x3@112,16,112,112,3,128-128-64/8x2,128,128,64,8,2,input,1.0,3.5705856323242187,1.2261785888671874,0.34341105777346254,8.191441156668589e-05,0.001953125,0.0003604204975999892
3x3@112,16,112,112,3,128-128-64/8x2,128,128,64,8,2,input,0.85,3.544637451171875,1.2261785888671874,0.3459249657427748,0.17681582272052765,1.222412109375,0.38564327359199524
3x3@112,16,112,112,3,128-128-64/8x2,128,128,64,8,2,input,0.75,3.2338739013671876,1.2261785888671874,0.3791670999752943,0.2249697744846344,1.6400146484375,0.4905202388763428
3x3@112,16,112,112,3,128-128-64/8x2,128,128,64,8,2,input,0.65,3.103599853515625,1.2261785888671874,0.3950826932403109,0.2649136185646057,1.85205078125,0.577515721321106
3x3@112,16,112,112,3,128-128-64/8x2,128,128,64,8,2,input,0.5,2.9157504272460937,1.2261785888671874,0.4205361945279057,0.3207659423351288,2.313720703125,0.6990968585014343
3x3@112,16,112,112,3,128-128-64/8x2,128,128,64,8,2,input,0.35,2.7049984741210937,1.2261785888671874,0.45330102792963556,0.3686618208885193,2.5283203125,0.803466796875
3x3@112,16,112,112,3,128-128-64/8x2,128,128,64,8,2,input,0.25,2.494361572265625,1.2261785888671874,0.49158013116496624,0.39485684037208557,2.729736328125,0.8604445457458496
3x3@112,16,112,112,3,128-64-32/8x3,128,64,32,8,3,dense,1.0,3.698892822265625,1.2261785888671874,0.331498815398532,8.191441156668589e-05,0.001953125,0.0003604204975999892
3x3@112,16,112,112,3,128-64-32/8x3,128,64,32,8,3,channel,1.0,3.734630432128906,1.2261785888671874,0.3283266205722559,8.191441156668589e-05,0.001953125,0.0003604204975999892
3x3@112,16,112,112,3,128-64-32/8x3,128,64,32,8,3,channel,0.85,4.0748422241210935,1.2261785888671874,0.30091437199919147,0.06625448912382126,3.544921875,0.37420424818992615
3x3@112,16,112,112,3,128-64-32/8x3,128,64,32,8,3,channel,0.75,4.337950744628906,1.2261785888671874,0.2826630962523946,0.11215022951364517,3.544921875,0.48837369680404663
3x3@112,16,112,112,3,128-64-32/8x3,128,64,32,8,3,channel,0.65,4.010946044921875,1.2261785888671874,0.30570807364003594,0.15833987295627594,3.544921875,0.5815834999084473
3x3@112,16,112,112,3,128-64-32/8x3,128,64,32,8,3,channel,0.5,3.233525695800781,1.2261785888671874,0.37920793097749755,0.2262498140335083,3.544921875,0.6969850063323975
3x3@112,16,112,112,3,128-64-32/8x3,128,64,32,8,3,channel,0.35,2.98461181640625,1.2261785888671874,0.41083352351784913,0.29448142647743225,3.544921875,0.7966587543487549
3x3@112,16,112,112,3,128-64-32/8x3,128,64,32,8,3,channel,0.25,2.8337969970703125,1.2261785888671874,0.4326981043931014,0.34146085381507874,3.544921875,0.8589478135108948
3x3@112,16,112,112,3,128-64-32/8x3,128,64,32,8,3,block,1.0,3.9672421264648436,1.2261785888671874,0.3090758138222884,8.191441156668589e-05,0.001953125,0.0003604204975999892
3x3@112,16,112,112,3,128-64-32/8x3,128,64,32,8,3,block,0.85,4.281466979980468,1.2261785888671874,0.28639216292000486,0.07097878307104111,3.01171875,0.39073869585990906
3x3@112,16,112,112,3,128-64-32/8x3,128,64,32,8,3,block,0.75,4.17554443359375,1.2261785888671874,0.29365717653538587,0.11369543522596359,3.544921875,0.4950806200504303
3x3@112,16,112,112,3,128-64-32/8x3,128,64,32,8,3,block,0.65,3.836661682128906,1.2261785888671874,0.31959518207683074,0.15650387108325958,3.544921875,0.5813040733337402
3x3@112,16,112,112,3,128-64-32/8x3,128,64,32,8,3,block,0.5,3.1338906860351563,1.2261785888671874,0.39126399473061646,0.22801008820533752,3.544921875,0.7024203538894653
3x3@112,16,112,112,3,128-64-32/8x3,128,64,32,8,3,block,0.35,2.9452288818359373,1.2261785888671874,0.41632709648794325,0.2996343970298767,3.544921875,0.8058054447174072
3x3@112,16,112,112,3,128-64-32/8x3,128,64,32,8,3,block,0.25,2.802956848144531,1.2261785888671874,0.4374589604113524,0.34284085035324097,3.544921875,0.862471878528595
3x3@112,16,112,112,3,128-64-32/8x3,128,64,32,8,3,input,1.0,3.936624755859375,1.2261785888671874,0.3114796722857852,8.191441156668589e-05,0.001953125,0.0003604204975999892
3x3@112,16,112,112,3,128-64-32/8x3,128,64,32,8,3,input,0.85,3.793203125,1.2261785888671874,0.32325676966407846,0.17681582272052765,1.222412109375,0.38564327359199524
3x3@112,16,112,112,3,128-64-32/8x3,128,64,32,8,3,input,0.75,3.7110751342773436,1.2261785888671874,0.3304106073039561,0.2249697744846344,1.6400146484375,0.4905202388763428
3x3@112,16,112,112,3,128-64-32/8x3,128,64,32,8,3,input,0.65,3.259043884277344,1.2261785888671874,0.3762387474383698,0.2649136185646057,1.85205078125,0.577515721321106
3x3@112,16,112,112,3,128-64-32/8x3,128,64,32,8,3,input,0.5,2.9725082397460936,1.2261785888671874,0.4125063717138511,0.3207659423351288,2.313720703125,0.6990968585014343
3x3@112,16,112,112,3,128-64-32/8x3,128,64,32,8,3,input,0.35,2.6599847412109376,1.2261785888671874,0.4609720386249205,0.3686618208885193,2.5283203125,0.803466796875
3x3@112,16,112,112,3,128-64-32/8x3,128,64,32,8,3,input,0.25,2.494218292236328,1.2261785888671874,0.4916083699184925,0.39485684037208557,2.729736328125,0.8604445457458496
3x3@112,16,112,112,3,64-128-32/4x3,64,128,32,4,3,dense,1.0,3.3284710693359374,1.2261785888671874,0.3683909408627734,8.191441156668589e-05,0.001953125,0.0003604204975999892
3x3@112,16,112,112,3,64-128-32/4x3,64,128,32,4,3,channel,1.0,3.3055743408203124,1.2261785888671874,0.3709426751427707,8.191441156668589e-05,0.001953125,0.0003604204975999892
3x3@112,16,112,112,3,64-128-32/4x3,64,128,32,4,3,channel,0.85,4.026958618164063,1.2261785888671874,0.30449247313751054,0.06625448912382126,3.544921875,0.37420424818992615
3x3@112,16,112,112,3,64-128-32/4x3,64,128,32,4,3,channel,0.75,3.673395080566406,1.2261785888671874,0.33379981242804985,0.11215022951364517,3.544921875,0.48837369680404663
3x3@112,16,112,112,3,64-128-32/4x3,64,128,32,4,3,channel,0.65,3.691356201171875,1.2261785888671874,0.33217563465642225,0.15833987295627594,3.544921875,0.5815834999084473
3x3@112,16,112,112,3,64-128-32/4x3,64,128,32,4,3,channel,0.5,3.2903988647460936,1.2261785888671874,0.3726534804046641,0.2262498140335083,3.544921875,0.6969850063323975
3x3@112,16,112,112,3,64-128-32/4x3,64,128,32,4,3,channel,0.35,3.2123699951171876,1.2261785888671874,0.3817052801299298,0.29448142647743225,3.544921875,0.7966587543487549
3x3@112,16,112,112,3,64-128-32/4x3,64,128,32,4,3,channel,0.25,2.951272277832031,1.2261785888671874,0.41547457280624867,0.34146085381507874,3.544921875,0.8589478135108948
3x3@112,16,112,112,3,64-128-32/4x3,64,128,32,4,3,block,1.0,3.3358642578125,1.2261785888671874,0.36757448568103807,8.191441156668589e-05,0.001953125,0.0003604204975999892
3x3@112,16,112,112,3,64-128-32/4x3,64,128,32,4,3,block,0.85,4.031343383789062,1.2261785888671874,0.30416128623473926,0.07097878307104111,3.01171875,0.39073869585990906
3x3@112,16,112,112,3,64-128-32/4x3,64,128,32,4,3,block,0.75,3.6769586181640626,1.2261785888671874,0.3334763091457986,0.11369543522596359,3.544921875,0.4950806200504303
3x3@112,16,112,112,3,64-128-32/4x3,64,128,32,4,3,block,0.65,3.6829183959960936,1.2261785888671874,0.3329366706034635,0.15650387108325958,3.544921875,0.5813040733337402
3x3@112,16,112,112,3,64-128-32/4x3,64,128,32,4,3,block,0.5,3.2988568115234376,1.2261785888671874,0.37169803326532647,0.22801008820533752,3.544921875,0.7024203538894653
3x3@112,16,112,112,3,64-128-32/4x3,64,128,32,4,3,block,0.35,3.254435729980469,1.2261785888671874,0.3767714868575838,0.2996343970298767,3.544921875,0.8058054447174072
3x3@112,16,112,112,3,64-128-32/4x3,64,128,32,4,3,block,0.25,2.991676025390625,1.2261785888671874,0.4098634272095303,0.34284085035324097,3.544921875,0.862471878528595
3x3@112,16,112,112,3,64-128-32/4x3,64,128,32,4,3,input,1.0,3.3412301635742185,1.2261785888671874,0.3669841731452304,8.191441156668589e-05,0.001953125,0.0003604204975999892
3x3@112,16,112,112,3,64-128-32/4x3,64,128,32,4,3,input,0.85,3.4650112915039064,1.2261785888671874,0.35387434144117713,0.17681582272052765,1.222412109375,0.38564327359199524
3x3@112,16,112,112,3,64-128-32/4x3,64,128,32,4,3,input,0.75,3.2423321533203127,1.2261785888671874,0.3781779690928699,0.2249697744846344,1.6400146484375,0.4905202388763428
3x3@112,16,112,112,3,64-128-32/4x3,64,128,32,4,3,input,0.65,3.0248141479492188,1.2261785888671874,0.40537319944054057,0.2649136185646057,1.85205078125,0.577515721321106
3x3@112,16,112,112,3,64-128-32/4x3,64,128,32,4,3,input,0.5,2.78572998046875,1.2261785888671874,0.4401641930352706,0.3207659423351288,2.313720703125,0.6990968585014343
3x3@112,16,112,112,3,64-128-32/4x3,64,128,32,4,3,input,0.35,2.521292724609375,1.2261785888671874,0.48632932499226555,0.3686618208885193,2.5283203125,0.803466796875
3x3@112,16,112,112,3,64-128-32/4x3,64,128,32,4,3,input,0.25,2.3642112731933596,1.2261785888671874,0.518641714795217,0.39485684037208557,2.729736328125,0.8604445457458496
3x3@112,16,112,112,3,64-64-32/2x2,64,64,32,2,2,dense,1.0,4.119507751464844,1.2261785888671874,0.2976517251196273,8.191441156668589e-05,0.001953125,0.0003604204975999892
3x3@112,16,112,112,3,64-64-32/2x2,64,64,32,2,2,channel,1.0,4.112281494140625,1.2261785888671874,0.29817477004293247,8.191441156668589e-05,0.001953125,0.0003604204975999892
3x3@112,16,112,112,3,64-64-32/2x2,64,64,32,2,2,channel,0.85,4.416163940429687,1.2261785888671874,0.2776569451241617,0.06625448912382126,3.544921875,0.37420424818992615
3x3@112,16,112,112,3,64-64-32/2x2,64,64,32,2,2,channel,0.75,4.406167602539062,1.2261785888671874,0.27828686955997767,0.11215022951364517,3.544921875,0.48837369680404663
3x3@112,16,112,112,3,64-64-32/2x2,64,64,32,2,2,channel,0.65,4.055695495605469,1.2261785888671874,0.30233497317434405,0.15833987295627594,3.544921875,0.5815834999084473
3x3@112,16,112,112,3,64-64-32/2x2,64,64,32,2,2,channel,0.5,3.301457824707031,1.2261785888671874,0.3714051955141961,0.2262498140335083,3.544921875,0.6969850063323975
3x3@112,16,112,112,3,64-64-32/2x2,64,64,32,2,2,channel,0.35,2.9915545654296873,1.2261785888671874,0.40988006805453914,0.29448142647743225,3.544921875,0.7966587543487549
3x3@112,16,112,112,3,64-64-32/2x2,64,64,32,2,2,channel,0.25,2.9853286743164062,1.2261785888671874,0.410734871311268,0.34146085381507874,3.544921875,0.8589478135108948
3x3@112,16,112,112,3,64-64-32/2x2,64,64,32,2,2,block,1.0,4.110335998535156,1.2261785888671874,0.2983159014990925,8.191441156668589e-05,0.001953125,0.0003604204975999892
3x3@112,16,112,112,3,64-64-32/2x2,64,64,32,2,2,block,0.85,4.370145263671875,1.2261785888671874,0.28058073928575317,0.07097878307104111,3.01171875,0.39073869585990906
3x3@112,16,112,112,3,64-64-32/2x2,64,64,32,2,2,block,0.75,4.397963562011719,1.2261785888671874,0.2788059909041875,0.11369543522596359,3.544921875,0.4950806200504303
3x3@112,16,112,112,3,64-64-32/2x2,64,64,32,2,2,block,0.65,4.016824340820312,1.2261785888671874,0.3052606947250221,0.15650387108325958,3.544921875,0.5813040733337402
3x3@112,16,112,112,3,64-64-32/2x2,64,64,32,2,2,block,0.5,3.324190673828125,1.2261785888671874,0.3688652996114465,0.22801008820533752,3.544921875,0.7024203538894653
3x3@112,16,112,112,3,64-64-32/2x2,64,64,32,2,2,block,0.35,2.998763427734375,1.2261785888671874,0.40889473892029876,0.2996343970298767,3.544921875,0.8058054447174072
3x3@112,16,112,112,3,64-64-32/2x2,64,64,32,2,2,block,0.25,2.9557144165039064,1.2261785888671874,0.4148501567067979,0.34284085035324097,3.544921875,0.862471878528595
3x3@112,16,112,112,3,64-64-32/2x2,64,64,32,2,2,input,1.0,4.126972045898437,1.2261785888671874,0.2971133739773732,8.191441156668589e-05,0.001953125,0.0003604204975999892
3x3@112,16,112,112,3,64-64-32/2x2,64,64,32,2,2,input,0.85,3.7479629516601562,1.2261785888671874,0.32715867384015973,0.17681582272052765,1.222412109375,0.38564327359199524
3x3@112,16,112,112,3,64-64-32/2x2,64,64,32,2,2,input,0.75,3.8836019897460936,1.2261785888671874,0.31573230009271724,0.2249697744846344,1.6400146484375,0.4905202388763428
3x3@112,16,112,112,3,64-64-32/2x2,64,64,32,2,2,input,0.65,3.2834744262695312,1.2261785888671874,0.3734393601658994,0.2649136185646057,1.85205078125,0.577515721321106
3x3@112,16,112,112,3,64-64-32/2x2,64,64,32,2,2,input,0.5,2.99694091796875,1.2261785888671874,0.4091433973607528,0.3207659423351288,2.313720703125,0.6990968585014343
3x3@112,16,112,112,3,64-64-32/2x2,64,64,32,2,2,input,0.35,2.6629119873046876,1.2261785888671874,0.460465308171257,0.3686618208885193,2.5283203125,0.803466796875
3x3@112,16,112,112,3,64-64-32/2x2,64,64,32,2,2,input,0.25,2.4788543701171877,1.2261785888671874,0.4946553551708727,0.39485684037208557,2.729736328125,0.8604445457458496
5x5@112,16,112,112,5,64-64-16/4x2,64,64,16,4,2,dense,1.0,12.859884033203125,2.486886444091797,0.19338327139427292,8.079518738668412e-05,0.001953125,0.0003583681827876717
5x5@112,16,112,112,5,64-64-16/4x2,64,64,16,4,2,channel,1.0,12.963922119140625,2.486886444091797,0.1918313316939806,8.079518738668412e-05,0.001953125,0.0003583681827876717
5x5@112,16,112,112,5,64-64-16/4x2,64,64,16,4,2,channel,0.85,13.04623046875,2.486886444091797,0.1906210725043303,0.06647877395153046,2.896484375,0.37810343503952026
5x5@112,16,112,112,5,64-64-16/4x2,64,64,16,4,2,channel,0.75,13.23496337890625,2.486886444091797,0.1879027824176205,0.11237408965826035,2.896484375,0.4927797019481659
5x5@112,16,112,112,5,64-64-16/4x2,64,64,16,4,2,channel,0.65,12.752813720703125,2.486886444091797,0.19500688228939977,0.15832528471946716,2.90625,0.5855605602264404
5x5@112,16,112,112,5,64-64-16/4x2,64,64,16,4,2,channel,0.5,8.722308959960937,2.486886444091797,0.28511790347116234,0.225979745388031,2.90625,0.7009423971176147
5x5@112,16,112,112,5,64-64-16/4x2,64,64,16,4,2,channel,0.35,8.365875244140625,2.486886444091797,0.29726554263806254,0.29383358359336853,2.982421875,0.8004061579704285
5x5@112,16,112,112,5,64-64-16/4x2,64,64,16,4,2,channel,0.25,8.344207153320312,2.486886444091797,0.2980374765866424,0.34042084217071533,3.080078125,0.8622490763664246
5x5@112,16,112,112,5,64-64-16/4x2,64,64,16,4,2,block,1.0,12.89101806640625,2.486886444091797,0.19291621742215814,8.079518738668412e-05,0.001953125,0.0003583681827876717
5x5@112,16,112,112,5,64-64-16/4x2,64,64,16,4,2,block,0.85,13.0069091796875,2.486886444091797,0.1911973405623138,0.07052034884691238,2.90625,0.3908939063549042
5x5@112,16,112,112,5,64-64-16/4x2,64,64,16,4,2,block,0.75,13.167288818359374,2.486886444091797,0.18886852702921567,0.11305427551269531,2.90625,0.49570026993751526
5x5@112,16,112,112,5,64-64-16/4x2,64,64,16,4,2,block,0.65,12.740587158203125,2.486886444091797,0.19519402153224907,0.1557004451751709,3.0,0.5823708772659302
5x5@112,16,112,112,5,64-64-16/4x2,64,64,16,4,2,block,0.5,8.70782470703125,2.486886444091797,0.2855921573712579,0.22683531045913696,3.0,0.7035990953445435
5x5@112,16,112,112,5,64-64-16/4x2,64,64,16,4,2,block,0.35,8.309636840820312,2.486886444091797,0.2992773922291285,0.29823169112205505,3.080078125,0.8075203895568848
5x5@112,16,112,112,5,64-64-16/4x2,64,64,16,4,2,block,0.25,8.330751953125,2.486886444091797,0.29851884416735336,0.3411329686641693,3.080078125,0.86406010389328
5x5@112,16,112,112,5,64-64-16/4x2,64,64,16,4,2,input,1.0,12.976822509765626,2.486886444091797,0.1916406302251808,8.079518738668412e-05,0.001953125,0.0003583681827876717
5x5@112,16,112,112,5,64-64-16/4x2,64,64,16,4,2,input,0.85,11.20638916015625,2.486886444091797,0.22191683766737244,0.17808641493320465,1.27197265625,0.3908116817474365
5x5@112,16,112,112,5,64-64-16/4x2,64,64,16,4,2,input,0.75,10.052935791015624,2.486886444091797,0.247379123451116,0.22585417330265045,1.659637451171875,0.49554041028022766
5x5@112,16,112,112,5,64-64-16/4x2,64,64,16,4,2,input,0.65,8.889012451171874,2.486886444091797,0.27977083593396707,0.26523882150650024,1.88165283203125,0.5819388031959534
5x5@112,16,112,112,5,64-64-16/4x2,64,64,16,4,2,input,0.5,7.3197802734375,2.486886444091797,0.33974878359619265,0.32041919231414795,2.25018310546875,0.7029388546943665
5x5@112,16,112,112,5,64-64-16/4x2,64,64,16,4,2,input,0.35,5.49791748046875,2.486886444091797,0.45233244277063356,0.36772656440734863,2.65966796875,0.8067489266395569
5x5@112,16,112,112,5,64-64-16/4x2,64,64,16,4,2,input,0.25,4.555755615234375,2.486886444091797,0.5458779298379588,0.39347755908966064,2.69482421875,0.8632180690765381
5x5@112,16,112,112,5,64-64-32/4x2,64,64,32,4,2,dense,1.0,8.900014038085937,2.486886444091797,0.2794250024156854,8.079518738668412e-05,0.001953125,0.0003583681827876717
5x5@112,16,112,112,5,64-64-32/4x2,64,64,32,4,2,channel,1.0,8.881008911132813,2.486886444091797,0.2800229646177197,8.079518738668412e-05,0.001953125,0.0003583681827876717
5x5@112,16,112,112,5,64-64-32/4x2,64,64,32,4,2,channel,0.85,9.300009155273438,2.486886444091797,0.26740688128050316,0.06647877395153046,2.896484375,0.37810343503952026
5x5@112,16,112,112,5,64-64-32/4x2,64,64,32,4,2,channel,0.75,9.176329956054687,2.486886444091797,0.27101100941241874,0.11237408965826035,2.896484375,0.4927797019481659
5x5@112,16,112,112,5,64-64-32/4x2,64,64,32,4,2,channel,0.65,8.915742797851562,2.486886444091797,0.2789320531645512,0.15832528471946716,2.90625,0.5855605602264404
5x5@112,16,112,112,5,64-64-32/4x2,64,64,32,4,2,channel,0.5,6.731161499023438,2.486886444091797,0.36945873969189363,0.225979745388031,2.90625,0.7009423971176147
5x5@112,16,112,112,5,64-64-32/4x2,64,64,32,4,2,channel,0.35,6.608834838867187,2.486886444091797,0.3762972603682242,0.29383358359336853,2.982421875,0.8004061579704285
5x5@112,16,112,112,5,64-64-32/4x2,64,64,32,4,2,channel,0.25,6.54688232421875,2.486886444091797,0.37985812497226473,0.34042084217071533,3.080078125,0.8622490763664246
5x5@112,16,112,112,5,64-64-32/4x2,64,64,32,4,2,block,1.0,9.093017578125,2.486886444091797,0.2734940763860921,8.079518738668412e-05,0.001953125,0.0003583681827876717
5x5@112,16,112,112,5,64-64-32/4x2,64,64,32,4,2,block,0.85,9.598692016601563,2.486886444091797,0.2590859712751034,0.07052034884691238,2.90625,0.3908939063549042
5x5@112,16,112,112,5,64-64-32/4x2,64,64,32,4,2,block,0.75,9.522667236328125,2.486886444091797,0.2611543995367755,0.11305427551269531,2.90625,0.49570026993751526
5x5@112,16,112,112,5,64-64-32/4x2,64,64,32,4,2,block,0.65,9.232586059570313,2.486886444091797,0.26935968189691994,0.1557004451751709,3.0,0.5823708772659302
5x5@112,16,112,112,5,64-64-32/4x2,64,64,32,4,2,block,0.5,6.7000927734375,2.486886444091797,0.37117194167087525,0.22683531045913696,3.0,0.7035990953445435
5x5@112,16,112,112,5,64-64-32/4x2,64,64,32,4,2,block,0.35,6.383042602539063,2.486886444091797,0.38960831047916816,0.29823169112205505,3.080078125,0.8075203895568848
5x5@112,16,112,112,5,64-64-32/4x2,64,64,32,4,2,block,0.25,6.330982055664062,2.486886444091797,0.39281211385947373,0.3411329686641693,3.080078125,0.86406010389328
5x5@112,16,112,112,5,64-64-32/4x2,64,64,32,4,2,input,1.0,9.158389892578125,2.486886444091797,0.27154188380941796,8.079518738668412e-05,0.001953125,0.0003583681827876717
5x5@112,16,112,112,5,64-64-32/4x2,64,64,32,4,2,input,0.85,8.005283813476563,2.486886444091797,0.3106556247144201,0.17808641493320465,1.27197265625,0.3908116817474365
5x5@112,16,112,112,5,64-64-32/4x2,64,64,32,4,2,input,0.75,7.591997680664062,2.486886444091797,0.327566807669819,0.22585417330265045,1.659637451171875,0.49554041028022766
5x5@112,16,112,112,5,64-64-32/4x2,64,64,32,4,2,input,0.65,6.850416870117187,2.486886444091797,0.36302702320789637,0.26523882150650024,1.88165283203125,0.5819388031959534
5x5@112,16,112,112,5,64-64-32/4x2,64,64,32,4,2,input,0.5,5.46482177734375,2.486886444091797,0.45507182949717007,0.32041919231414795,2.25018310546875,0.7029388546943665
5x5@112,16,112,112,5,64-64-32/4x2,64,64,32,4,2,input,0.35,4.397564086914063,2.486886444091797,0.565514542810663,0.36772656440734863,2.65966796875,0.8067489266395569
5x5@112,16,112,112,5,64-64-32/4x2,64,64,32,4,2,input,0.25,3.851776123046875,2.486886444091797,0.6456466743255556,0.39347755908966064,2.69482421875,0.8632180690765381
5x5@112,16,112,112,5,64-64-64/4x2,64,64,64,4,2,dense,1.0,7.349081420898438,2.486886444091797,0.33839418856074815,8.079518738668412e-05,0.001953125,0.0003583681827876717
5x5@112,16,112,112,5,64-64-64/4x2,64,64,64,4,2,channel,1.0,7.334398803710937,2.486886444091797,0.33907161454508356,8.079518738668412e-05,0.001953125,0.0003583681827876717
5x5@112,16,112,112,5,64-64-64/4x2,64,64,64,4,2,channel,0.85,8.1828662109375,2.486886444091797,0.3039138585411233,0.06647877395153046,2.896484375,0.37810343503952026
5x5@112,16,112,112,5,64-64-64/4x2,64,64,64,4,2,channel,0.75,7.59752685546875,2.486886444091797,0.32732841770762805,0.11237408965826035,2.896484375,0.4927797019481659
5x5@112,16,112,112,5,64-64-64/4x2,64,64,64,4,2,channel,0.65,7.7749481201171875,2.486886444091797,0.31985891168291336,0.15832528471946716,2.90625,0.5855605602264404
5x5@112,16,112,112,5,64-64-64/4x2,64,64,64,4,2,channel,0.5,5.9611749267578125,2.486886444091797,0.41718058514420653,0.225979745388031,2.90625,0.7009423971176147
5x5@112,16,112,112,5,64-64-64/4x2,64,64,64,4,2,channel,0.35,5.885234985351563,2.486886444091797,0.4225636614819449,0.29383358359336853,2.982421875,0.8004061579704285
5x5@112,16,112,112,5,64-64-64/4x2,64,64,64,4,2,channel,0.25,5.558067016601562,2.486886444091797,0.44743729009809324,0.34042084217071533,3.080078125,0.8622490763664246
5x5@112,16,112,112,5,64-64-64/4x2,64,64,64,4,2,block,1.0,7.312896118164063,2.486886444091797,0.3400686135708627,8.079518738668412e-05,0.001953125,0.0003583681827876717
5x5@112,16,112,112,5,64-64-64/4x2,64,64,64,4,2,block,0.85,8.141209716796874,2.486886444091797,0.30546890825829903,0.07052034884691238,2.90625,0.3908939063549042
5x5@112,16,112,112,5,64-64-64/4x2,64,64,64,4,2,block,0.75,7.573012084960937,2.486886444091797,0.32838802000995676,0.11305427551269531,2.90625,0.49570026993751526
5x5@112,16,112,112,5,64-64-64/4x2,64,64,64,4,2,block,0.65,7.798825073242187,2.486886444091797,0.3188796287564287,0.1557004451751709,3.0,0.5823708772659302
5x5@112,16,112,112,5,64-64-64/4x2,64,64,64,4,2,block,0.5,5.852426147460937,2.486886444091797,0.4249325632534,0.22683531045913696,3.0,0.7035990953445435
5x5@112,16,112,112,5,64-64-64/4x2,64,64,64,4,2,block,0.35,5.642158203125,2.486886444091797,0.4407686481946562,0.29823169112205505,3.080078125,0.8075203895568848
5x5@112,16,112,112,5,64-64-64/4x2,64,64,64,4,2,block,0.25,5.378209228515625,2.486886444091797,0.4624004642486124,0.3411329686641693,3.080078125,0.86406010389328
5x5@112,16,112,112,5,64-64-64/4x2,64,64,64,4,2,input,1.0,7.100620727539063,2.486886444091797,0.3502350765541738,8.079518738668412e-05,0.001953125,0.0003583681827876717
5x5@112,16,112,112,5,64-64-64/4x2,64,64,64,4,2,input,0.85,6.902373046875,2.486886444091797,0.36029441283497665,0.17808641493320465,1.27197265625,0.3908116817474365
5x5@112,16,112,112,5,64-64-64/4x2,64,64,64,4,2,input,0.75,6.183055419921875,2.486886444091797,0.4022099553044633,0.22585417330265045,1.659637451171875,0.49554041028022766
5x5@112,16,112,112,5,64-64-64/4x2,64,64,64,4,2,input,0.65,5.9376025390625,2.486886444091797,0.4188367994878378,0.26523882150650024,1.88165283203125,0.5819388031959534
5x5@112,16,112,112,5,64-64-64/4x2,64,64,64,4,2,input,0.5,4.719983215332031,2.486886444091797,0.5268845948463515,0.32041919231414795,2.25018310546875,0.7029388546943665
5x5@112,16,112,112,5,64-64-64/4x2,64,64,64,4,2,input,0.35,3.989603271484375,2.486886444091797,0.6233417898633624,0.36772656440734863,2.65966796875,0.8067489266395569
5x5@112,16,112,112,5,64-64-64/4x2,64,64,64,4,2,input,0.25,3.392428283691406,2.486886444091797,0.7330697176553836,0.39347755908966064,2.69482421875,0.8632180690765381
5x5@112,16,112,112,5,64-128-32/4x2,64,128,32,4,2,dense,1.0,6.949070434570313,2.486886444091797,0.35787325333759845,8.079518738668412e-05,0.001953125,0.0003583681827876717
5x5@112,16,112,112,5,64-128-32/4x2,64,128,32,4,2,channel,1.0,6.676971435546875,2.486886444091797,0.37245725372615873,8.079518738668412e-05,0.001953125,0.0003583681827876717
5x5@112,16,112,112,5,64-128-32/4x2,64,128,32,4,2,channel,0.85,8.00071533203125,2.486886444091797,0.3108330119102509,0.06647877395153046,2.896484375,0.37810343503952026
5x5@112,16,112,112,5,64-128-32/4x2,64,128,32,4,2,channel,0.75,7.2461309814453125,2.486886444091797,0.3432019722607557,0.11237408965826035,2.896484375,0.4927797019481659
5x5@112,16,112,112,5,64-128-32/4x2,64,128,32,4,2,channel,0.65,7.635455932617187,2.486886444091797,0.3257024159445803,0.15832528471946716,2.90625,0.5855605602264404
5x5@112,16,112,112,5,64-128-32/4x2,64,128,32,4,2,channel,0.5,6.812733154296875,2.486886444091797,0.36503505828982696,0.225979745388031,2.90625,0.7009423971176147
5x5@112,16,112,112,5,64-128-32/4x2,64,128,32,4,2,channel,0.35,7.046983642578125,2.486886444091797,0.3529008395969505,0.29383358359336853,2.982421875,0.8004061579704285
5x5@112,16,112,112,5,64-128-32/4x2,64,128,32,4,2,channel,0.25,6.365122680664062,2.486886444091797,0.39070518650747266,0.34042084217071533,3.080078125,0.8622490763664246
5x5@112,16,112,112,5,64-128-32/4x2,64,128,32,4,2,block,1.0,6.800076904296875,2.486886444091797,0.3657144586880139,8.079518738668412e-05,0.001953125,0.0003583681827876717
5x5@112,16,112,112,5,64-128-32/4x2,64,128,32,4,2,block,0.85,7.82599853515625,2.486886444091797,0.31777241369521225,0.07052034884691238,2.90625,0.3908939063549042
5x5@112,16,112,112,5,64-128-32/4x2,64,128,32,4,2,block,0.75,7.115120849609375,2.486886444091797,0.34952132179572587,0.11305427551269531,2.90625,0.49570026993751526
5x5@112,16,112,112,5,64-128-32/4x2,64,128,32,4,2,block,0.65,7.47399169921875,2.486886444091797,0.3327387217130237,0.1557004451751709,3.0,0.5823708772659302
5x5@112,16,112,112,5,64-128-32/4x2,64,128,32,4,2,block,0.5,6.689766845703125,2.486886444091797,0.37174486068810275,0.22683531045913696,3.0,0.7035990953445435
5x5@112,16,112,112,5,64-128-32/4x2,64,128,32,4,2,block,0.35,6.891888427734375,2.486886444091797,0.36084252816456736,0.29823169112205505,3.080078125,0.8075203895568848
5x5@112,16,112,112,5,64-128-32/4x2,64,128,32,4,2,block,0.25,6.36569580078125,2.486886444091797,0.39067001030532844,0.3411329686641693,3.080078125,0.86406010389328
5x5@112,16,112,112,5,64-128-32/4x2,64,128,32,4,2,input,1.0,6.79878662109375,2.486886444091797,0.3657838644878254,8.079518738668412e-05,0.001953125,0.0003583681827876717
5x5@112,16,112,112,5,64-128-32/4x2,64,128,32,4,2,input,0.85,6.659072265625,2.486886444091797,0.37345839553798343,0.17808641493320465,1.27197265625,0.3908116817474365
5x5@112,16,112,112,5,64-128-32/4x2,64,128,32,4,2,input,0.75,5.834895629882812,2.486886444091797,0.4262092420908895,0.22585417330265045,1.659637451171875,0.49554041028022766
5x5@112,16,112,112,5,64-128-32/4x2,64,128,32,4,2,input,0.65,5.589952392578125,2.486886444091797,0.4448850847806286,0.26523882150650024,1.88165283203125,0.5819388031959534
5x5@112,16,112,112,5,64-128-32/4x2,64,128,32,4,2,input,0.5,4.444221496582031,2.486886444091797,0.5595775201583484,0.32041919231414795,2.25018310546875,0.7029388546943665
5x5@112,16,112,112,5,64-128-32/4x2,64,128,32,4,2,input,0.35,3.85322998046875,2.486886444091797,0.6454030661801464,0.36772656440734863,2.65966796875,0.8067489266395569
5x5@112,16,112,112,5,64-128-32/4x2,64,128,32,4,2,input,0.25,3.260906982421875,2.486886444091797,0.7626364252330764,0.39347755908966064,2.69482421875,0.8632180690765381
5x5@112,16,112,112,5,128-64-32/8x2,128,64,32,8,2,dense,1.0,8.672481079101562,2.486886444091797,0.2867560530151574,8.079518738668412e-05,0.001953125,0.0003583681827876717
5x5@112,16,112,112,5,128-64-32/8x2,128,64,32,8,2,channel,1.0,8.663469848632813,2.486886444091797,0.2870543197520626,8.079518738668412e-05,0.001953125,0.0003583681827876717
5x5@112,16,112,112,5,128-64-32/8x2,128,64,32,8,2,channel,0.85,9.533992919921875,2.486886444091797,0.2608441672843381,0.06647877395153046,2.896484375,0.37810343503952026
5x5@112,16,112,112,5,128-64-32/8x2,128,64,32,8,2,channel,0.75,8.971939697265626,2.486886444091797,0.2771849263375816,0.11237408965826035,2.896484375,0.4927797019481659
5x5@112,16,112,112,5,128-64-32/8x2,128,64,32,8,2,channel,0.65,9.276600341796875,2.486886444091797,0.26808166272797385,0.15832528471946716,2.90625,0.5855605602264404
5x5@112,16,112,112,5,128-64-32/8x2,128,64,32,8,2,channel,0.5,6.601611328125,2.486886444091797,0.37670900640527805,0.225979745388031,2.90625,0.7009423971176147
5x5@112,16,112,112,5,128-64-32/8x2,128,64,32,8,2,channel,0.35,6.482022705078125,2.486886444091797,0.38365901466891317,0.29383358359336853,2.982421875,0.8004061579704285
5x5@112,16,112,112,5,128-64-32/8x2,128,64,32,8,2,channel,0.25,6.26028564453125,2.486886444091797,0.3972480786502525,0.34042084217071533,3.080078125,0.8622490763664246
5x5@112,16,112,112,5,128-64-32/8x2,128,64,32,8,2,block,1.0,8.66977783203125,2.486886444091797,0.2868454638945623,8.079518738668412e-05,0.001953125,0.0003583681827876717
5x5@112,16,112,112,5,128-64-32/8x2,128,64,32,8,2,block,0.85,9.482401123046875,2.486886444091797,0.26226336682250717,0.07052034884691238,2.90625,0.3908939063549042
5x5@112,16,112,112,5,128-64-32/8x2,128,64,32,8,2,block,0.75,9.009049682617187,2.486886444091797,0.27604314902272137,0.11305427551269531,2.90625,0.49570026993751526
5x5@112,16,112,112,5,128-64-32/8x2,128,64,32,8,2,block,0.65,9.254170532226562,2.486886444091797,0.2687314260561232,0.1557004451751709,3.0,0.5823708772659302
5x5@112,16,112,112,5,128-64-32/8x2,128,64,32,8,2,block,0.5,6.583702392578125,2.486886444091797,0.37773372728622867,0.22683531045913696,3.0,0.7035990953445435
5x5@112,16,112,112,5,128-64-32/8x2,128,64,32,8,2,block,0.35,6.4150732421875,2.486886444091797,0.387662985316717,0.29823169112205505,3.080078125,0.8075203895568848
5x5@112,16,112,112,5,128-64-32/8x2,128,64,32,8,2,block,0.25,6.244929809570312,2.486886444091797,0.39822488321336463,0.3411329686641693,3.080078125,0.86406010389328
5x5@112,16,112,112,5,128-64-32/8x2,128,64,32,8,2,input,1.0,8.6696142578125,2.486886444091797,0.28685087596034325,8.079518738668412e-05,0.001953125,0.0003583681827876717
5x5@112,16,112,112,5,128-64-32/8x2,128,64,32,8,2,input,0.85,7.69486572265625,2.486886444091797,0.32318776359795004,0.17808641493320465,1.27197265625,0.3908116817474365
5x5@112,16,112,112,5,128-64-32/8x2,128,64,32,8,2,input,0.75,7.470242919921875,2.486886444091797,0.33290569941971915,0.22585417330265045,1.659637451171875,0.49554041028022766
5x5@112,16,112,112,5,128-64-32/8x2,128,64,32,8,2,input,0.65,6.482723388671875,2.486886444091797,0.38361754697685607,0.26523882150650024,1.88165283203125,0.5819388031959534
5x5@112,16,112,112,5,128-64-32/8x2,128,64,32,8,2,input,0.5,5.247545166015625,2.486886444091797,0.4739142523627003,0.32041919231414795,2.25018310546875,0.7029388546943665
5x5@112,16,112,112,5,128-64-32/8x2,128,64,32,8,2,input,0.35,4.183121948242188,2.486886444091797,0.594504887703985,0.36772656440734863,2.65966796875,0.8067489266395569
5x5@112,16,112,112,5,128-64-32/8x2,128,64,32,8,2,input,0.25,3.68795654296875,2.486886444091797,0.674326395963953,0.39347755908966064,2.69482421875,0.8632180690765381
5x5@112,16,112,112,5,128-128-32/8x2,128,128,32,8,2,dense,1.0,6.836039428710937,2.486886444091797,0.3637905354446947,8.079518738668412e-05,0.001953125,0.0003583681827876717
5x5@112,16,112,112,5,128-128-32/8x2,128,128,32,8,2,channel,1.0,6.80910400390625,2.486886444091797,0.36522961650536084,8.079518738668412e-05,0.001953125,0.0003583681827876717
5x5@112,16,112,112,5,128-128-32/8x2,128,128,32,8,2,channel,0.85,9.399276123046874,2.486886444091797,0.2645827627080761,0.06647877395153046,2.896484375,0.37810343503952026
5x5@112,16,112,112,5,128-128-32/8x2,128,128,32,8,2,channel,0.75,7.187906494140625,2.486886444091797,0.34598202496360175,0.11237408965826035,2.896484375,0.4927797019481659
5x5@112,16,112,112,5,128-128-32/8x2,128,128,32,8,2,channel,0.65,8.916195678710938,2.486886444091797,0.27891788535212353,0.15832528471946716,2.90625,0.5855605602264404
5x5@112,16,112,112,5,128-128-32/8x2,128,128,32,8,2,channel,0.5,6.697984008789063,2.486886444091797,0.3712887998580642,0.225979745388031,2.90625,0.7009423971176147
5x5@112,16,112,112,5,128-128-32/8x2,128,128,32,8,2,channel,0.35,8.334827270507812,2.486886444091797,0.29837288324995836,0.29383358359336853,2.982421875,0.8004061579704285
5x5@112,16,112,112,5,128-128-32/8x2,128,128,32,8,2,channel,0.25,6.369625854492187,2.486886444091797,0.3904289672427018,0.34042084217071533,3.080078125,0.8622490763664246
5x5@112,16,112,112,5,128-128-32/8x2,128,128,32,8,2,block,1.0,6.8098046875,2.486886444091797,0.365192036807854,8.079518738668412e-05,0.001953125,0.0003583681827876717
5x5@112,16,112,112,5,128-128-32/8x2,128,128,32,8,2,block,0.85,9.383218994140625,2.486886444091797,0.2650355326508674,0.07052034884691238,2.90625,0.3908939063549042
5x5@112,16,112,112,5,128-128-32/8x2,128,128,32,8,2,block,0.75,7.176458129882812,2.486886444091797,0.3465339585465409,0.11305427551269531,2.90625,0.49570026993751526
5x5@112,16,112,112,5,128-128-32/8x2,128,128,32,8,2,block,0.65,8.842445068359375,2.486886444091797,0.2812442061970551,0.1557004451751709,3.0,0.5823708772659302
5x5@112,16,112,112,5,128-128-32/8x2,128,128,32,8,2,block,0.5,6.671421508789063,2.486886444091797,0.3727670993079246,0.22683531045913696,3.0,0.7035990953445435
5x5@112,16,112,112,5,128-128-32/8x2,128,128,32,8,2,block,0.35,8.234700927734375,2.486886444091797,0.30200082139182405,0.29823169112205505,3.080078125,0.8075203895568848
5x5@112,16,112,112,5,128-128-32/8x2,128,128,32,8,2,block,0.25,6.332493896484375,2.486886444091797,0.392718332578646,0.3411329686641693,3.080078125,0.86406010389328
5x5@112,16,112,112,5,128-128-32/8x2,128,128,32,8,2,input,1.0,6.8014453125,2.486886444091797,0.3656408792291964,8.079518738668412e-05,0.001953125,0.0003583681827876717
5x5@112,16,112,112,5,128-128-32/8x2,128,128,32,8,2,input,0.85,7.238430786132812,2.486886444091797,0.34356706827343103,0.17808641493320465,1.27197265625,0.3908116817474365
5x5@112,16,112,112,5,128-128-32/8x2,128,128,32,8,2,input,0.75,5.8189208984375,2.486886444091797,0.42737931783186417,0.22585417330265045,1.659637451171875,0.49554041028022766
5x5@112,16,112,112,5,128-128-32/8x2,128,128,32,8,2,input,0.65,6.075391845703125,2.486886444091797,0.4093376208895348,0.26523882150650024,1.88165283203125,0.5819388031959534
5x5@112,16,112,112,5,128-128-32/8x2,128,128,32,8,2,input,0.5,4.467343444824219,2.486886444091797,0.5566812748576689,0.32041919231414795,2.25018310546875,0.7029388546943665
5x5@112,16,112,112,5,128-128-32/8x2,128,128,32,8,2,input,0.35,4.1038232421875,2.486886444091797,0.6059925823623408,0.36772656440734863,2.65966796875,0.8067489266395569
5x5@112,16,112,112,5,128-128-32/8x2,128,128,32,8,2,input,0.25,3.2747705078125,2.486886444091797,0.759407854125632,0.39347755908966064,2.69482421875,0.8632180690765381
5x5@112,16,112,112,5,128-128-64/8x2,128,128,64,8,2,dense,1.0,7.175413818359375,2.486886444091797,0.34658439318562007,8.079518738668412e-05,0.001953125,0.0003583681827876717
5x5@112,16,112,112,5,128-128-64/8x2,128,128,64,8,2,channel,1.0,7.183749389648438,2.486886444091797,0.3461822384387913,8.079518738668412e-05,0.001953125,0.0003583681827876717
5x5@112,16,112,112,5,128-128-64/8x2,128,128,64,8,2,channel,0.85,8.544727172851562,2.486886444091797,0.29104339948888835,0.06647877395153046,2.896484375,0.37810343503952026
5x5@112,16,112,112,5,128-128-64/8x2,128,128,64,8,2,channel,0.75,7.507128295898437,2.486886444091797,0.3312700071278283,0.11237408965826035,2.896484375,0.4927797019481659
5x5@112,16,112,112,5,128-128-64/8x2,128,128,64,8,2,channel,0.65,8.289320068359375,2.486886444091797,0.3000109084440266,0.15832528471946716,2.90625,0.5855605602264404
5x5@112,16,112,112,5,128-128-64/8x2,128,128,64,8,2,channel,0.5,7.039794921875,2.486886444091797,0.3532612059996532,0.225979745388031,2.90625,0.7009423971176147
5x5@112,16,112,112,5,128-128-64/8x2,128,128,64,8,2,channel,0.35,7.59572509765625,2.486886444091797,0.32740606224139873,0.29383358359336853,2.982421875,0.8004061579704285
5x5@112,16,112,112,5,128-128-64/8x2,128,128,64,8,2,channel,0.25,6.764503173828125,2.486886444091797,0.3676377082227657,0.34042084217071533,3.080078125,0.8622490763664246
5x5@112,16,112,112,5,128-128-64/8x2,128,128,64,8,2,block,1.0,7.340298461914062,2.486886444091797,0.3387990906630402,8.079518738668412e-05,0.001953125,0.0003583681827876717
5x5@112,16,112,112,5,128-128-64/8x2,128,128,64,8,2,block,0.85,8.2431787109375,2.486886444091797,0.30169022549420893,0.07052034884691238,2.90625,0.3908939063549042
5x5@112,16,112,112,5,128-128-64/8x2,128,128,64,8,2,block,0.75,7.020789794921875,2.486886444091797,0.3542174764854173,0.11305427551269531,2.90625,0.49570026993751526
5x5@112,16,112,112,5,128-128-64/8x2,128,128,64,8,2,block,0.65,7.550587158203125,2.486886444091797,0.32936331863807283,0.1557004451751709,3.0,0.5823708772659302
5x5@112,16,112,112,5,128-128-64/8x2,128,128,64,8,2,block,0.5,6.591963500976562,2.486886444091797,0.37726034795601926,0.22683531045913696,3.0,0.7035990953445435
5x5@112,16,112,112,5,128-128-64/8x2,128,128,64,8,2,block,0.35,7.0546417236328125,2.486886444091797,0.3525177523559858,0.29823169112205505,3.080078125,0.8075203895568848
5x5@112,16,112,112,5,128-128-64/8x2,128,128,64,8,2,block,0.25,6.287830810546875,2.486886444091797,0.39550784984869897,0.3411329686641693,3.080078125,0.86406010389328
5x5@112,16,112,112,5,128-128-64/8x2,128,128,64,8,2,input,1.0,6.724033813476563,2.486886444091797,0.3698503774783947,8.079518738668412e-05,0.001953125,0.0003583681827876717
5x5@112,16,112,112,5,128-128-64/8x2,128,128,64,8,2,input,0.85,6.57459228515625,2.486886444091797,0.37825713538260786,0.17808641493320465,1.27197265625,0.3908116817474365
5x5@112,16,112,112,5,128-128-64/8x2,128,128,64,8,2,input,0.75,5.6504931640625,2.486886444091797,0.4401184767213869,0.22585417330265045,1.659637451171875,0.49554041028022766
5x5@112,16,112,112,5,128-128-64/8x2,128,128,64,8,2,input,0.65,5.56471923828125,2.486886444091797,0.4469024109938582,0.26523882150650024,1.88165283203125,0.5819388031959534
5x5@112,16,112,112,5,128-128-64/8x2,128,128,64,8,2,input,0.5,4.409466857910156,2.486886444091797,0.5639880113013126,0.32041919231414795,2.25018310546875,0.7029388546943665
5x5@112,16,112,112,5,128-128-64/8x2,128,128,64,8,2,input,0.35,3.7695693969726562,2.486886444091797,0.6597269295768946,0.36772656440734863,2.65966796875,0.8067489266395569
5x5@112,16,112,112,5,128-128-64/8x2,128,128,64,8,2,input,0.25,3.1954534912109374,2.486886444091797,0.7782577499350102,0.39347755908966064,2.69482421875,0.8632180690765381
5x5@112,16,112,112,5,128-64-32/8x3,128,64,32,8,3,dense,1.0,8.371036376953125,2.486886444091797,0.297082264621214,8.079518738668412e-05,0.001953125,0.0003583681827876717
5x5@112,16,112,112,5,128-64-32/8x3,128,64,32,8,3,channel,1.0,8.222125854492187,2.486886444091797,0.30246270710306356,8.079518738668412e-05,0.001953125,0.0003583681827876717
5x5@112,16,112,112,5,128-64-32/8x3,128,64,32,8,3,channel,0.85,8.33509521484375,2.486886444091797,0.29836329159899294,0.06647877395153046,2.896484375,0.37810343503952026
5x5@112,16,112,112,5,128-64-32/8x3,128,64,32,8,3,channel,0.75,8.460718383789063,2.486886444091797,0.29393324907926616,0.11237408965826035,2.896484375,0.4927797019481659
5x5@112,16,112,112,5,128-64-32/8x3,128,64,32,8,3,channel,0.65,8.021094360351562,2.486886444091797,0.3100432849144038,0.15832528471946716,2.90625,0.5855605602264404
5x5@112,16,112,112,5,128-64-32/8x3,128,64,32,8,3,channel,0.5,6.201589965820313,2.486886444091797,0.4010078798821142,0.225979745388031,2.90625,0.7009423971176147
5x5@112,16,112,112,5,128-64-32/8x3,128,64,32,8,3,channel,0.35,5.896724243164062,2.486886444091797,0.421740332689762,0.29383358359336853,2.982421875,0.8004061579704285
5x5@112,16,112,112,5,128-64-32/8x3,128,64,32,8,3,channel,0.25,5.813165893554688,2.486886444091797,0.4278024211985963,0.34042084217071533,3.080078125,0.8622490763664246
5x5@112,16,112,112,5,128-64-32/8x3,128,64,32,8,3,block,1.0,8.214364013671876,2.486886444091797,0.30274850736498365,8.079518738668412e-05,0.001953125,0.0003583681827876717
5x5@112,16,112,112,5,128-64-32/8x3,128,64,32,8,3,block,0.85,8.2874951171875,2.486886444091797,0.3000769724659293,0.07052034884691238,2.90625,0.3908939063549042
5x5@112,16,112,112,5,128-64-32/8x3,128,64,32,8,3,block,0.75,8.493035278320313,2.486886444091797,0.29281480208141014,0.11305427551269531,2.90625,0.49570026993751526
5x5@112,16,112,112,5,128-64-32/8x3,128,64,32,8,3,block,0.65,7.989288940429687,2.486886444091797,0.31127756958531594,0.1557004451751709,3.0,0.5823708772659302
5x5@112,16,112,112,5,128-64-32/8x3,128,64,32,8,3,block,0.5,6.228418579101563,2.486886444091797,0.3992805577383859,0.22683531045913696,3.0,0.7035990953445435
5x5@112,16,112,112,5,128-64-32/8x3,128,64,32,8,3,block,0.35,5.86919921875,2.486886444091797,0.423718185633754,0.29823169112205505,3.080078125,0.8075203895568848
5x5@112,16,112,112,5,128-64-32/8x3,128,64,32,8,3,block,0.25,5.82389892578125,2.486886444091797,0.42701401171006625,0.3411329686641693,3.080078125,0.86406010389328
5x5@112,16,112,112,5,128-64-32/8x3,128,64,32,8,3,input,1.0,8.232919311523437,2.486886444091797,0.3020661748270697,8.079518738668412e-05,0.001953125,0.0003583681827876717
5x5@112,16,112,112,5,128-64-32/8x3,128,64,32,8,3,input,0.85,7.1950732421875,2.486886444091797,0.345637404982929,0.17808641493320465,1.27197265625,0.3908116817474365
5x5@112,16,112,112,5,128-64-32/8x3,128,64,32,8,3,input,0.75,7.001251831054687,2.486886444091797,0.35520596946120214,0.22585417330265045,1.659637451171875,0.49554041028022766
5x5@112,16,112,112,5,128-64-32/8x3,128,64,32,8,3,input,0.65,6.073789672851563,2.486886444091797,0.4094455978954301,0.26523882150650024,1.88165283203125,0.5819388031959534
5x5@112,16,112,112,5,128-64-32/8x3,128,64,32,8,3,input,0.5,4.953477172851563,2.486886444091797,0.5020486331746178,0.32041919231414795,2.25018310546875,0.7029388546943665
5x5@112,16,112,112,5,128-64-32/8x3,128,64,32,8,3,input,0.35,3.9341055297851564,2.486886444091797,0.6321351639562163,0.36772656440734863,2.65966796875,0.8067489266395569
5x5@112,16,112,112,5,128-64-32/8x3,128,64,32,8,3,input,0.25,3.457331237792969,2.486886444091797,0.7193081232446019,0.39347755908966064,2.69482421875,0.8632180690765381
5x5@112,16,112,112,5,64-128-32/4x3,64,128,32,4,3,dense,1.0,6.266326904296875,2.486886444091797,0.3968650984975771,8.079518738668412e-05,0.001953125,0.0003583681827876717
5x5@112,16,112,112,5,64-128-32/4x3,64,128,32,4,3,channel,1.0,6.276137084960937,2.486886444091797,0.396244761774077,8.079518738668412e-05,0.001953125,0.0003583681827876717
5x5@112,16,112,112,5,64-128-32/4x3,64,128,32,4,3,channel,0.85,7.165501708984375,2.486886444091797,0.3470638268041504,0.06647877395153046,2.896484375,0.37810343503952026
5x5@112,16,112,112,5,64-128-32/4x3,64,128,32,4,3,channel,0.75,6.546079711914063,2.486886444091797,0.3799046992302261,0.11237408965826035,2.896484375,0.4927797019481659
5x5@112,16,112,112,5,64-128-32/4x3,64,128,32,4,3,channel,0.65,6.843633422851562,2.486886444091797,0.36338685759933304,0.15832528471946716,2.90625,0.5855605602264404
5x5@112,16,112,112,5,64-128-32/4x3,64,128,32,4,3,channel,0.5,6.15715087890625,2.486886444091797,0.4039021445148612,0.225979745388031,2.90625,0.7009423971176147
5x5@112,16,112,112,5,64-128-32/4x3,64,128,32,4,3,channel,0.35,6.383184204101562,2.486886444091797,0.3895996675912673,0.29383358359336853,2.982421875,0.8004061579704285
5x5@112,16,112,112,5,64-128-32/4x3,64,128,32,4,3,channel,0.25,5.845135498046875,2.486886444091797,0.4254625825051923,0.34042084217071533,3.080078125,0.8622490763664246
5x5@112,16,112,112,5,64-128-32/4x3,64,128,32,4,3,block,1.0,6.25817626953125,2.486886444091797,0.3973819747135485,8.079518738668412e-05,0.001953125,0.0003583681827876717
5x5@112,16,112,112,5,64-128-32/4x3,64,128,32,4,3,block,0.85,7.153047485351562,2.486886444091797,0.3476681021878565,0.07052034884691238,2.90625,0.3908939063549042
5x5@112,16,112,112,5,64-128-32/4x3,64,128,32,4,3,block,0.75,6.54434326171875,2.486886444091797,0.3800055016427519,0.11305427551269531,2.90625,0.49570026993751526
5x5@112,16,112,112,5,64-128-32/4x3,64,128,32,4,3,block,0.65,6.814187622070312,2.486886444091797,0.36495714265880774,0.1557004451751709,3.0,0.5823708772659302
5x5@112,16,112,112,5,64-128-32/4x3,64,128,32,4,3,block,0.5,6.171504516601562,2.486886444091797,0.40296275201646303,0.22683531045913696,3.0,0.7035990953445435
5x5@112,16,112,112,5,64-128-32/4x3,64,128,32,4,3,block,0.35,6.351011962890625,2.486886444091797,0.39157325771433527,0.29823169112205505,3.080078125,0.8075203895568848
5x5@112,16,112,112,5,64-128-32/4x3,64,128,32,4,3,block,0.25,5.8706903076171875,2.486886444091797,0.4236105660121563,0.3411329686641693,3.080078125,0.86406010389328
5x5@112,16,112,112,5,64-128-32/4x3,64,128,32,4,3,input,1.0,6.279188232421875,2.486886444091797,0.3960522207713158,8.079518738668412e-05,0.001953125,0.0003583681827876717
5x5@112,16,112,112,5,64-128-32/4x3,64,128,32,4,3,input,0.85,6.213855590820312,2.486886444091797,0.4002163242682462,0.17808641493320465,1.27197265625,0.3908116817474365
5x5@112,16,112,112,5,64-128-32/4x3,64,128,32,4,3,input,0.75,5.501337890625,2.486886444091797,0.4520512089122497,0.22585417330265045,1.659637451171875,0.49554041028022766
5x5@112,16,112,112,5,64-128-32/4x3,64,128,32,4,3,input,0.65,5.264671020507812,2.486886444091797,0.47237262013228704,0.26523882150650024,1.88165283203125,0.5819388031959534
5x5@112,16,112,112,5,64-128-32/4x3,64,128,32,4,3,input,0.5,4.12037109375,2.486886444091797,0.6035588512559074,0.32041919231414795,2.25018310546875,0.7029388546943665
5x5@112,16,112,112,5,64-128-32/4x3,64,128,32,4,3,input,0.35,3.6234036254882813,2.486886444091797,0.686339889544232,0.36772656440734863,2.65966796875,0.8067489266395569
5x5@112,16,112,112,5,64-128-32/4x3,64,128,32,4,3,input,0.25,3.1343820190429685,2.486886444091797,0.7934216151645505,0.39347755908966064,2.69482421875,0.8632180690765381
5x5@112,16,112,112,5,64-64-32/2x2,64,64,32,2,2,dense,1.0,8.481360473632812,2.486886444091797,0.29321786897551727,8.079518738668412e-05,0.001953125,0.0003583681827876717
5x5@112,16,112,112,5,64-64-32/2x2,64,64,32,2,2,channel,1.0,8.624148559570312,2.486886444091797,0.2883631267381256,8.079518738668412e-05,0.001953125,0.0003583681827876717
5x5@112,16,112,112,5,64-64-32/2x2,64,64,32,2,2,channel,0.85,9.050972290039063,2.486886444091797,0.27476456278942646,0.06647877395153046,2.896484375,0.37810343503952026
5x5@112,16,112,112,5,64-64-32/2x2,64,64,32,2,2,channel,0.75,8.6542333984375,2.486886444091797,0.28736068575881,0.11237408965826035,2.896484375,0.4927797019481659
5x5@112,16,112,112,5,64-64-32/2x2,64,64,32,2,2,channel,0.65,8.700354614257812,2.486886444091797,0.28583736575706714,0.15832528471946716,2.90625,0.5855605602264404
5x5@112,16,112,112,5,64-64-32/2x2,64,64,32,2,2,channel,0.5,6.3280126953125,2.486886444091797,0.39299643724387084,0.225979745388031,2.90625,0.7009423971176147
5x5@112,16,112,112,5,64-64-32/2x2,64,64,32,2,2,channel,0.35,6.132899780273437,2.486886444091797,0.4054992798171762,0.29383358359336853,2.982421875,0.8004061579704285
5x5@112,16,112,112,5,64-64-32/2x2,64,64,32,2,2,channel,0.25,5.976412353515625,2.486886444091797,0.41611694391015136,0.34042084217071533,3.080078125,0.8622490763664246
5x5@112,16,112,112,5,64-64-32/2x2,64,64,32,2,2,block,1.0,8.370503540039062,2.486886444091797,0.29710117583681134,8.079518738668412e-05,0.001953125,0.0003583681827876717
5x5@112,16,112,112,5,64-64-32/2x2,64,64,32,2,2,block,0.85,9.044847412109375,2.486886444091797,0.2749506244585527,0.07052034884691238,2.90625,0.3908939063549042
5x5@112,16,112,112,5,64-64-32/2x2,64,64,32,2,2,block,0.75,8.637808837890624,2.486886444091797,0.2879070943527735,0.11305427551269531,2.90625,0.49570026993751526
5x5@112,16,112,112,5,64-64-32/2x2,64,64,32,2,2,block,0.65,8.660564575195313,2.486886444091797,0.28715061500891964,0.1557004451751709,3.0,0.5823708772659302
5x5@112,16,112,112,5,64-64-32/2x2,64,64,32,2,2,block,0.5,6.306078491210937,2.486886444091797,0.3943633824979948,0.22683531045913696,3.0,0.7035990953445435
5x5@112,16,112,112,5,64-64-32/2x2,64,64,32,2,2,block,0.35,6.174470825195312,2.486886444091797,0.40276916265340534,0.29823169112205505,3.080078125,0.8075203895568848
5x5@112,16,112,112,5,64-64-32/2x2,64,64,32,2,2,block,0.25,5.955686645507813,2.486886444091797,0.41756502517935146,0.3411329686641693,3.080078125,0.86406010389328
